'Nothing finalised' on lifting of Victoria's lockdown as state records 11 new local COVID-19 cases,Health Minister Martin Foley says a decision on easing restrictions has not been finalised yet.,None found,"Mon, 26 Jul 2021 02:10:38 +0000"
SA lockdown looks set to end as planned after state records one new local COVID-19 case,South Australia looks set to end its lockdown on Wednesday morning as scheduled after no major escalation in COVID-19 case numbers.,None found,"Mon, 26 Jul 2021 02:30:27 +0000"
The Australian government is being sued by the parents of an asylum seeker murdered on Manus Island,It is thought to be the first time civil proceedings have been launched in Australia on behalf of the family of a person killed in offshore detention. ,None found,"Mon, 26 Jul 2021 04:57:49 +0000"
Barnaby Joyce defends George Christensen and his support for anti-lockdown protests,The Nationals leader defended his colleague for attending an anti-lockdown rally in Queensland and supporting two other illegal protests in Sydney and Melbourne.,None found,"Mon, 26 Jul 2021 00:07:35 +0000"
French parliament passes vaccine passports law despite protests,"France has passed a law requiring people to have special COVID-19 passes for cafes, cinemas and domestic travel.",None found,"Mon, 26 Jul 2021 05:44:07 +0000"
SBS is now interpreting NSW COVID-19 press conferences live in languages other than English,"SBS and the New South Wales government have teamed up for the new initiative, providing live interpreting of critical health information in languages other than English.",None found,"Mon, 26 Jul 2021 00:58:48 +0000"
The Afghan women risking their lives to take on the Taliban,"As troubling reports emerge about the treatment of women in Afghan districts that have fallen to the Taliban, SBS News meets those on the ground who are speaking up for women&rsquo;s rights at great personal cost.",None found,"Mon, 26 Jul 2021 07:31:13 +0000"
"NSW records two more COVID-19 related deaths, taking toll from current outbreak to 10",The new deaths come amid concerns an anti-lockdown protest that took place in Sydney's CBD over the weekend could be a &quot;super-spreader event&quot;.,None found,"Mon, 26 Jul 2021 07:50:49 +0000"
Indonesia loosens coronavirus curbs despite warnings of another wave,The Indonesian government has been widely criticised over its handling of the pandemic and policies that critics say prioritised Southeast Asia's largest economy over public healt,None found,"Mon, 26 Jul 2021 12:01:16 +0000"
UN warns of 'unprecedented' Afghan civilian deaths from Taliban offensives,Violence has surged in Afghanistan since early May when insurgents cranked up operations to coincide with a final withdrawal of US-led foreign forces.,None found,"Mon, 26 Jul 2021 09:54:46 +0000"
Not declaring the Great Barrier Reef as 'in danger' only postpones the inevitable,"Opinion: Dangerous impacts are already occurring on the Great Barrier Reef. Some, such as coral bleaching and death from marine heatwaves, will continue to accelerate.",None found,"Mon, 26 Jul 2021 11:31:27 +0000"
NSW records 172 local COVID-19 cases as apartment block in Sydney's west is locked down for two weeks,"NSW Premier Gladys Berejiklian says the virus is becoming more prevalent in western Sydney, rather than just the southwest.  ",None found,"Tue, 27 Jul 2021 02:58:12 +0000"
Victoria is updating its coronavirus restrictions. Here's what's changing,"At 11:59pm on Tuesday, Victoria's fifth lockdown will end and the state will move to a lighter set of restrictions for at least two weeks.",None found,"Tue, 27 Jul 2021 02:53:29 +0000"
End of South Australia's COVID-19 lockdown confirmed after reporting no new cases,South Australia will lift its COVID-19 lockdown on Wednesday morning as scheduled.,None found,"Tue, 27 Jul 2021 02:11:47 +0000"
'F**k yeah!': Australia's Kaylee McKeown gives excited interview after winning Olympic backstroke gold,"Kaylee McKeown has won the final of the women's 100-metre backstroke in Tokyo, claiming an Olympic record and Australia's third gold of the Games - but her post-swim interview with Channel 7 will also go down in history after she accidentally swore on live television.",None found,"Tue, 27 Jul 2021 03:33:20 +0000"
Blacktown apartment block resident speaks out after building plunged into isolation,"Along with 100-or so residents, Michelle Hinwood will be locked up in her Western Sydney unit after six cases of COVID-19 were detected in the building. She told The Feed the heavy police presence on Monday night was &ldquo;a little bit scary&rdquo;.",None found,"Tue, 27 Jul 2021 04:47:55 +0000"
Australian visas for pharmacists to be fast-tracked to support troubled vaccine rollout,The decision comes as thousands of pharmacies across Australia are invited to help accelerate the nation&rsquo;s vaccine rollout. ,None found,"Tue, 27 Jul 2021 03:45:59 +0000"
Calls for the Senate to address sexual assault allegations against US marines in the Northern Territory,"After an SBS News investigation revealed women&rsquo;s claims made against US marines stationed in the Northern Territory were shifted overseas or dropped, there are calls for the Senate to look into the issue and for a legal agreement covering US military personnel in Australia to be revised.",None found,"Mon, 26 Jul 2021 21:27:40 +0000"
Tunisia president accused of staging coup after sacking PM and suspending parliament,Tunisia is facing its biggest crisis in a decade of democracy after President Kais Saied suspended parliament and removed Hichem Mechichi as prime minister.,None found,"Mon, 26 Jul 2021 19:59:58 +0000"
Children continue to be jailed in Australia a year since governments failed to raise the age,"Human rights groups and Indigenous advocates are urging state and territory leaders to take action to raise the age of criminal responsibility from 10 to 14, one year after the deferral of a decision to do so.",None found,"Mon, 26 Jul 2021 20:50:45 +0000"
Joe Biden launches push to get US long COVID sufferers access to disability 'rights and resources',The US president says the new effort will be aimed at making sure people with long-term COVID-19 symptoms &quot;have access to the rights and resources that are due under the disability law&quot;.,None found,"Mon, 26 Jul 2021 23:49:54 +0000"
Greater Sydney lockdown to be extended by four weeks as NSW records 172 local COVID-19 cases,"SBS News understands the Greater Sydney lockdown, which is due to lift on 30 July, will be extended by four weeks to 27 August.",None found,"Tue, 27 Jul 2021 10:53:02 +0000"
Victoria has updated its coronavirus restrictions. Here's what's changed,"At 11:59pm on Tuesday, Victoria's fifth lockdown ended and the state moved to a lighter set of restrictions for at least two weeks.",None found,"Tue, 27 Jul 2021 19:34:53 +0000"
Here's where you can now get your COVID-19 vaccination around Australia,"As Greater Sydney's COVID-19 cluster continues to grow, NSW is ramping up its vaccination rollout to younger people.",None found,"Tue, 27 Jul 2021 11:03:54 +0000"
"First person charged under Hong Kong security law found guilty of terrorism, inciting secession","Tong Ying-kit was charged after he drove a motorbike into three police officers while flying a protest flag during a rally last year, the day after the national security law was enacted.",None found,"Tue, 27 Jul 2021 08:14:50 +0000"
Australia's Filipino community celebrates as weightlifter Hidilyn Diaz secures the Philippines' first gold medal,"Hidilyn Diaz wins Philippines' first Olympic gold medal with weightlifting, in an inspirational effort to secure the win",None found,"Tue, 27 Jul 2021 10:59:32 +0000"
Greater Sydney lockdown extended by four weeks as NSW records 177 new local COVID-19 cases,"A woman in her 90s has also died at Liverpool Hospital overnight, taking the NSW toll linked to the current outbreak to 11. ",None found,"Wed, 28 Jul 2021 02:59:54 +0000"
More financial support is on the way for people affected by NSW's COVID-19 lockdown,"Prime Minister Scott Morrison has announced additional financial support for people locked down in NSW who have lost work, with COVID-19 disaster payments now extended to those on welfare support",None found,"Wed, 28 Jul 2021 06:10:21 +0000"
New South Wales has updated its coronavirus restrictions. Here's what you need to know,"The updated restrictions for Greater Sydney apply to shopping and construction, with a support bubble for single people living alone and a pathway for year 12 students to return to classrooms also announced",None found,"Wed, 28 Jul 2021 05:17:20 +0000"
Victoria records nine new local COVID-19 cases as fifth lockdown lifts,The ninth case - which was found after the Tuesday midnight deadline - is a Victorian traffic controller working at a drive-through testing centre who worked at least two days while infectious.,None found,"Wed, 28 Jul 2021 01:48:32 +0000"
Sydney singles grateful for the chance to connect after bubble announcement,Single Sydney residents who live alone are relieved to be able to see one other person within a newly announced 'singles bubble'.,None found,"Wed, 28 Jul 2021 07:30:29 +0000"
Here's where you can now get your COVID-19 vaccination across Australia,"As Greater Sydney's COVID-19 cluster continues to grow, NSW is ramping up its vaccination rollout to younger people.",None found,"Tue, 27 Jul 2021 11:03:54 +0000"
'I need my mum': Migrant mothers with postnatal depression write open letter to Jenny Morrison,A group of new mothers say Australia's current border restrictions - which prevent their parents overseas from entering the country - are worsening their mental health. They're now pleading for help from someone they think will understand their situation: the prime minister's wife Jenny Morrison.,None found,"Wed, 28 Jul 2021 01:24:45 +0000"
Queensland's new local COVID-19 case was infectious in the community for six days,The man completed hotel quarantine in Brisbane on 17 July and then stayed at a backpacker hotel in the CBD before becoming unwell and getting tested on Monday.,None found,"Wed, 28 Jul 2021 00:23:45 +0000"
Australia's Ariarne Titmus surges to second Tokyo gold medal in nail-biting 200m freestyle victory,"The Australian swimmer has followed up her historic 400m freestyle gold medal at the Tokyo Olympics with another win, surging home to claim the 200m freestyle in Olympic-record time.",None found,"Wed, 28 Jul 2021 02:34:52 +0000"
Support pours in for gymnastics superstar Simone Biles after Olympic withdrawal to look after mental health,"Olympians, athletes, other US figures were quick to rally around Biles after her decision.",None found,"Tue, 27 Jul 2021 22:42:41 +0000"
'This is how I'm going to die': Police testify about defending US Capitol from Trump supporters,"United States police officers have testified to a congressional hearing about their experiences on 6 January, telling of how they were racially abused, beaten unconscious, and thought they were going to die.",None found,"Tue, 27 Jul 2021 21:01:53 +0000"
Experts say anti-lockdown protests reveal a &lsquo;much deeper-seated problem&rsquo; in Australia right now,"More anti-lockdown protests are planned in Sydney for this weekend. While police have warned the events will be 'heavily policed', experts say there are deeper issues to be addressed. ",None found,"Wed, 28 Jul 2021 10:32:46 +0000"
"Desperate to be vaccinated, southwestern Sydneysiders pay hundreds to get their COVID-19 jabs","People in the southwest Sydney suburb of Campsie, where there are high rates of COVID-19 transmission, have paid hundreds of dollars to be vaccinated.",None found,"Wed, 28 Jul 2021 19:46:19 +0000"
North and South Korea in talks to reopen joint liaison office and hold summit in effort to restore relations,The discussions signal an improvement in ties that have deteriorated in the past year after three leaders' summits in 2018 promised peace and reconciliation.,None found,"Wed, 28 Jul 2021 10:39:43 +0000"
Disability carer pleads guilty to manslaughter of Adelaide woman Ann Marie Smith,"The 54-year-old, who had cerebral palsy, died last year from septic shock, multiple organ failure, severe pressure sores and malnourishment.",None found,"Wed, 28 Jul 2021 19:34:52 +0000"
NSW reports record 239 COVID-19 cases and two new deaths as authorities further tighten restrictions,"There are currently 182 COVID-19 cases in hospital, including two teens, eight people in their 20s, four in their 30s, and three in their 40s. ",None found,"Thu, 29 Jul 2021 05:57:42 +0000"
New South Wales has new coronavirus restrictions. Here's what you need to know,"New restrictions for Greater Sydney apply to shopping and construction, with a support bubble for single people living alone and a pathway for Year 12 students to return to classrooms also announced. ",None found,"Thu, 29 Jul 2021 02:51:25 +0000"
Bridget McKenzie's comments rejected after saying she'd rather be on welfare in Australia than anywhere else,Emergency Management Minister Bridget McKenzie has declared she would rather be on welfare in Australia than anywhere else in the world during the COVID-19 pandemic.,None found,"Thu, 29 Jul 2021 07:33:14 +0000"
Australian Olympic athletes expected to compete as planned after COVID-19 scare,Three members of the Australian Olympic athletics team have returned negative tests to COVID-19 after having contact with leading US pole vaulter Sam Kendricks.,None found,"Thu, 29 Jul 2021 07:44:14 +0000"
Victoria reports six more COVID-19 cases as investigations into unlinked testing worker continue,Six new local COVID-19 cases have been reported in Victoria as authorities continue to investigate the mystery case of a Melbourne testing site worker.,None found,"Wed, 28 Jul 2021 23:02:11 +0000"
National Gallery of Australia announces it will return 14 artworks to the Indian government,"Fourteen works from the Asian Art Collection, including 13 connected to an alleged antiquities smuggler, will be repatriated this year.",None found,"Thu, 29 Jul 2021 07:06:09 +0000"
"Behind the romance of the Olympics, Tokyo's COVID-19 cases have risen to record highs","Tokyo - under its fourth state of emergency, which is due to last through the Olympics - has reported its highest daily number of coronavirus cases to date.",None found,"Thu, 29 Jul 2021 00:06:09 +0000"
Kylie Moore-Gilbert and Craig Foster join calls to stamp out hate speech against Baha&rsquo;is,"Baha&rsquo;is are the most persecuted religious minority in Iran, according to the United Nations. ",None found,"Thu, 29 Jul 2021 04:51:44 +0000"
Scott Morrison expecting everyone who wants a COVID-19 jab to be fully vaccinated by Christmas,But the Prime Minister says no one can guarantee Australia would be fully open by the end of 2021 because of the unpredictability of the Delta strain.,None found,"Thu, 29 Jul 2021 01:57:53 +0000"
Hundreds of Australian Defence Force troops to be deployed to Greater Sydney to enforce lockdown measures,The mayor of Cumberland Council fears his south-western Sydney community will find the image of troops patrolling their streets &ldquo;demoralising&rdquo,None found,"Thu, 29 Jul 2021 10:34:01 +0000"
Australians in Indonesia living through COVID-19 'disaster' as government hints at repatriation flight,The Department of Foreign Affairs says it's working with Qantas to facilitate a repatriation flight for stranded Australians in Indonesia. ,None found,"Thu, 29 Jul 2021 10:53:57 +0000"
Non-urgent elective surgery suspended in parts of Greater Sydney as NSW records 170 new COVID-19 cases,"New South Wales Premier Gladys Berejiklian has warned people against attending anti-lockdown protests over the weekend, as 170 new cases were recorded.",None found,"Fri, 30 Jul 2021 07:17:56 +0000"
'Don't give those you love a death sentence': People told not to attend Sydney protests,Authorities are determining whether a person who later tested positive for COVID-19 case attended Saturday's anti-lockdown protest. ,None found,"Fri, 30 Jul 2021 03:11:47 +0000"
"More than 38,000 Australians remain stranded overseas, DFAT reveals","The Department of Foreign Affairs says 38,523 Australians overseas are registered to return home with 4,569 considered vulnerable.",None found,"Fri, 30 Jul 2021 05:51:49 +0000"
Aboriginal communities fear their culture will be lost amid Northern Territory cotton boom,Aboriginal elders and Traditional Owners in the Northern Territory are urging farmers to reassure river communities that their water systems will remain pristine and intact as the cotton industry is set to expand.,None found,"Fri, 30 Jul 2021 03:11:43 +0000"
'Wise to be thinking now': Calls for Australia to consider the burden of long COVID,"While managing Australia's current COVID-19 outbreaks remains the key priority, experts agree the long-term burden of the virus must be considered and planned for. ",None found,"Fri, 30 Jul 2021 04:12:18 +0000"
Victoria records two new local COVID-19 cases as authorities find link in mystery case,Victorian authorities say the new local COVID-19 infections are linked to known cases and were in isolation during their entire infectious period. ,None found,"Thu, 29 Jul 2021 22:49:16 +0000"
'Equivalent to slavery': QLD mayor delivers historic apology for blackbirding practices,A mayor in Queensland's sugarcane heartland has made a historic apology for the blackbirding practices he says were &quot;equivalent to slavery and abhorrent&quot;.,None found,"Fri, 30 Jul 2021 05:31:50 +0000"
Brisbane high school closes after teenage student tests positive to COVID-19,A high school in Brisbane's inner west has closed for 48 hours as contact tracers work to identify any transmission after a student tested positive for COVID-19. ,None found,"Fri, 30 Jul 2021 04:26:45 +0000"
German cycling director apologises for use of racial slur after being sent home from Olympics,Germany's cycling director has been told to leave the Tokyo Olympics after he was caught using racist language about rival riders.,None found,"Fri, 30 Jul 2021 02:51:24 +0000"
ABC's Christian Porter defence to stay suppressed,"Most of the ABC 's defence to the Christian Porter defamation case won't be made public, after a judge agreed 27 pages should be removed from the court file.",None found,"Fri, 30 Jul 2021 01:42:30 +0000"
Calls for more migrants in Australia to sign the organ donor register,An organ from a donor of the same ethnic background as the person in need of a transplant is more likely to be a close match - and they can save lives. ,None found,"Thu, 29 Jul 2021 21:36:16 +0000"
Scott Morrison confirms greater freedoms for Australians when 70 per cent are fully vaccinated,Prime Minister Scott Morrison says national cabinet has agreed to the targets that will get Australians out of coronavirus restrictions.,None found,"Fri, 30 Jul 2021 09:46:41 +0000"
Sydney hospital allegedly instructs staff to breach COVID-19 self-isolation to come to work,It's been claimed that executives at the Royal Prince Alfred Hospital asked staff to continue to come to work despite being identified as close COVID-19 contacts.,None found,"Fri, 30 Jul 2021 10:50:54 +0000"
There&rsquo;s a faster and easier way to get tested for COVID - so why isn&rsquo;t Australia using it?,There are growing calls for Australia to introduce rapid antigen testing in an effort to keep pace with COVID-19 and curb the spread of the highly infectious Delta varian,None found,"Fri, 30 Jul 2021 11:05:49 +0000"
South-east Queensland plunges back into lockdown after state records six new local COVID-19 cases,"The lockdown affects the Brisbane City, Moreton Bay, Gold Coast, Ipswich, Lockyer Valley, Logan, Noosa, Redland, Scenic Rim, Somerset and Sunshine Coast LGAs.",None found,"Sat, 31 Jul 2021 06:16:06 +0000"
A swathe of Queensland has re-entered lockdown. These are the new rules,Eleven local government areas in south-east Queensland have plunged into a three-day lockdown after an outbreak connected to a Brisbane high school student expanded by six. ,None found,"Sat, 31 Jul 2021 06:14:50 +0000"
"NSW records 210 local cases of COVID-19, with two-thirds of the new infections under 40",New South Wales Health Minister Brad Hazzard says the majority of the cases were recorded in south-western Sydney and western Sydney. ,None found,"Sat, 31 Jul 2021 02:05:14 +0000"
Sydney anti-lockdown protest fizzles to nothing after heavy police operation,NSW Police said they arrested eight people over the operation on Saturday and issued more than 250 penalty infringement notices.,None found,"Sat, 31 Jul 2021 07:34:49 +0000"
Kaylee McKeown claims Australia&rsquo;s first-ever gold medal in women&rsquo;s 200m backstroke,Australian swimmer Kaylee McKeown has won her second gold medal of the Tokyo Olympics with victory in the women's 200-metres backstroke.,None found,"Sat, 31 Jul 2021 03:59:29 +0000"
"With zero-COVID looking less possible, experts say Greater Sydney needs a new strategy to curb Delta outbreak","With the daily number of COVID-19 cases in Greater Sydney and the number of those infectious in the community remaining stubbornly high, residents are calling out for an effective long-term strategy.",None found,"Fri, 30 Jul 2021 22:22:48 +0000"
"Mitch got a COVID-19 test in Sydney. Two weeks on, he still hasn't got the results",Some residents of Greater Sydney are reporting a blowout in turnaround times for COVID-19 test results beyond the average three days recommended by NSW Health. But health authorities insist no tests have been lost and it's vital that people keep getting tested.,None found,"Sat, 31 Jul 2021 02:11:59 +0000"
Victoria records two new local COVID-19 cases - both linked to current outbreaks,Victoria has recorded two new locally acquired COVID-19 cases as genomic testing continues to determine how a Melbourne testing site worker became infected.,None found,"Fri, 30 Jul 2021 23:30:18 +0000"
"The project addressing Australia's homelessness crisis, one box at a time","Australian social enterprise The Good Box creates unique gift boxes for people experiencing homelessness across the country. Here, SBS meets its founders and those benefitting from the support. ",None found,"Fri, 30 Jul 2021 22:50:36 +0000"
Israel blames Iran for deadly attack on oil tanker off the coast of Oman,An attack on an oil tanker linked to the wealthy Israeli Ofer family has killed two crew members off Oman in the Arabian Sea.,None found,"Sat, 31 Jul 2021 04:30:08 +0000"
Activist Tong Ying-kit jailed for nine years in Hong Kong's first national security trial,Tong Ying-kit's trial was heard without a jury - a significant departure from Hong Kong's common law tradition - and was decided by three judges handpicked to try security crimes.,None found,"Fri, 30 Jul 2021 21:09:50 +0000"
Meet the winners of this year's Young Archie portrait competition,"Among the artworks being celebrated from this year's crop of finalists are touching self-portraits and tributes to family members, including grandparents from second-generation migrant families.",None found,"Sat, 31 Jul 2021 10:14:47 +0000"
"Tokyo has reported more than 4,000 coronavirus cases in 24 hours for the first time","Malaysia and Thailand also reported record numbers of new cases on Saturday - 17,786 and 18,912 infections respectively.",None found,"Sat, 31 Jul 2021 11:23:10 +0000"
Simone Biles withdraws from two more Olympic events days after revealing mental health concerns,"The US superstar has not competed since she pulled out of the women's team final on Wednesday after one rotation, citing mental health concerns.",None found,"Sat, 31 Jul 2021 08:19:07 +0000"
When Troy went to renew his Australian passport he was told he wasn't a citizen. This is what happened next,"EXCLUSIVE: After a near five-year battle, Australian citizen Troy Lee has won a landmark legal case against the Department of Home Affairs and is now hoping for a seven-figure payout. This is how he went from doing a routine passport renewal to being threatened with statelessness and detention.",None found,"Sat, 31 Jul 2021 22:53:17 +0000"
'Make August the month we get vaccinated': NSW records 239 new local COVID-19 cases,Premier Gladys Berejiklian renewed her call for people to get any vaccine available as she said the state will be driving towards an 80 per cent target for population-wide vaccine coverage. ,None found,"Sun, 01 Aug 2021 01:59:40 +0000"
Queensland records nine new local COVID-19 cases - its highest spike in almost a year,"There are now 18 cases linked to the current cluster, with a community transmission increase not seen in Queensland since last August. ",None found,"Sun, 01 Aug 2021 00:51:02 +0000"
Emma McKeon makes Olympic history as Australia wins more gold on record day in Tokyo,McKeon's exploits were part of a stunning Sunday that's seen Australia win four Olympic gold medals on one day for the first time ever.,None found,"Sun, 01 Aug 2021 06:21:57 +0000"
Jacinda Ardern issues state apology for New Zealand's racist 1970s 'dawn raids',"Governments from both sides of the political spectrum oversaw the raids, when Pasifika people were racially profiled as authorities chased visa overstayers.",None found,"Sun, 01 Aug 2021 05:58:12 +0000"
Victoria records four new COVID-19 cases as Richmond apartment block goes into lockdown,All of the new local infections were in quarantine throughout their infectious period.,None found,"Sun, 01 Aug 2021 02:59:32 +0000"
Sky News Australia has been suspended from YouTube over COVID-19 misinformation concerns,Sky confirmed the temporary ban and said &quot;we support broad discussion and debate on a wide range of topics and perspectives which is vital to any democracy&quot;.,None found,"Sun, 01 Aug 2021 07:31:52 +0000"
