This community course helps migrants learn to drive. It has a 200-person waiting list,Migrants and refugees face additional barriers getting their Australian driving licence. A community driving program is helping reduce those challenges. ,None found,"Tue, 13 Jul 2021 22:01:41 +0000"
'It's heartbreaking': Fijians in Australia rally as COVID-19 ravages their homeland,"In a community where family connection is important, Australia&rsquo;s Fiji diaspora watched from afar as their home country was overwhelmed by the COVID-19 Delta variant.",None found,"Tue, 13 Jul 2021 20:54:41 +0000"
Singles living alone in Sydney frustrated over lockdown exemptions granted to couples,"NSW Health Minister Brad Hazard has confirmed an intimate partners&rsquo; exemption for lockdown, citing &ldquo;compassion&rdquo; and &ldquo;common sense&rdquo;. Now, singles living alone are wondering where the same empathy is for them",None found,"Wed, 14 Jul 2021 04:34:39 +0000"
New COVID-19 lockdown support 'excludes those on the lowest incomes',The federal and New South Wales governments on Tuesday unveiled a new financial relief package aimed at keeping people in jobs during extended lockdowns.,None found,"Wed, 14 Jul 2021 03:17:07 +0000"
Dozens killed in South Africa as unrest over former president Jacob Zuma's jailing escalates,"Police say at least 72 people have been killed and 1,234 arrested in the last few days of protests which have now turned into looting and riots.",None found,"Tue, 13 Jul 2021 22:00:24 +0000"
Khaled was hospitalised with COVID-19 last week. Now he's urging his community in Sydney to 'take it seriously',"Community leaders in southwest Sydney are joining together to reinforce the dangers of COVID-19, as the infection rate soars in the area.",None found,"Wed, 14 Jul 2021 10:05:53 +0000"
NSW extends Sydney lockdown by two weeks as state records 97 new local COVID-19 cases,Greater Sydney residents will remain in lockdown for some time yet as NSW records 97 new local coronavirus cases.,None found,"Wed, 14 Jul 2021 11:37:45 +0000"
Victoria records eight new local COVID-19 cases linked to NSW outbreak,"Victoria has recorded eight new locally acquired COVID-19 cases, with the latest being a private school teacher. ",None found,"Wed, 14 Jul 2021 08:00:44 +0000"
Queensland lists seven new COVID-19 exposure sites over mystery overseas case,"An unnamed country has contacted Queensland to warn of a positive coronavirus case, with seven new exposure sites listed in Brisbane.",None found,"Wed, 14 Jul 2021 09:44:16 +0000"
"As Myanmar's COVID-19 crisis worsens, Dr Alex says the military has forced him to flee for his life",EXCLUSIVE: An emergency doctor at one of Myanmar's largest hospitals says he's been forced to go into hiding as Myanmar's junta targets medics who supported the anti-coup protesters.,None found,"Wed, 14 Jul 2021 07:53:21 +0000"
'Big wake-up call': Authorities urged to tackle COVID-19 vaccine misinformation in diverse communities,"New research has found evidence of confusion and misinformation about the COVID-19 vaccine in culturally and linguistically diverse communities, which is seeing a rise in vaccine hesitancy. ",None found,"Wed, 14 Jul 2021 08:34:09 +0000"
Victoria to enter five-day COVID-19 lockdown from midnight to curb Delta outbreak,"The lockdown, which will come into effect from midnight tonight, will mark the state's fifth lockdown since the start of the COVID-19 pandemic and the third this year. ",None found,"Thu, 15 Jul 2021 07:45:28 +0000"
NSW reports 65 new local coronavirus cases with Gladys Berejiklian confirming 'we are seeing a stabilisation',But the premier said she expected higher case numbers on Friday given the number of people still infectious in the community.,None found,"Thu, 15 Jul 2021 02:17:59 +0000"
Scott Morrison proposes new COVID-19 financial support plan for all states affected by lockdowns,"It comes comes as NSW, Victoria and Queensland grapple with growing COVID-19 outbreaks. ",None found,"Thu, 15 Jul 2021 05:48:35 +0000"
South Australia introduces new COVID-19 rules and tightens border restrictions with Victoria,South Australia will reimpose stronger local COVID-19 rules and border restrictions amid growing interstate case numbers.,None found,"Thu, 15 Jul 2021 05:57:05 +0000"
US prepares to evacuate Afghan interpreters as Taliban seize border crossing,"Many  interpreters who aided US and NATO forces in Afghanistan fear retaliation by the Taliban, who are seeking to regain control of the government in Kabul after the departure of US troops before the end of August.",None found,"Wed, 14 Jul 2021 23:19:44 +0000"
"One in four unvaccinated Australians over 70 are waiting for a different COVID-19 vaccine, survey suggests","But despite concerns around the AstraZeneca jab, the ABS data also shows the percentage of Australians intending to get vaccinated is on the increase.",None found,"Thu, 15 Jul 2021 02:11:57 +0000"
Queensland extends mask mandate after recording three new local COVID-19 cases,Queensland has extended a face mask mandate for the southeast after three new locally acquired and unlinked COVID-19 cases were recorded in Brisbane.,None found,"Thu, 15 Jul 2021 01:48:05 +0000"
European Union to send petrol cars to scrap heap in mammoth climate change plan,"The European Commission wants to end the sale of new petrol and diesel cars by 2035, under a massive plan to fight climate change unveiled Wednesday.",None found,"Thu, 15 Jul 2021 00:05:36 +0000"
Britney Spears allowed to hire her own lawyer after demanding father's removal from conservatorship,"Britney Spears, speaking to a court on Wednesday, was at turns angry and upset - and used the occasional expletive - as she said she wanted to press charges against her father.",None found,"Thu, 15 Jul 2021 00:52:11 +0000"
Indonesia posts record daily COVID-19 infections as it becomes new 'epicentre of Asia' ,"Indonesia reported more than 54,000 new coronavirus cases for the first time Wednesday, surpassing recent daily infections in India, whose disastrous outbreak is declining, and becoming Asia&rsquo;s new virus hotspot.",None found,"Wed, 14 Jul 2021 21:48:21 +0000"
Victoria to enter five-day lockdown as the state's COVID-19 outbreak grows,"The lockdown, which will come into effect from midnight on Thursday, will mark the state's fifth since the start of the COVID-19 pandemic and the third this year. ",None found,"Thu, 15 Jul 2021 11:36:00 +0000"
'Toxic boys club': Women in politics join calls for code of conduct in parliament ,Federal MPs have told a women&rsquo;s leadership summit a &quot;legacy of misogyny&quot; and &quot;sexist underbelly&quot; continues to plague Australian politics and must be addressed.,None found,"Thu, 15 Jul 2021 10:24:27 +0000"
Papua New Guinea records first COVID-19 case of highly contagious Delta variant,The case is the captain of a cargo ship which departed from Indonesia on 26 June and arrived in PNG almost two weeks later.,None found,"Thu, 15 Jul 2021 11:33:03 +0000"
Australia labels the European Union's push for a carbon border tax 'protectionist',The European Commission has warned climate change action can't be undermined by less ambitious countries and the proposal is necessary to prevent &quot;carbon leakage&quot,None found,"Thu, 15 Jul 2021 08:24:06 +0000"
"Sydney's current social distancing 'inadequate' in controlling COVID-19 outbreak, modelling shows","University of Sydney data says not enough residents are socially distancing themselves, with health experts in agreement that Thursday's numbers do not necessarily point to a stabilising trend. ",None found,"Thu, 15 Jul 2021 10:34:44 +0000"
Josh Frydenberg hails 'resilient' economy as unemployment rate hits lowest level in over a decade,"Australia's unemployment rate fell to 4.9 per cent in June, its lowest level since December 2010, as another 29,100 people joined the workforce.",None found,"Thu, 15 Jul 2021 08:12:37 +0000"
Scott Morrison says four-step plan out of COVID-19 pandemic remains 'on the agenda' despite growing outbreaks,"The prime minister also noted that 'just shy of two million' vaccine doses have been implemented this month, with Australia setting a record day for jabs on Thursday.",None found,"Fri, 16 Jul 2021 07:54:27 +0000"
"NSW records 97 new coronavirus cases, with at least 46 in the community while infectious","More than 1,000 locally acquired cases have now been recorded in the state since 16 June, when the first case in the Bondi cluster was discovered.",None found,"Fri, 16 Jul 2021 01:49:28 +0000"
Victoria reports six new coronavirus cases as Daniel Andrews announces financial support payments,Victorian businesses and workers will be eligible for weekly government payments if they have lost money during the latest lockdown.,None found,"Fri, 16 Jul 2021 03:28:08 +0000"
"Queensland reports one new local case of coronavirus, shuts border to Victoria","Queensland has recorded one new local case of coronavirus and will close its border to people from Victoria from Saturday, after declaring it a hotspot.",None found,"Fri, 16 Jul 2021 00:06:09 +0000"
Australia says it won't put Afghans who helped its military on evacuation flights,"Australia won&rsquo;t be part of a US evacuation plan for Afghan staff in fear of persecution from the resurgent Taliban, despite calls from former senior diplomats and military figure",None found,"Fri, 16 Jul 2021 04:15:44 +0000"
Here&rsquo;s how Victorians can access cash payments for the latest COVID-19 lockdown,Cash payments will be delivered to Victorian workers and businesses that lose income during the latest five-day lockdown.,None found,"Fri, 16 Jul 2021 05:37:53 +0000"
"Lockdowns in Victoria, NSW expected to drive unemployment and stall economic recovery",Australia's unemployment rate has fallen to 4.9 per cent but the latest lockdowns in NSW and Victoria are expected to stall the recovery in the labour market.,None found,"Fri, 16 Jul 2021 05:31:30 +0000"
World leaders attend special APEC meeting on pandemic,It is the first time in the regional forum's history that leaders have held an extraordinary meeting at leaders' level.,None found,"Fri, 16 Jul 2021 05:17:52 +0000"
Indonesia prepares for 'worst-case scenario' as coronavirus crisis deepens,"Indonesia is being described as the new &quot;epicentre of Asia&quot;, recording tens of thousands of new coronavirus cases every day.",None found,"Thu, 15 Jul 2021 21:49:54 +0000"
"Hunt for Indigenous children's unmarked graves in Canada 'barely scratched the surface', say researchers","In the first in-depth technical briefing on the discovery, researchers have called on authorities to release school records to help them identify the victims.",None found,"Thu, 15 Jul 2021 22:40:30 +0000"
Australian siblings make it to Olympics but only one will compete after tragic accident,"Kai Sakakibara has travelled to Tokyo to cheer on his BMX rider sister Saya after his own Olympic dream was cut short by an accident that left him with a brain injury. Instead of competing, he'll now carry the Paralympic flame in the torch relay. ",None found,"Fri, 16 Jul 2021 06:42:02 +0000"
States tighten border restrictions with Victoria as it battles growing COVID-19 outbreak,"There are now 24 COVID-19 cases linked to Victoria's outbreak, including 126 exposure sites, 1,500 close contacts and 5,000 secondary contacts.",None found,"Fri, 16 Jul 2021 10:05:05 +0000"
Environmental activists hail 'incredible win' as Santos and Murphy Oil axe drilling plans in the Great Australian Bight,"Bight Petroleum is now the only company that still intends to drill in the area, even though its most recent plans to do so were rejected by the regulator.",None found,"Fri, 16 Jul 2021 08:25:32 +0000"
China steps up climate fight with emissions trading scheme,"The world's biggest emitter of the greenhouse gases, China has launched a carbon trading system to help lower emissions.",None found,"Fri, 16 Jul 2021 10:21:41 +0000"
Pulitzer Prize-winning photographer Danish Siddiqui killed in Afghanistan,Photographer Danish Siddiqui was killed covering fighting between Afghan security forces and the Taliban near a border crossing with Pakistan. ,None found,"Fri, 16 Jul 2021 09:43:09 +0000"
Sydney builders scramble to close up ahead of two-week shutdown in construction sector,The construction industry in Greater Sydney has been given less than 48 hours to prepare for a two-week shutdow,None found,"Sat, 17 Jul 2021 06:31:59 +0000"
NSW tightens Greater Sydney lockdown restrictions as state records 111 local COVID-19 cases and another death,"Of the new cases reported on Saturday, 29 were infectious in the community.",None found,"Sat, 17 Jul 2021 02:22:21 +0000"
Victoria records 19 new local COVID-19 cases as MCG-linked infections continue to spread,"Victorian authorities have identified some 10,000 primary close contacts as the state reports 19 new locally acquired COVID-19 case",None found,"Sat, 17 Jul 2021 02:58:05 +0000"
The cleaners helping to keep Sydney's essential workers safe during lockdown,"With new coronavirus exposure sites listed every day, armies of cleaners are working around the clock to keep Sydneysiders safe. One cleaning business, founded by Liberian refugee Badi Mahabat, is doing just that, and is hiring workers who have lost their jobs in other industries. ",None found,"Sat, 17 Jul 2021 00:42:54 +0000"
'Thoughtless act': Sydney removalists who allegedly knew they were COVID-positive still travelled to regional NSW,"The three removalists travelled from Sydney to Molong in regional NSW, stopping off in South Bowenfels and Orange along the way.",None found,"Sat, 17 Jul 2021 07:17:50 +0000"
Cap removed for Australia's international students working at supermarkets during lockdown,The government has relaxed the cap on working hours for student visa holders employed at supermarkets to address a worker shortage.,None found,"Sat, 17 Jul 2021 05:02:47 +0000"
Man tests positive to COVID-19 after travelling from Indonesia to Darwin by yacht,The 70-year-old man arrived in the Northern Territory on 13 July and is in quarantine under the care of the NT Centre for National Resilience with mild symptoms.,None found,"Sat, 17 Jul 2021 03:23:09 +0000"
APEC leaders vow to ramp up distribution of COVID-19 vaccines at emergency meeting,"The emergency virtual meeting produced few specific commitments, although China promised $3 billion in aid to help developing countries recover from the social and economic impacts of the coronavirus.",None found,"Fri, 16 Jul 2021 22:16:53 +0000"
Can 'viral shedding' after the COVID vaccine infect others? That's a big 'no',"&quot;Viral shedding&quot; fears have led some businesses to ban vaccinated customers, but COVID-19 vaccines don&rsquo;t contain any live virus to shed.",None found,"Sat, 17 Jul 2021 00:16:17 +0000"
South-west Sydney mayors say new COVID-19 restrictions segregates community from rest of Greater Sydney,"From Sunday, new measures to curb transmission will be put in place across Liverpool, Canterbury Bankstown and Fairfield. ",None found,"Sat, 17 Jul 2021 07:49:39 +0000"
Football fans at Melbourne Euro 2020 finals pub event told to quarantine after positive COVID-19 case,"Contact tracers have begun calling football fans who attended a Melbourne CBD Euro 2020 finals event, advising them and their household members to go into isolation.",None found,"Sat, 17 Jul 2021 09:47:06 +0000"
"Afghan embassy says videos show 'extreme violence' by Taliban against civilians, officials",Afghanistan's embassy in Australia says it has obtained videos allegedly showing civilians being tortured and Afghan government officials being shot dead. ,None found,"Sat, 17 Jul 2021 09:19:29 +0000"
First case of COVID-19 recorded at Tokyo Olympics athletes' village,"The first COVID-19 case in the athletes' village has raised concerns about the risk of the virus spreading among the 11,000 competitors who will reside in accommodation on the same site.",None found,"Sat, 17 Jul 2021 12:23:03 +0000"
NSW records 105 new cases and one new death as new restrictions come into force,"New restrictions are in force across Greater Sydney, with additional restrictions on movement in the city's southwest.",None found,"Sun, 18 Jul 2021 02:36:32 +0000"
Victoria's new local coronavirus cases rises to 17 with residents told to brace for longer lockdown,Victorian Premier Daniel Andrews says it is too early to tell whether there will be an extension of the state's COVID-19 lockdown as new virus cases reach 17.,None found,"Sat, 17 Jul 2021 23:43:18 +0000"
Government minister calls for deportation of British commentator Katie Hopkins after boasts of quarantine breach,Health Minister Greg Hunt says if it is found that Katie Hopkins breached Sydney COVID-19 quarantine rules then deportation should follow. ,None found,"Sun, 18 Jul 2021 05:36:36 +0000"
Australian Olympic team says 'minimal' impact from COVID-scare as more cases reported in Tokyo Olympics athletes' village,The Australian Olympic Committee says multiple tests on a support staff member in Cairns have come back negative and athletes will participate in upcoming events in Cairns - even as infections rise in the athletes' village in Tokyo.,None found,"Sun, 18 Jul 2021 06:09:57 +0000"
Peter Dutton is 'surprised' China has sent a second spy ship to monitor Australian operations,"Defence Minister Peter Dutton says by sending a second spy ship, China has &quot;obviously made a decision to have a greater presence&quot;.",None found,"Sun, 18 Jul 2021 03:47:30 +0000"
'They were trying to make me feel shame': Breastfeeding Australian mum confronted at Disneyland Paris,"Disneyland Paris guards confronted an Australian-born, French-based mum for breastfeeding at the park and she's speaking out to stop it happening to others.",None found,"Sun, 18 Jul 2021 00:31:01 +0000"
Hunt for survivors and victims as toll from deadly floods in western Europe rises to 170,"As residents gradually returned to their homes in Germany's worst hit areas, authorities warned more bodies were likely to be found in flooded cellars and collapsed homes.",None found,"Sat, 17 Jul 2021 22:46:09 +0000"
Cargo ship with COVID-19 crew to dock in WA,Seven crew members aboard the BBC California ship are suffering suspected COVID-19 symptoms and the ship will dock in Fremantle so they can be medically assessed.,None found,"Sun, 18 Jul 2021 07:29:13 +0000"
Southwest Sydney mayors say new COVID-19 restrictions segregates community from rest of Greater Sydney,"From Sunday, new measures to curb transmission will be put in place across Liverpool, Canterbury Bankstown and Fairfield. ",None found,"Sat, 17 Jul 2021 07:49:39 +0000"
Controversial film on Port Arthur massacre wins Cannes Film Festival prize,Caleb Landry Jones has received the best acting award at Cannes for his performance in a film about Australia's worst mass shooting from 1996.,None found,"Sun, 18 Jul 2021 07:03:21 +0000"
Spirit of Eid shines through despite Sydney lockdown,Muslims across Greater Sydney have been urged by authorities to celebrate the Eid religious festival at home.,None found,"Sun, 18 Jul 2021 08:07:20 +0000"
Minister calls for deportation of British commentator Katie Hopkins after boasts of quarantine breach,Health Minister Greg Hunt says if it is found that Katie Hopkins breached Sydney COVID-19 quarantine rules then deportation should follow. ,None found,"Sun, 18 Jul 2021 05:36:36 +0000"
Australian Olympic team says 'minimal' impact from COVID-19 scare as more cases reported in athletes' village,The Australian Olympic Committee says multiple tests on a support staff member in Cairns have come back negative and athletes will participate in upcoming events in Cairns - even as infections rise in the athletes' village in Tokyo.,None found,"Sun, 18 Jul 2021 06:09:57 +0000"
Boris Johnson will work remotely after public backlash over COVID-19 isolation rules ahead of 'freedom day',"Prime Minister Boris Johnson will now work remotely, reversing an earlier decision to avoid complete isolation after he was identified as a close contact of Health Secretary Sajid Javid, who tested positive for COVID-19.",None found,"Sun, 18 Jul 2021 11:10:27 +0000"
Why have the floods in Europe been so deadly?,Dutch Prime Minister  Mark Rutte says he has no doubts that the storms that have lashed Europe are the result of climate change. ,None found,"Sun, 18 Jul 2021 08:41:41 +0000"
NSW records 98 new local COVID-19 cases and one death as tougher restrictions come into force,NSW Health has confirmed a southwestern Sydney woman in her 50s has died after contracting COVID-19.,None found,"Mon, 19 Jul 2021 06:01:25 +0000"
Daniel Andrews confirms Victoria's lockdown will be extended as state records 16 new local COVID-19 cases,The Victorian premier described Delta as a &quot;great challenge&quot; and said he wanted to avoid an outbreak of the scale being experienced in Sydney. ,None found,"Mon, 19 Jul 2021 01:52:00 +0000"
South Australia to impose further COVID-19 restrictions after second new case,"Premier Steven Marshall has announced widespread coronavirus restrictions for South Australia, including closing all non-essential retail outlets.",None found,"Mon, 19 Jul 2021 07:17:54 +0000"
"With new COVID-19 cases and a scaled-back spectacle, is the Tokyo Olympics worth it?","Olympic Games organisers hoped delaying Tokyo 2020 by a year would give Japan &ndash; and the world &ndash; a chance to get over the coronavirus pandemic. Instead, the sporting spectacle will be drastically scaled back, with COVID-19 cases in the Olympic bubble emerging just days before it begins.",None found,"Mon, 19 Jul 2021 03:13:56 +0000"
Hundreds have joined a review into federal parliament's workplace culture - but not many are politicians,It comes as Home Affairs Minister Karen Andrews challenges politicians to take sexual harassment training as a 'clear demonstration of their commitment' against the problem.,None found,"Mon, 19 Jul 2021 05:27:57 +0000"
"'Almost like a menu': List of marginal seats guided government's $660m car park project, audit office says",A senior Australian National Audit Office official told a Senate hearing the office of then-urban infrastructure minister Alan Tudge started with a sheet of &quot;top 20 marginals&quot; to be canvassed for fundin,None found,"Mon, 19 Jul 2021 05:46:49 +0000"
British far-right commentator Katie Hopkins to be deported after visa cancelled,It comes after the Seven Network dropped the British commentator as a cast member of Big Brother on Sunday. ,None found,"Mon, 19 Jul 2021 04:38:00 +0000"
Support for the Morrison government's handling of the COVID-19 pandemic is dropping,"The research comes as the federal government announced one million Pfizer doses will be arriving in Australia, with similar-sized shipments expected in the coming weeks.",None found,"Mon, 19 Jul 2021 02:13:47 +0000"
Detained Australian Sean Turnell 'at tremendous risk' in Myanmar prison as Delta variant spreads,"Mr Turnell, a former adviser to Aung San Suu Kyi, is now experiencing &quot;cold and flu symptoms&quot; at the notorious Insein prison, his wife says.",None found,"Mon, 19 Jul 2021 03:07:26 +0000"
More than one million Pfizer doses have arrived in Australia amid lagging rollout,"More than one million Pfizer doses have arrived in Australia, with similar-sized shipments expected in coming weeks.",None found,"Sun, 18 Jul 2021 23:21:47 +0000"
More coronavirus support is now available to people in NSW. Here's how you can access it,"From this week, individuals and businesses across NSW directly impacted by the coronavirus lockdown can claim extended financial support payments.",None found,"Mon, 19 Jul 2021 08:33:28 +0000"
South Australia to impose further COVID-19 restrictions as authorities find third case,"Premier Steven Marshall has announced widespread coronavirus restrictions for South Australia, including closing all non-essential retail outlets.",None found,"Mon, 19 Jul 2021 07:17:54 +0000"
Veterans are burning their service medals in protest against Australia's treatment of Afghan interpreters,"A number of veterans across the country have burned their service medals, angered by the government's treatment of Australia's former Afghan staff.",None found,"Mon, 19 Jul 2021 10:45:40 +0000"
"After eight years of offshore detention, refugees and advocates in Australia renew calls for freedom",Monday marks eight years since the Australian government's offshore detention program came into force. The anniversary has sparked renewed calls for asylum seekers languishing in detention to be set free.,None found,"Mon, 19 Jul 2021 10:12:36 +0000"
'Absolutely disgraceful': Southwestern Sydney mayor questions equity of lockdown rules,Cumberland City Council mayor Steve Christou says the community is feeling &quot;let down&quot; and &quot;singled out&quot; by the NSW government's tougher lockdown rules for southwestern Sydney.,None found,"Mon, 19 Jul 2021 11:58:42 +0000"
British far-right commentator Katie Hopkins deported after having visa revoked,It came after the Seven Network dropped Ms Hopkins as a cast member of Big Brother on Sunday. ,None found,"Mon, 19 Jul 2021 08:42:19 +0000"
NSW experiencing 'significant crisis' as demand for food relief skyrockets during lockdown,"Foodbank says it has helped provide more than 10,000 emergency relief hampers for people in lockdown across NSW since 26 June.",None found,"Mon, 19 Jul 2021 08:33:19 +0000"
Eight crew members from cargo ship docked in Western Australia test positive to COVID-19,"Eight crew members aboard the BBC California, docked in Fremantle, have tested positive to COVID-19.",None found,"Mon, 19 Jul 2021 09:00:37 +0000"
