Harvey Weinstein pleads not guilty to rape and sexual assault in LA trial,The convicted rapist is serving a 23-year prison term in New York and now faces the possibility of another sentence in California,Associated Press,"Wed, 21 Jul 2021 23:33:06 GMT"
Johnson &amp; Johnson to pay $5bn in landmark $26bn US opioid settlement,Group of US states attorneys general unveil settlement including three largest US drug distributors and Johnson &amp;amp; Johnson,Guardian staff and agencies,"Wed, 21 Jul 2021 22:45:44 GMT"
More than 80 wildfires rage across western US – video report,"The Bootleg fire in Oregon, now roughly the size of Los Angeles, is so intense that it has created its own weather system, causing winds that have further fanned its flames. It has been burning for two weeks and barely a third of its perimeter has been contained. The Dixie fire in California exploded in size to roughly 94 sq miles (243 sq km) on Tuesday, and is only 15% contained. It broke out on 13 July",Stephanie Windeler,"Wed, 21 Jul 2021 15:37:27 GMT"
What sparked the mass violence in South Africa – video explainer,South Africa has recently experienced its worst violence since the end of the apartheid regime 27 years ago.&amp;nbsp;,Jason Burke Monika Cvorak Nikhita Chulani,"Wed, 21 Jul 2021 13:52:24 GMT"
‘I shoot for the common man’: the photographs of Danish Siddiqui,The photojournalist Danish Siddiqui was shot dead last week while documenting the Taliban offensive in Afghanistan. His award-winning work for Reuters spanned some of the world’s most era-defining crises. ,Danish Siddiqui,"Thu, 22 Jul 2021 05:30:16 GMT"
Gaza’s silent children – in pictures,Brazilian photographer Felipe Dana arrived in Gaza to cover the aftermath of the last war in May and was struck by how children were suffering psychologically,Felipe Dana/AP,"Thu, 22 Jul 2021 07:47:23 GMT"
My generation: four decades of British youth – in pictures,"From smokers to marchers to high-flying trampolinists, a new exhibition captures the awkward and emotional moments on the journey to adulthood. We pick the highlights of Youth Rising in the UK: 1981-2021",None found,"Thu, 22 Jul 2021 06:00:18 GMT"
Annastacia Palaszczuk ordered to attend Tokyo opening ceremony by AOC boss John Coates – video,"In an awkward exchange during a press conference hours after Brisbane won the right to host the 2032 Olympics, the head of the Australian Olympic Committee John Coates appears to order the Queensland premier to attend the Tokyo 2020 Olympic Games opening ceremony. Palaszczuk had previously said she would not attend the ceremony, in the face of growing domestic concern about her international trip. 'You are going to the opening ceremony,' Coates says. 'I am still the deputy chair of the candidature leadership group [for the 2032 bid] ... None of you are staying behind and hiding in your rooms, alright?'",None found,"Thu, 22 Jul 2021 00:35:02 GMT"
"NSW records 124 new cases and ‘nobody in ICU had both doses of vaccine’, premier says – video","New South Wales premier Gladys Berejiklian has said that there is nobody currently in intensive care that has had both doses of the vaccine. ‘That means the vaccine works in preventing serious illness’, she said. We really need people to remember that and feel confident when they’re getting vaccinated’. New South Wales recorded 124 local Covid-19 cases overnight with at least 48 of those were infectious while in the community.",None found,"Thu, 22 Jul 2021 02:06:28 GMT"
‘I’m not alone’: survivors organise against sexual violence in Colombia,"Despite death threats, gangs and guerrilla warfare, a network of women are determined to help others recover from rape and domestic abuse",Kiran Stallone and Megan Janetsky,"Thu, 22 Jul 2021 06:30:17 GMT"
Spike by Jeremy Farrar and Anjana Ahuja; and Vaxxers by Sarah Gilbert and Catherine Green – review,"Two urgent and fascinating accounts from the frontlines show how scientists succeeded, and failed, at saving us from Covid-19",Debora MacKenzie,"Thu, 22 Jul 2021 06:30:17 GMT"
Why do I hate nightclubs? They are for beautiful people and good dancers only,I endured the experience as an underage teenager so I could drink beer. But every club night since has made my heart sink,Adrian Chiles,"Wed, 21 Jul 2021 14:32:02 GMT"
‘I might not make it’: passengers tell of horror as Chinese subway floods,"Footage shows water filling carriages in Zhengzhou metro system, trapping people inside",Helen Davidson in Taipei,"Wed, 21 Jul 2021 10:46:16 GMT"
Sydney’s Covid test: what will it take to bring the case numbers down?,Mask mandate? More testing? Harder lockdown? Experts and NSW Health are divided on the best ways to reduce transmission,Melissa Davey,"Thu, 22 Jul 2021 17:30:32 GMT"
Whether or not the Great Barrier Reef is listed as ‘in danger’ won’t alter the fact it is at risk from climate change,The Australian government pushed back fiercely against Unesco’s recommendation – and the world is watching,Graham Readfearn,"Thu, 22 Jul 2021 17:30:31 GMT"
Australia stun 10-man Argentina at Olympics with goals from Wales and Tilio,"Australia have seized top spot in Group C with a 2-0 victory over Argentina, who had Francisco Ortega sent off before half-time",Suzanne Wrack in Sapporo,"Thu, 22 Jul 2021 13:55:50 GMT"
Sulphur-crested cockatoos learn to open wheelie bins in Sydney – video,"Sulphur-crested cockatoos are learning to pry open bins, with researchers finding the new skill has caught on in 44 Sydney suburbs in just two years. With help from the public, Australian and German ecologists have documented cockatoos learning the bin-diving behaviour through social interactions. The research, published in the journal ",None found,"Thu, 22 Jul 2021 18:00:31 GMT"
NSW government has only used 15% of its allocation of the AstraZeneca vaccine,,Sarah Martin and Michael McGowan,"Thu, 22 Jul 2021 17:48:41 GMT"
Australia’s reliance on gas exports questioned as Japan winds down fossil fuel power,Government urged to speed up transition to green energy as Australia’s biggest market shifts away from LNG and coal,Adam Morton Climate and environment editor,"Thu, 22 Jul 2021 17:30:31 GMT"
Merkel: Germany has not done enough to hit Paris climate targets,Chancellor says record on reducing carbon emissions ‘not sufficient’ as she reflects on 16-year leadership,Philip Oltermann in Berlin,"Thu, 22 Jul 2021 15:16:18 GMT"
"FBI failed to fully investigate Kavanaugh allegations, say Democrats","Group of senators say letter from Chris Wray shows the FBI gathered more than 4,500 tips without any apparent further action",Guardian staff and agencies,"Thu, 22 Jul 2021 18:20:10 GMT"
Dawn Butler ejected from Commons for saying Johnson has lied repeatedly,Labour MP accused the prime minister of misleading the Commons and the country over coronavirus,Peter Walker Political correspondent,"Thu, 22 Jul 2021 17:05:58 GMT"
"Morrison has finally embraced ‘informed consent’ for AstraZeneca, what took him so long to take Atagi’s advice? | Paul Karp","Despite government rhetoric, Atagi had always advised that adults wanting to be vaccinated COULD choose either vaccine",Paul Karp,"Thu, 22 Jul 2021 10:50:38 GMT"
Coles bins Stikeez and minis for good following criticism of plastic promotions,Environmental campaigners welcome announcement saying ‘the vast majority of the toys were either littered or dumped in landfill’,Lisa Cox,"Thu, 22 Jul 2021 17:30:31 GMT"
"As climate disasters unfold worldwide, can Australia resist change? – with Lenore Taylor","Increasing bushfires, floods and rising temperatures around the world make action on the climate crisis even more urgent, but Australia remains at a standstill. Guardian Australia editor Lenore Taylor and head of news Mike Ticher discuss Australia’s laggard approach to climate change, and why it’s important not to lose hope in the face of climate disaster",Presented by Gabrielle Jackson with Lenore Taylor and Mike Ticher. Produced by Miles Herbert and Camilla Hannan. The executive producer is Miles Martignoni,"Thu, 22 Jul 2021 17:30:31 GMT"
‘Tragic on many levels’: Queensland ambulance service apologises after death of Indigenous man,"Noomba, 39, died in 2018 after being detained outside his Townsville home by police with paramedics in attendance",Nino Bucci,"Thu, 22 Jul 2021 17:30:31 GMT"
"With half of Australia locked down, Bondi has become public enemy No 1 | Brigid Delaney","It’s become a thing to bash the coastal suburb synonymous with selfishness and privilege. But at its raffish, egalitarian heart, it’s still a place that belongs to everyone",Brigid Delaney,"Thu, 22 Jul 2021 17:30:32 GMT"
Mangoes in July: how growers coax a summer crop to fruit in winter,Australia’s mango season is getting longer. Making it happen is ‘a bit like KFC’: lots of secret ingredients plus trial and error,Natalie Parletta,"Thu, 22 Jul 2021 17:30:32 GMT"
Superstore: the workplace sitcom the world needs right now,It’s tricky for a comedy to deal with real-world issues without disappearing up its own woke-hole. It helps that this one is also gloriously stupid,Andrew P Street,"Thu, 22 Jul 2021 17:30:32 GMT"
After Story by Larissa Behrendt review – trauma and secrets unspool on literary tour of England,"Travelling the seat of colonial violence, an Indigenous mother and daughter complicate and celebrate the canon in Behrendt’s thoughtful, wry novel",Imogen Dewey,"Thu, 22 Jul 2021 17:30:32 GMT"
Rates of double-jabbed people in hospital will grow – but that does not mean Covid vaccines are failing,"Several factors, including the portion of those at highest risk among the double-vaccinated and antibody levels, account for the data",Ian Sample Science editor,"Thu, 22 Jul 2021 15:34:36 GMT"
Australian swimmers eager to entertain on the eve of Olympics duel with US | Kieran Pender,There is a feeling on the pool deck that it may be the Dolphins’ time to shine over a nine-day schedule,Kieran Pender at the Tokyo Aquatics Centre,"Thu, 22 Jul 2021 17:30:31 GMT"
Tokyo waits and the world watches as IOC gambles on the Games again,tish competitor George Robertson,Andy Bull in T Kyle MacMahon,"Thu, 22 Jul 2021 19:00:32 GMT"
International rugby league on life support due to self-interest of Australian clubs,World Cup later this year,Nick Tedeschi in Sydney,"Thu, 22 Jul 2021 17:30:30 GMT"
Australia’s and New Zealand’s World Cup myopia threatens crisis for rugby league | Aaron Bower, this autumn’s World Cup,Aaron Bower,"Thu, 22 Jul 2021 15:42:17 GMT"
Russia in all but name: the ROC team go to Tokyo with a siege mentality | Andrew Both,scandal,Andrew Roth in Moscow,"Thu, 22 Jul 2021 07:00:18 GMT"
Pieter‑Steph du Toit: ‘I grew up with a sense of destiny – I feel responsibility carrying this name’,The South Africa forward and reigning world player of the year almost lost a leg 17 months ago but is back for a Lions series he considers as big as a World Cup final,Daniel Gallan,"Thu, 22 Jul 2021 15:01:57 GMT"
The Hundred men’s opener: Oval Invincibles v Manchester Originals – live!,;,Tim de Lisle,"Thu, 22 Jul 2021 19:54:56 GMT"
Australia and New Zealand labelled ‘selfish’ after pulling out of Rugby League World Cup,;,Aaron Bower,"Thu, 22 Jul 2021 10:26:14 GMT"
It’s time to rethink what loneliness is | Miriam Kirmayer,Research suggests that chronic loneliness may be as damaging to health as smoking 15 cigarettes a day. But do we know what loneliness actually is?,Miriam Kirmayer,"Thu, 22 Jul 2021 10:27:22 GMT"
"Burner phones, fake sources and ‘evil twin’ attacks: journalism in the surveillance age | Bradley Hope","When I heard my number was on a leaked data list, I wasn’t surprised. Reporters have never been more vulnerable",Bradley Hope,"Thu, 22 Jul 2021 16:00:29 GMT"
The Guardian view on Pegasus spyware: the export of self-censorship | Editorial,l military spending,Editorial,"Thu, 22 Jul 2021 18:03:47 GMT"
Witnessing England’s response to Covid at first hand has profoundly shocked me | William Hanage,"On a visit to the UK from the US, I have seen how incoherent government policy is allowing Delta to run rampant",William Hanage,"Thu, 22 Jul 2021 08:36:17 GMT"
What has Norway learned from the Utøya attack 10 years ago? Not what I hoped | Sindre Bangstad,The deaths of 69 young Labour activists failed to prompt a reckoning with the far-right ideas that motivated Anders Breivik,Sindre Bangstad,"Thu, 22 Jul 2021 10:00:22 GMT"
"For all our sakes, let’s hope Jeff Bezos’s space trip is just a midlife crisis | Gaby Hinsliff",The flight by the Amazon boss could mark the unchecked commercial exploitation of the ultimate virgin environment,Gaby Hinsliff,"Thu, 22 Jul 2021 14:30:27 GMT"
There will be blood: women on the shocking truth about periods and perimenopause,"The menopause brings an end to menstruation – but in the lead-up, many women experience periods that can disrupt their lives and careers",Gaby Hinsliff,"Thu, 22 Jul 2021 09:00:20 GMT"
Old review – M Night Shyamalan’s fast-ageing beach horror is top notch hokum,"With a cast worthy of Agatha Christie, this tale of a resort where time has been terrifyingly accelerated is brilliantly poised between serious and silly",Peter Bradshaw,"Thu, 22 Jul 2021 16:00:29 GMT"
Amy Winehouse’s 20 greatest songs – ranked!,"With the 10th anniversary of her death this week, rediscover the best of Winehouse’s discography, where heartbreak and anger are mixed up with wit and joy",Alexis Petridis,"Thu, 22 Jul 2021 12:03:56 GMT"
Seth Meyers: Trump presidency was ‘Epcot world showcase of corruption’,Late-night hosts discuss the arrest of  ex-Trump inaugural chair Tom Barrack and the GOP’s late change of heart on vaccines,Adrian Horton,"Thu, 22 Jul 2021 15:31:15 GMT"
Prince: Welcome 2 America review – the best album of his last two decades,"Prince’s stock as a recording artist was low in 2010, so it makes weird sense for this work to appear in 2021, getting the posthumous attention it deserves",Alexis Petridis,"Thu, 22 Jul 2021 11:00:23 GMT"
‘My son reeks of Persona’: a week with a scent inspired by Ingmar Bergman’s most challenging film,The perfume was specially commissioned by organisers of the annual Bergman Week festival on the island on which the Swedish director was born. But what does it smell like?,Xan Brooks and Tania Sanchez,"Thu, 22 Jul 2021 15:00:28 GMT"
UTS professor Dianne Jolley found guilty of sending herself threatening letters,Jolley admitted drafting one letter herself after she was caught on CCTV shortly before her arrest in November 2019,Australian Associated Press,"Thu, 22 Jul 2021 08:13:26 GMT"
Coronavirus live: more than half of all European adults fully vaccinated; more Olympic athletes test positive in Tokyo,More than ,"Lucy Campbell (now); Mattha Busby, Miranda Bryant and Martin Farrer (earlier)","Thu, 22 Jul 2021 19:49:25 GMT"
Argentina threatens to cancel deal for Sputnik vaccine as Russia fails to deliver,"Moscow owes 18.5m doses, leaving Argentina in a ‘very critical situation’ with only 12% fully vaccinated, leaked letter reveals",Uki Goñi in Buenos Aires,"Thu, 22 Jul 2021 18:39:33 GMT"
‘It’s too late’: US doctor says dying patients begging for Covid vaccine,"At least 99% of those in US who died of Covid in the last six months had not been vaccinated, says CDC director Dr Rochelle Walensky",Sarah Betancourt,"Thu, 22 Jul 2021 16:19:14 GMT"
UK scientists back Covid boosters as study finds post-jab falls in antibodies,,Ian Sample Science editor,"Thu, 22 Jul 2021 11:45:37 GMT"
Israel to examine whether spyware export rules should be tightened,Commission to review claims NSO’s Pegasus was misused by customers to target journalists and activists,Peter Beaumont and Philip Oltermann,"Thu, 22 Jul 2021 15:45:03 GMT"
"California prepares to bury 10,000 miles of power lines as wildfires force new evacuations",Tamarack fire spreads from California to Nevada while weather aids firefighters in Oregon,Guardian staff and agencies,"Thu, 22 Jul 2021 19:06:41 GMT"
Brexit: Von der Leyen rejects Boris Johnson bid to renegotiate Irish protocol,"EU has already proposed changes to lessen impact on Northern Irish citizens, say officials",Jennifer Rankin in Brussels and Aubrey Allegretti,"Thu, 22 Jul 2021 14:50:11 GMT"
"FBI failed to fully investigate Brett Kavanaugh sexual misconduct allegations, Democrats say – live",;,Daniel Strauss,"Thu, 22 Jul 2021 19:38:13 GMT"
Alleged killing of migrant by far-right politician prompts Italy gun control row,"Estimated 1.2m Italians who are not in police or the security forces own small guns, according to poll",Angela Giuffrida in Rome,"Thu, 22 Jul 2021 12:17:50 GMT"
Eric Clapton refuses to play venues that require proof of vaccination,Clapton says he won’t perform for a ‘discriminated audience’ after vaccination passports made mandatory for clubs and venues this autumn,Laura Snapes,"Thu, 22 Jul 2021 10:05:24 GMT"
AI firm DeepMind puts database of the building blocks of life online,"AlphaFold program’s prediction of nearly 20,000 human protein structures now free for researchers",Natalie Grover Science correspondent,"Thu, 22 Jul 2021 15:00:27 GMT"
China refuses further inquiry into Covid-19 origins in Wuhan lab,"WHO proposal to audit Chinese laboratories is ‘arrogance towards science’, says health official",Helen Davidson in Taipei,"Thu, 22 Jul 2021 08:59:32 GMT"
Scott Morrison says sorry for Australia's slow Covid vaccine rollout – video,"Australia prime minister Scott Morrison has said sorry for the sluggish rollout of the country’s vaccination program. ‘I’m sorry that we haven’t been able to achieve the marks that we had hoped for at the beginning of this year,’ he said. ‘But what’s more important is that we’re totally focused on ensuring that we’ve been turning this around.’ The apology comes ",None found,"Thu, 22 Jul 2021 04:27:23 GMT"
China floods: aluminium alloy plant explodes in Henan province – video,Dramatic footage shows the moment an aluminium plant exploded in China's central Henan province after a record-breaking rain storm. Local government officials said Dengfeng Power Group's plant exploded when flood waters from a nearby river breached a wall and entered it,None found,"Thu, 22 Jul 2021 08:56:30 GMT"
Whirlwind sweeps through football match in Bolivia – video,"There was a whirlwind start to a match in Bolivia after a 'dust devil' rolled across the pitch as teams lined up before kick-off. 'Dust devils' are small whirlwinds that pick up dust and debris as they roll over land. They are often mistaken for tornados, which form with a downward motion of wind as opposed to upward. The moment took place in the middle of a small tournament final in Achocalla. The powerful wind can be seen dragging clothes into the air as the teams disperse to avoid being hit by the whirlwind.&amp;nbsp;",None found,"Thu, 22 Jul 2021 08:30:54 GMT"
Victoria health minister condemns Morrison 'blaming' vaccine advisory body for slow rollout – video,"Victorian health minister Martin Foley has criticised prime minister Scott Morrison’s ‘constant appeal’ to the Australian Technical Advisory Group on Immunisation (Atagi) to change its advice relating to AstraZeneca. ‘I thought it was an unnecessary shot at professionals doing their job,’ Foley said. ‘If there is a problem, work through it with them, don’t blame them for doing their job’",None found,"Thu, 22 Jul 2021 03:49:29 GMT"
Greensill could yet cause problems for Boris Johnson,"Analysis: Despite escaping criticism in Nigel Boardman’s report, other inquiries will ensure affair rumbles on",Rajeev Syal,"Thu, 22 Jul 2021 18:06:15 GMT"
‘I had a crush on my sexy manager’: seven readers on their summers of love,"A virtual lockdown date that blossomed, an encounter on a backpackers’ bus and a school trip to Spain – readers share their most memorable summer romances",Guardian readers,"Thu, 22 Jul 2021 10:30:22 GMT"
"Ballooning, surfing and Johnny Rotten: Thursday’s best photos",The Guardian’s picture editors select photo highlights from around the world,Selected by Natasha Rees-Bloor,"Thu, 22 Jul 2021 13:13:18 GMT"
Australia Covid live news update: Scott Morrison speaks after national cabinet; NSW calls outbreak ‘national emergency’ with 136 new cases,Premier Gladys Berejiklian says 53 of the new NSW cases were infectious in the community; ,"Lisa Cox (now) and Nino Bucci,Elias Visontay,Mostafa Rachwani and Michael McGowan (earlier)","Fri, 23 Jul 2021 07:41:25 GMT"
Australian Medical Association says NSW Covid lockdown failing and urges change to AstraZeneca advice,Exclusive: Dr Omar Khorshid says Atagi advice must be changed given growing number of cases from Sydney outbreak,Melissa Davey,"Fri, 23 Jul 2021 05:13:59 GMT"
Tokyo Olympic Games 2020: build-up to the opening ceremony – live!,;,Emma Kemp (now) and Barry Glendenning (later),"Fri, 23 Jul 2021 07:38:43 GMT"
Hazzard warning as News Corp turns on NSW government | The Weekly Beast,Lockdown takes toll as Telegraph puts heat on Gladys Berejiklian and her health minister,Amanda Meade,"Fri, 23 Jul 2021 03:41:24 GMT"
Morrison held press conferences at the Lodge despite health advice visitors should be vaccinated,Prof Paul Kelly gave written health advice to the prime minister on 18 July with ways to mitigate risk while in quarantine,Paul Karp,"Fri, 23 Jul 2021 07:30:55 GMT"
New Zealand shuts Australia travel bubble as Sydney’s Covid outbreak worsens,Jacinda Ardern pauses flights for eight weeks as her health chief says the spread in NSW was ‘clearly not under control’,Tess McClure in Christchurch,"Fri, 23 Jul 2021 02:19:28 GMT"
Activewear brand Lorna Jane fined $5m for claiming clothes could stop Covid spread,Company falsely claimed its anti-virus activewear had been sprayed with a substance that protected people against pathogens,Australian Associated Press,"Fri, 23 Jul 2021 06:32:29 GMT"
"Locked down and wintry: Victoria, NSW and SA to shiver through weekend as cold snap continues","Cold fronts will move across Australia’s east and south over the weekend, bringing foul weather to many already in lockdown",Soofia Tariq,"Fri, 23 Jul 2021 04:53:21 GMT"
Businesses that had no downturn from Covid crisis received $12.5bn jobkeeper windfall,Payments described as ‘waste of public money’ represent almost 14% of the $90bn program,Ben Butler,"Fri, 23 Jul 2021 01:11:18 GMT"
"Half a million NSW workers granted Covid payments, but many remain ineligible","Nearly half of the unemployed or part-time workers barred from disaster payments are now at risk of homelessness, says Acoss",Anne Davies and Elias Visontay,"Fri, 23 Jul 2021 03:09:12 GMT"
"Cockatoos in Sydney learning from each other to bin-dive for food, study finds",Sulphur-crested cockatoos’ ability to pry open bins has spread across 44 suburbs in only two years,Donna Lu,"Thu, 22 Jul 2021 18:00:31 GMT"
Eid al-Adha under Covid lockdown is a cruel challenge – and a reminder to care for each other | Heba Shaheed,"My daughter is currently in a relapse of her stage 4 childhood cancer, and every Thursday she undergoes an aggressive chemotherapy protocol",Heba Shaheed,"Fri, 23 Jul 2021 04:26:28 GMT"
‘There are no rules now’: how gen Z reinvented pop punk,"Twenty years ago, it was made by juvenile men in shorts. Now, from Meet Me @ the Altar to Olivia Rodrigo, diverse young women have reclaimed the genre – and made it the sound of the summer",Hannah Ewens,"Fri, 23 Jul 2021 05:00:45 GMT"
All the trains in my son’s train podcast ranked by how much I hate them | Ben Jenkins,"Living in lockdown with small children means distracting them with the same thing, over and over again, until you – like ",Ben Jenkins,"Fri, 23 Jul 2021 02:42:57 GMT"
"The feeling of being cooped up like lockdown will never end, is just a feeling | First Dog on the Moon",Although it might not be …,First Dog on the Moon,"Fri, 23 Jul 2021 06:02:40 GMT"
They Are Us: controversial film about Christchurch attacks put on hold,Fictional account of mosque shootings starring Rose Byrne as Jacinda Ardern has been criticised as ‘insensitive’,Tess McClure in Christchurch,"Fri, 23 Jul 2021 06:31:29 GMT"
Hockeyroos move on from recent turmoil as different kind of heat builds in Tokyo,;,"Kieran Pender at Oi Hockey Stadium, Tokyo","Fri, 23 Jul 2021 04:17:45 GMT"
Australia stun 10-man Argentina at Olympics with Wales and Tilio strikes,;,Suzanne Wrack in Sapporo,"Thu, 22 Jul 2021 21:36:21 GMT"
International rugby league on life support due to self-interest of Australian clubs | Nick Tedeschi,World Cup later this year,Nick Tedeschi in Sydney,"Thu, 22 Jul 2021 17:30:30 GMT"
Covid case in West Indies leaves Australia’s ODI series in jeopardy,;,Australian Associated Press,"Fri, 23 Jul 2021 04:30:44 GMT"
Michael Vaughan says England players may not make Ashes tour if families are barred,;,Martin Farrer,"Fri, 23 Jul 2021 01:06:29 GMT"
Russia in all but name: the ROC team go to Tokyo with a siege mentality | Andrew Roth,scandal,Andrew Roth in Moscow,"Thu, 22 Jul 2021 07:00:18 GMT"
Tokyo 2020 U-turn allows social media teams to show athletes taking the knee,;,Sean Ingle in Tokyo,"Thu, 22 Jul 2021 08:31:37 GMT"
‘A fundamental right’: Dina Asher-Smith urges Games to allow podium protests,;,Sean Ingle in Tokyo,"Thu, 22 Jul 2021 21:00:35 GMT"
Morrison has finally embraced ‘informed consent’ for AstraZeneca. What took him so long to take Atagi’s advice? | Paul Karp,"Despite government rhetoric, Atagi had always advised that adults wanting to be vaccinated could choose either vaccine",Paul Karp,"Thu, 22 Jul 2021 21:30:46 GMT"
