Derbyshire cave house identified as ninth-century home to exiled king,Anchor Church cave is thought to be one of the oldest intact domestic interiors found in the UK,Mark Brown Arts correspondent,"Wed, 14 Jul 2021 23:01:26 GMT"
"Coronavirus live news: Indonesia ‘in worst case scenario’ as  daily cases climb past 50,000",First minister of Wales says there is ,Martin Belam (now) and Helen Sullivan (earlier),"Thu, 15 Jul 2021 07:36:57 GMT"
Victoria Covid update: state set to go into lockdown as clusters linked to Sydney outbreak grow,"Covid commander Jeroen Weimar reports 10 new locally-acquired cases, says more than 6,500 people are isolating and did not rule out another lockdown in Melbourne",Josh Taylor,"Thu, 15 Jul 2021 04:38:09 GMT"
‘Not time for blame game’: former Atagi representative says Morrison’s AstraZeneca comments ‘unfair’,Australia’s immunisation adviser says Covid vaccine rollout the responsibility of government,Paul Karp,"Wed, 14 Jul 2021 17:29:18 GMT"
‘Death in Venice screwed up my life’ – the tragic story of Visconti’s ‘beautiful boy’,"Björn Andrésen was the striking child star of the classic film, the perfect embodiment of youthful beauty. Fifty years on, he is still haunted by the exploitation that continued long after filming stopped",Ryan Gilbey,"Thu, 15 Jul 2021 05:00:34 GMT"
‘I’ve outlasted them all’: the spectacular life of the world’s most powerful crossword editor,"The New York Times’ Will Shortz has appeared on The Simpsons, written riddles for a Batman villain and sold over 1m copies of a sudoku book. He talks hate mail, controversial clues and why puzzles are like drugs",J Oliver Conroy,"Thu, 15 Jul 2021 07:00:34 GMT"
This Way Up series two review – TV so good it’s indistinguishable from magic,"Co-starring Sharon Horgan, Aisling Bea’s delightful, devastating comedy about mental health and sisterhood remains the perfect showcase for the pair’s prodigious talents",Lucy Mangan,"Wed, 14 Jul 2021 21:30:23 GMT"
"Who is Britney Spears’ new celebrity lawyer, Mathew Rosengart?","Attorney Mathew Rosengart has represented Steven Spielberg and Sean Penn, and will now help the singer in her conservatorship battle",Helen Sullivan and agencies,"Thu, 15 Jul 2021 03:46:12 GMT"
‘Did Donald Trump lose?’ Fox News host won’t answer Texas Democrat,In interview James Talarico challenges Fox News host Pete Hegseth to say Trump lost the 2020 presidential election,Martin Pengelly in Washington,"Wed, 14 Jul 2021 11:50:07 GMT"
Queensland rediscover spirit as low-energy NSW pay price for hubris | Nick Tedeschi,The Maroons saved some face with their State of Origin game three win on the Gold Coast after the Blues’ selection policy backfired,Nick Tedeschi,"Wed, 14 Jul 2021 23:41:48 GMT"
Matildas’ latest defeat shines light on gap between expectations and reality | Samantha Lewis,Australia remain winless in five heading to the Olympics where they face a tough assignment to meet high expectations,Samantha Lewis,"Thu, 15 Jul 2021 00:30:53 GMT"
Mitchell Marsh stars with bat and ball as Australia salvage some pride in West Indies,;,Australian Associated Press,"Thu, 15 Jul 2021 04:06:10 GMT"
Open ready for return of crowds with army marshals to ease security fears,;,Paul MacInnes at Royal St George's,"Wed, 14 Jul 2021 17:36:18 GMT"
Dogged Bucks rally past Suns in Game 4 to level NBA finals at two games apiece,;,Agencies,"Thu, 15 Jul 2021 03:50:54 GMT"
Royal St George’s is toughest Open course with history of surprises,r in 2003,Michael Butler at Royal St George’s,"Wed, 14 Jul 2021 17:41:56 GMT"
South Africa A show British &amp; Irish Lions size of their task with bruising win,• Cape Town: South Africa A 17-13 Lions,Robert Kitson at the Cape Town Stadium,"Wed, 14 Jul 2021 20:34:51 GMT"
The pandemic prompted a wild transformation. I have become an exercise monster | Deborah Frances-White,"I was up for nothing but lockdown walks and a spot of yoga until I sat on the Peloton saddle. Now, beat me if you dare …",Deborah Frances-White,"Thu, 15 Jul 2021 06:00:34 GMT"
The UK won’t meet its ambitious climate goals by making spending cuts | Larry Elliott,"Boris Johnson may talk a good game on the climate crisis, but ordinary people need financial support to make changes",Larry Elliott,"Thu, 15 Jul 2021 06:00:34 GMT"
Charlie Chaplin films are returning to cinemas – the perfect tonic for today,"Re-released across two seasons for Australian and New Zealand audiences, Chaplin’s elegant crowdpleasers will rescue you from chaotic times",Luke Buckmaster,"Wed, 14 Jul 2021 22:00:24 GMT"
"Paris, 13th District review – Jacques Audiard’s sexy apartment-block anthology",Audiard brings his typical visual fluency to this entertaining collection of interlocking stories about characters hooking up in the 13th arrondissement,Peter Bradshaw,"Wed, 14 Jul 2021 22:16:24 GMT"
Gunpowder Milkshake review – slick thriller goes down smoothly,"A female-led, John Wick-inspired franchise starter might be more of the same but it’s done with just about enough flair to pass the time",Benjamin Lee,"Wed, 14 Jul 2021 18:17:59 GMT"
The Croods: A New Age review – much yabba-dabba ado in caveman caper,A-list voice actors leaven this hectic children’s movie with gags for grownups,Cath Clarke,"Thu, 15 Jul 2021 06:00:35 GMT"
Former Nationals president says party ‘losing its way’ under Barnaby Joyce and urges women to speak up,,Sarah Martin Chief political correspondent,"Wed, 14 Jul 2021 17:30:18 GMT"
‘We weren’t afforded dignity’: family had to phone authorities to ask if father had died,Frank Coleman was the ninth Aboriginal person to die in custody this year. His family first heard he’d been found ‘unresponsive’ via Facebook,Lorena Allam,"Wed, 14 Jul 2021 17:30:18 GMT"
One in four unvaccinated Australians over 70 waiting for ‘different vaccine’,"Australian Bureau of Statistics survey reveals more people intend to get vaccinated, despite some AstraZeneca concerns ",Christopher Knaus,"Wed, 14 Jul 2021 06:51:06 GMT"
Australia’s unemployment rate falls to 4.9% but underemployment up as lockdowns take toll,"The economy added nearly 30,000 jobs in June but fewer hours were worked overall as a result of Victoria’s lockdown",Paul Karp,"Thu, 15 Jul 2021 04:54:59 GMT"
Australian government stokes fears that Europe’s new carbon levy could hurt jobs,Dan Tehan criticises tarffs as ‘just a new form of protectionism’ despite Australia’s major exports being mostly spared in initial stage ,Daniel Hurst Foreign affairs and defence correspondent,"Wed, 14 Jul 2021 22:24:29 GMT"
Two Liberal MPs urge Morrison to set 2050 net zero target before UN climate conference,Trent Zimmerman and Bridget Archer said net zero was not only the right thing to do but would create opportunities for Australia,Adam Morton Climate and environment editor,"Wed, 14 Jul 2021 09:33:56 GMT"
"South Africa seeks to deploy 25,000 troops to curb unrest","Fears of food and fuel shortages as sixth day of disruption to farming, manufacturing and oil refining take toll",Agence France-Presse,"Thu, 15 Jul 2021 06:51:05 GMT"
Top US general warned of ‘Reichstag moment’ in Trump’s turbulent last days,"Gen Mark Milley drew comparison to Nazi Germany as Trump tried to overturn election defeat, new book I Alone Can Fix This says",Martin Pengelly in Washington,"Wed, 14 Jul 2021 20:27:25 GMT"
Several missing and many stranded after houses collapse in German floods,Buildings gave way in Rhineland area of Schuld bei Adenau amid heavy rain and once-in-a-generation flooding,Reuters,"Thu, 15 Jul 2021 05:36:29 GMT"
LA beaches close after 17m gallons of untreated sewage discharged into bay,Health officials face anger over hours-long delay before notifying public of danger,Victoria Bekiempis,"Thu, 15 Jul 2021 00:04:28 GMT"
World’s rarest stamp returns to Britain for first time in 143 years,British Guiana 1c Magenta is described as ‘holy grail of philately’ and ‘Mona Lisa of stamp world’,PA Media,"Thu, 15 Jul 2021 07:16:54 GMT"
New Zealand man reaches plea deal over alleged attempt to kidnap US teen,Teenager’s mother shot Troy George Skinner as he allegedly tried to break into their Virginia home; he has pleaded not guilty to charges,Associated Press,"Thu, 15 Jul 2021 00:25:08 GMT"
France protests: clashes with police on Bastille Day amid anger at tighter Covid rules,Demonstrations in Paris and other cities over plan for mandatory vaccinations for health workers and vaccine pass for public places,Agence France-Presse,"Thu, 15 Jul 2021 00:25:36 GMT"
"‘Inexcusable’: FBI badly mishandled Larry Nassar case, DoJ watchdog says",;,Associated Press,"Wed, 14 Jul 2021 21:12:26 GMT"
"Joe Exotic should receive shorter prison sentence, federal appeals court rules",Exotic was sentenced in January 2020 to 22 years after being convicted of trying to hire two different men to kill Carole Baskin,Guardian staff and agencies,"Wed, 14 Jul 2021 20:53:00 GMT"
South African mother describes throwing baby from burning building – video,"A young mother from Durban has described throwing her two-year-old daughter from a burning building. Naledi Manyoni said she had no choice but to release her grip on her daughter and hope that she was caught by people waiting below.'They kept screaming ""throw her"",' she said. Manyoni and her fiance lived on the 16th floor of building set ablaze by looters at ground level amid widespread violence in parts of South Africa",None found,"Thu, 15 Jul 2021 04:31:41 GMT"
Cuba cracks down on protests as rallies spring up across US in support  – video,"Cuban special forces have begun a widespread crackdown on anti-government protests. The historic demonstrations were sparked&amp;nbsp;over food shortages, high prices and other grievances against the government. Meanwhile, rallies have been held in several US cities, with hundreds of people waving&amp;nbsp;Cuban flags and calling for change on the Communist-run island",None found,"Wed, 14 Jul 2021 06:40:34 GMT"
A rare look inside a Sydney Covid-19 ICU ward as one man fights for his life – video,"Cameras have been allowed in a Sydney hospital's Covid-19 intensive care unit, showing the struggle of one patient on a ventilator. The 53-year-old Covid patient from NSW is only able to take shallow breaths of air through the ventilator. His medical teams, dressed in full PPE,&amp;nbsp;adjusts his ventilator tubes and monitor his oxygen levels. The patient has given his consent for his images to be published",None found,"Thu, 15 Jul 2021 01:37:24 GMT"
Five in the bed! Life with a Chinese family in New York – in pictures,"Photographed over 18 years, The Lams of Ludlow Street intimately captures Thomas Holton’s time with a family in their tiny Chinatown apartment",None found,"Thu, 15 Jul 2021 06:00:34 GMT"
Rooftop crops: urban farms in Hong Kong – in pictures,"More than 60 urban farms have sprouted across space-starved Hong Kong since 2015 – on decommissioned helipads, shopping mall rooftops and public terraces – thanks to initiatives such as Rooftop Republic",Anthony Wallace/AFP/Getty Images,"Wed, 14 Jul 2021 08:50:48 GMT"
The heatwave forcing America to confront climate reality,"An extraordinary heatwave has swept the west coast of the US and Canada, leading to record temperatures, water shortages, and hundreds of deaths – and bringing home the catastrophic consequences of global heating",Presented by Rachel Humphreys with Oliver Milman; produced by Ned Carter Miles and Axel Kacoutié; executive producers Archie Bland and Phil Maynard,"Wed, 14 Jul 2021 02:00:04 GMT"
"No cults, no politics, no ghouls: how China censors the video game world",China’s video game market is the world’s biggest. International developers want in on it – but its rules on what is acceptable are growing increasingly harsh. Is it worth the compromise?,Oliver Holmes,"Thu, 15 Jul 2021 05:00:33 GMT"
"‘Not our first pandemic’: drag queen, 90, who stayed onstage during Covid","Darcelle XV, officially the world’s oldest drag queen, is part of an LGBT generation that lived through HIV/Aids",Alice Hutton,"Thu, 15 Jul 2021 06:00:34 GMT"
The search for the loneliest whale in the world,"When people learned he vocalized at a much higher pitch than other whales,   they wondered: could other whales hear him? Was he plaintively calling, never hearing a reply? Was he lonely?",Kieran Mulvaney,"Tue, 13 Jul 2021 20:00:01 GMT"
Sony WF-1000XM4 review: the best-sounding noise-cancelling earbuds,Comfortable and long lasting with good case and brilliant audio but ultimately disposable,Samuel Gibbs Consumer technology editor,"Thu, 15 Jul 2021 06:00:34 GMT"
Black faces in high places: how Simon Woolley revolutionised British politics,"He set up Operation Black Vote in 1996, vastly increasing the number of Black MPs - and later this year becomes the first Black man to head an Oxbridge college",Alex Mistlin,"Thu, 15 Jul 2021 05:00:33 GMT"
Colbert: ‘Restrictive voting laws are being justified by the fig leaf of the big lie’,Late-night hosts discuss the wave of state-level voting restrictions and Rudy Giuliani’s election antics,Adrian Horton,"Wed, 14 Jul 2021 15:36:22 GMT"
Victoria Covid update: state enters five-day lockdown as outbreak linked to Sydney grows,"Covid commander Jeroen Weimar reports 18 cases, 75 exposure sites and says more than 6,500 people are isolating",Josh Taylor and Paul Karp,"Thu, 15 Jul 2021 12:58:51 GMT"
Kremlin papers appear to show Putin’s plot to put Trump in White House,Exclusive: Documents suggest Russia launched secret multi-agency effort to interfere in US democracy,"Luke Harding, Julian Borger and Dan Sabbagh","Thu, 15 Jul 2021 10:00:38 GMT"
At least 58 dead in Germany as heavy rains bring catastrophic flooding,"Parts of Belgium, France and Netherlands also badly affected as unprecedented rainfall wreaks havoc",Philip Oltermann in Berlin,"Thu, 15 Jul 2021 19:41:00 GMT"
Scientists dismiss Warren Entsch’s claim warm water from northern hemisphere is damaging reef,Coalition’s Great Barrier Reef envoy also said Australia was a ‘victim of our own success’ when it came to coral bleaching,Graham Readfearn,"Thu, 15 Jul 2021 17:30:48 GMT"
‘Not engaging isn’t the answer’: Australia under pressure as US follows EU lead on carbon tariffs,Experts and opposition MPs say Australia should work with Europe on new imports scheme instead of criticising,Daniel Hurst and Adam Morton,"Thu, 15 Jul 2021 17:30:48 GMT"
Huge study supporting ivermectin as Covid treatment withdrawn over ethical concerns,"The preprint endorsing ivermectin as a coronavirus therapy has been widely cited, but independent researchers find glaring discrepancies in the data",Melissa Davey,"Thu, 15 Jul 2021 17:30:48 GMT"
‘Absolutely confusing’: businesses suffering in Sydney lockdown plead for certainty over what’s essential work,Owners and staff call the NSW Covid rules confusing and are frustrated the government can’t answer questions directly,Mostafa Rachwani and Elias Visontay,"Thu, 15 Jul 2021 17:30:47 GMT"
Dutch crime reporter Peter de Vries dies after shooting,Family announces death of 64-year-old just over a week after attack in Amsterdam,Jon Henley Europe correspondent,"Thu, 15 Jul 2021 15:59:39 GMT"
Four arrested over online racist abuse of England footballers,Police warn other alleged offenders will be tracked down for targeting black players after Euro 2020 final,Tobi Thomas,"Thu, 15 Jul 2021 15:02:17 GMT"
Paralyzed man’s brain waves turned into sentences on computer in medical first,Study marks important step toward restoring more natural communication for people who can’t talk ,Associated Press,"Thu, 15 Jul 2021 13:05:48 GMT"
The treacherous politics of Covid-19 – with Lenore Taylor,"The Delta variant has seemingly foiled Australia’s best laid pandemic plans. As politicians point fingers, case numbers are growing, and cities are going back into lockdown. Editor in chief Lenore Taylor and head of news Mike Ticher discuss why lessons have not been learnt from the first wave of the pandemic","Presented by Gabrielle Jackson with Lenore Taylor and Mike Ticher. Produced by Ryan Pemberton, Miles Herbert, and Soofia Tariq. The executive producer is Miles Martignoni","Thu, 15 Jul 2021 17:30:48 GMT"
Death disruptor: how an Australian funnel-web spider may help human hearts,University of Queensland researchers are investigating if protein in venom of Fraser Island spider can stop cardiac cells dying,Donna Lu,"Thu, 15 Jul 2021 18:30:49 GMT"
"Covid live: deaths in Africa rise by 43% in a week; UK reports 48,553 new cases in highest total since mid-January",,"Nadeem Badshah (now); Mattha Busby  ,Matthew Weaver, Martin Belam ,Helen Sullivan (earlier)","Thu, 15 Jul 2021 19:33:50 GMT"
"Long Covid has more than 200 symptoms, study finds",Calls for national screening programme as symptoms revealed range from brain fog to tinnitus,Linda Geddes Science correspondent,"Thu, 15 Jul 2021 09:00:37 GMT"
How lockdown has a cruel way of making a mockery of our life circumstances | Brigid Delaney,"Almost everyone’s existence – their partner, their lack of partner, their children, their job – conspires against them when they’re shut inside",Brigid Delaney,"Thu, 15 Jul 2021 17:30:48 GMT"
The person to ‘weaken’ America: what the Kremlin papers said about Trump,Documents appear to show how Russian intelligence worked to install their preferred candidate as president,Luke Harding and Dan Sabbagh,"Thu, 15 Jul 2021 17:05:31 GMT"
Tones and I: Welcome to the Madhouse review – a disappointing pastiche of pop trends,"After a global hit as odd as Dance Monkey, Toni Watson had dream conditions to write a debut. Instead, the album is unadventurous and occasionally exhausting",Shaad D'Souza,"Thu, 15 Jul 2021 17:30:48 GMT"
"A bee: before it dies, its mouth opens and closes, kissing the ground | Helen Sullivan","Its favourite thing to do is to crawl inside a flower, where petals turn light pink, yellow or red",Helen Sullivan,"Thu, 15 Jul 2021 19:00:49 GMT"
‘People don’t have time to search’: how clear instructions could help Australians recycle better,Most of us believe that recycling is important – but many find figuring out how to do it properly confusing,Justine Landis-Hanley,"Thu, 15 Jul 2021 17:30:49 GMT"
The Rabbits by Sophie Overett review – a unique and captivating tangle of magic and mystery,"It’s an ambitious undertaking to interweave literary fiction and magic realism, but Overett executes it beautifully in this deliciously unsettling debut",Giselle Au-Nhien Nguyen,"Thu, 15 Jul 2021 17:30:48 GMT"
The Open 2021: Louis Oosthuizen leads after first round – as it happened,;,Scott Murray,"Thu, 15 Jul 2021 19:14:26 GMT"
Tadej Pogacar powers up last mountain test to take Tour de France stage 18,;,Jeremy Whittle in Pierrefitte,"Thu, 15 Jul 2021 16:08:13 GMT"
Fury v Wilder rematch postponed after Tyson Fury tests positive for Covid-19,;,PA Media and Guardian sport,"Thu, 15 Jul 2021 17:41:22 GMT"
Alun Wyn Jones arrives in South Africa and lands place on Lions bench,;,Robert Kitson in Cape Town,"Thu, 15 Jul 2021 15:23:05 GMT"
The European ruling on headscarves opens the way to rank discrimination | Polly Toynbee,Humanists like me believe in people’s right to express their religious identity - or lack of it – however they see fit,Polly Toynbee,"Thu, 15 Jul 2021 13:20:42 GMT"
"As global covid vaccine passports become a reality, we have to make sure they’re fair | Laura Spinney",Discrimination against those from poorer countries seems inevitable unless everyone accepts the WHO’s guidelines,Laura Spinney,"Thu, 15 Jul 2021 12:20:41 GMT"
There’s a new tactic for exposing you to radical content online: the ‘slow red-pill’ | Joshua Citarella,The far right is trying to funnel people on Instagram to extreme content with a few simple tricks. Here’s how they do it,Joshua Citarella,"Thu, 15 Jul 2021 10:21:38 GMT"
Abolishing online anonymity won’t tackle the underlying problems of racist abuse | Hussein Kesvani,"As a person of colour, I’ve suffered online abuse, but ending anonymity and mandatory ID verification each raise problems",Hussein Kesvani,"Thu, 15 Jul 2021 08:00:36 GMT"
Burnout eating: how chronic pandemic stress can disrupt and destroy our diet,"Over the past year, many of us have suffered from physical and emotional exhaustion. It is no surprise that people have turned to food for comfort",Nicola Slawson,"Thu, 15 Jul 2021 09:00:37 GMT"
Emily Blunt’s 20 best film performances – ranked!,"With her latest movie, Jungle Cruise, out this month, we round up the finest work by the star of The Devil Wears Prada and A Quiet Place Part II",Ryan Gilbey,"Thu, 15 Jul 2021 12:00:40 GMT"
Jackson Browne: Downhill from Everywhere review – voice of the boomers faces his mortality,,Alexis Petridis,"Thu, 15 Jul 2021 11:00:39 GMT"
Australian singer known as Jimmy Beloved jailed for 21 years for sexually abusing young fans,Newcastle musician and former band frontman Daniel Hanson pleaded guilty to a string of offences relating to sexual abuse of victims aged between 12 and 22,Australian Associated Press,"Thu, 15 Jul 2021 11:25:29 GMT"
Sydney’s ever-growing Covid hotspot list exposes NSW government’s lockdown failures,,Anne Davies,"Thu, 15 Jul 2021 08:48:25 GMT"
"One-hour, optional sexual harassment training for Australian MPs a ‘tick and flick exercise’, union says",Public sector union has criticised government’s ‘half-hearted’ response to women’s workplace safety,Amy Remeikis,"Thu, 15 Jul 2021 09:29:46 GMT"
"South Africa: 10,000 troops deployed and reservists called up to quell unrest","Warnings of looming humanitarian crisis as looting and violence hits food, fuel and medicine chains",Jason Burke Africa correspondent,"Thu, 15 Jul 2021 15:29:48 GMT"
Russia bans media outlet that published Vladimir Putin scoops,Proekt outlawed in act of revenge for embarrassing revelations about the president and top Kremlin officials,Andrew Roth in Moscow,"Thu, 15 Jul 2021 16:51:56 GMT"
Biden praises child tax credit payments as ‘historic’ step to end child poverty – live,;,Joan E Greve in Washington,"Thu, 15 Jul 2021 19:44:07 GMT"
First Nation calls for release of school records to identify residential victims,• Indigenous community seeks Canada state and church records,Leyland Cecco in Toronto,"Thu, 15 Jul 2021 18:55:31 GMT"
Cocaine stash worth €9m lands on roof of home in Sardinia,"Startled owners hear a loud bang and call the police, who find a black suitcase filled with drugs",Angela Giuffrida in Rome,"Thu, 15 Jul 2021 15:47:28 GMT"
Israeli spyware firm linked to fake Black Lives Matter and Amnesty websites – report,"Researchers say web domains masquerading as activist, health and media groups are used by governments to hack targets",Sam Levin in Los Angeles,"Thu, 15 Jul 2021 15:18:23 GMT"
US west and Canada brace for another heatwave amid more than 70 wildfires,"Combined area of blaze is about 1,562 sq miles while next heatwave expected to start on Saturday ","Ed Pilkington in New York, Gabrielle Canon in San Francisco and agencies","Thu, 15 Jul 2021 19:10:19 GMT"
"EU companies can ban employees wearing headscarves, court rules",Prohibition can only be implemented against all religious symbols as part of a policy of neutrality,Jennifer Rankin in Brussels,"Thu, 15 Jul 2021 11:24:24 GMT"
Revolut co-founder Nik Storonsky set to join the multibillionaire club,Banking and payments app launched six years ago valued at £24bn in deal secured by 36-year-old CEO,Mark Sweney,"Thu, 15 Jul 2021 14:22:06 GMT"
"Renée Dorléac, actor and mother of Catherine Deneuve, dies aged 109",Star who dubbed French versions of talkies starring Olivia de Havilland and Judy Garland quit acting during second world war,Staff and agencies,"Thu, 15 Jul 2021 13:44:25 GMT"
Germany floods: stranded residents rescued by helicopter from rooftops – video,"At least 58 people have died and dozens more were missing in Germany on Thursday as swollen rivers caused by record rainfall across western Europe swept through towns and villages. Many of the victims died around the wine-growing region of Ahrweiler, in Rhineland-Palatinate state, police said, and dozens were still unaccounted for, after the Ahr river that flows into the Rhine broke its banks and brought down half a dozen houses",None found,"Thu, 15 Jul 2021 19:29:28 GMT"
Vanuatu’s golden passports,"A Guardian investigation has revealed that a scheme allowing foreign nationals to purchase citizenship in Vanuatu saw more than 2,000 people granted “golden passports” – and with it visa-free access to the EU and UK – in 2020. Among them are senior political figures from around the world, as well as several convicted and alleged criminals. While such citizenship schemes are not illegal or unusual, some experts have warned that this system could create a backdoor for criminals to enter the EU, and may encourage illegal operations in the broader Pacific area. Pacific Editor Kate Lyons and freelance reporter Euan Ward speak to Laura Murphy-Oates about how this passport scheme works and how it could be exploited","Presented by Laura Murphy-Oates and reported by Euan Ward; produced by Ellen Leabeater, Joe Koning, Camilla Hannan, Allison Chan, Kate Lyons and Jane Lee. The executive producers are Miles Martignoni and Gabrielle Jackson","Wed, 14 Jul 2021 23:00:25 GMT"
The best of Latin American photojournalism – in pictures,The fourth annual Latin American Foto festival at the ,Sarah Gilbert,"Thu, 15 Jul 2021 08:00:36 GMT"
Seth Meyers on GOP voting restrictions in Texas: ‘They’re not hiding it or being shy about it’,"Late-night hosts discuss GOP efforts to restrict voting in Texas, Olivia Rodrigo’s White House visit and new details from the last days of Trump’s presidency",Adrian Horton,"Thu, 15 Jul 2021 15:16:51 GMT"
