Aussie healthcare revolution: Major Medicare shake-up,"Wearable health monitors, instant in clinic blood tests, diagnosis assisted by computers and genetic screening will be part of a revolution in GP care starting next July.",None found,"Wed, 13 Oct 2021 07:00:00 +0000"
Sanctions looming as NRL hits out at Panthers GF antics,NRL chief executive Andrew Abdo has confirmed the game is reviewing an unsavoury social media post from Tyrone May and spoken of his disappointment with the antics of Penrith players in the aftermath to their historic grand final win.,None found,"Wed, 13 Oct 2021 07:00:00 +0000"
"Harvey, Singo hoping star mare can break ‘Libertini curse’","When Libertini became troubled by a hoof issue earlier this month, her owner Gerry Harvey blamed it on the curse.",None found,"Wed, 13 Oct 2021 07:00:00 +0000"
Regional travel delay as Grafton gets more venues of concern,Regional travel may remain banned as concerns linger over relatively low vaccination rates in the region.,None found,"Thu, 14 Oct 2021 19:48:00 +0000"
‘Dangerous escalation’: City in absolute chaos,Tank deployments and deadly exchanges of fire turned Beirut into a war zone after a demonstration organised by Shiite parties against the lead investigator into last year’s devastating port blast turned violent.,None found,"Thu, 14 Oct 2021 19:42:00 +0000"
ASX set to rise as Wall St rallies,"Welcome to the Trading Day blog for Friday, October 15.",None found,"Thu, 14 Oct 2021 19:41:00 +0000"
Here’s what you can expect with tomorrow’s Gosford weather,Tomorrow's forecast is becoming windy; partly cloudy.,None found,"Fri, 15 Oct 2021 07:30:23 +0000"
Here’s what you can expect with tomorrow’s Bowral weather,Tomorrow's forecast is shower or two; windy.,None found,"Fri, 15 Oct 2021 07:30:23 +0000"
‘THE GREATEST CRISIS’: Behind the pandemic’s most shocking photo,The photographer of one of the most controversial pictures of the Covid-19 pandemic has revealed what happened in the devastating weeks after. Warning: Distressing,None found,"Sat, 16 Oct 2021 07:48:31 +0000"
Latest business liquidations in Dubbo Regional,NO liquidation appointment notices have been listed for businesses in the Dubbo Regional Local Government Area so far today. The total for the past year is 22.,None found,"Sat, 16 Oct 2021 07:45:22 +0000"
Latest business liquidations in Bathurst Regional,NO liquidation appointment notices have been listed for businesses in the Bathurst Regional Local Government Area so far today. The total for the past year is 12.,None found,"Sat, 16 Oct 2021 07:45:22 +0000"
Latest business liquidations in Forbes,NO liquidation appointment notices have been listed for businesses in the Forbes Local Government Area so far today. The total for the past year is four.,None found,"Sat, 16 Oct 2021 07:45:22 +0000"
Latest business liquidations in Bunbury,NO liquidation appointment notices have been listed for businesses in the Bunbury Local Government Area so far today. The total for the past year is three.,None found,"Sat, 16 Oct 2021 07:45:22 +0000"
Latest business liquidations in Edward River,NO liquidation appointment notices have been listed for businesses in the Edward River Local Government Area so far today. The total for the past year is one.,None found,"Sat, 16 Oct 2021 07:45:22 +0000"
Latest business liquidations in Carrathool,NO liquidation appointment notices have been listed for businesses in the Carrathool Local Government Area so far today. The total for the past year is one.,None found,"Sat, 16 Oct 2021 07:45:22 +0000"
Latest business liquidations in Dardanup,NO liquidation appointment notices have been listed for businesses in the Dardanup Local Government Area so far today. The total for the past year is one.,None found,"Sat, 16 Oct 2021 07:45:22 +0000"
New freedoms as NSW vax rate surges,Welcome to Monday’s live coverage of Australia’s Covid-19 situation.,None found,"Sun, 17 Oct 2021 19:53:00 +0000"
SA lists three new COVID exposure sites,South Australian health authorities have listed three new exposure sites linked to a COVID-positive truck driver who entered the state from Victor,None found,"Sun, 17 Oct 2021 19:50:08 +0000"
‘I’m Swimming Here’: Whale Spotted Off Staten Island,"A whale was spotted breaching the waters of Raritan Bay off Staten Island on Friday, October 15 — a rare sighting captured on video by a local fisherman. Thomas Fisher told Storyful that he was casting in the bay on Friday afternoon when he spotted the whale. Fisher said the whale came up around five or six times. Humpback whales have been spotted several times in recent years in waters off New York City. In December 2020, a whale was seen in the Hudson River, exciting locals. Credit: Thomas Fisher via Storyful",None found,"Sun, 17 Oct 2021 19:49:05 +0000"
Group of Americans kidnapped in Haiti,"One of the 17 missionaries kidnapped in Haiti on Saturday sent a harrowing cry for help on WhatsApp as the group of 16 Americans and one Canadian were being abducted, according to a report.",None found,"Sun, 17 Oct 2021 19:47:00 +0000"
Child groomer caught with child abuse material while on bail,"A Jesmond man who tried to groom what he believed was a 14-year-old girl online, before being caught with child abuse material while on bail, will spend more than a year behind bars.",None found,"Sun, 17 Oct 2021 19:47:00 +0000"
Body found in ‘difficult and dangerous’ spot,Police are calling on the public for help to identify a man after he was discovered dead in a creek in Townsville on Sunday afternoon.,None found,"Sun, 17 Oct 2021 19:46:00 +0000"
CCTV released in appeal for suspicious fire at Glebe cafe,Police have released CCTV and are appealing for public assistance as investigations continue into a suspicious fire in Glebe.,None found,"Sun, 17 Oct 2021 19:45:54 +0000"
Queensland declares southern Tasmania a hotspot,Queensland has declared all of southern Tasmania a hotspot as it enters a three day lockdo,None found,"Sat, 16 Oct 2021 05:17:35 +0000"
Winx scenes as Art Cadeau claims Kosciuszko,"This wasn’t Winx, this was Art Cadeau – but they were familiar, emotional scenes at Royal Randwick.",None found,"Sat, 16 Oct 2021 05:16:00 +0000"
Where to find the cheapest fuel in The Hills Shire,THE average price of U91 unleaded petrol in The Hills Shire this afternoon was 170.3 cents a litre.,None found,"Sat, 16 Oct 2021 05:15:22 +0000"
Where to find the cheapest fuel in the North Shore,THE average price of U91 unleaded petrol in the North Shore this afternoon was 177.0 cents a litre.,None found,"Sat, 16 Oct 2021 05:15:22 +0000"
Where to find the cheapest fuel in Port Macquarie,THE average price of U91 unleaded petrol in Port Macquarie this afternoon was 156.7 cents a litre.,None found,"Sat, 16 Oct 2021 05:15:22 +0000"
Where to find the cheapest fuel in Hornsby,THE average price of U91 unleaded petrol in Hornsby this afternoon was 178.0 cents a litre.,None found,"Sat, 16 Oct 2021 05:15:22 +0000"
Where to find the cheapest fuel in Wollongong,THE average price of U91 unleaded petrol in Wollongong this afternoon was 159.3 cents a litre.,None found,"Sat, 16 Oct 2021 05:15:22 +0000"
Where to find the cheapest fuel in Parramatta,THE average price of U91 unleaded petrol in Parramatta this afternoon was 167.0 cents a litre.,None found,"Sat, 16 Oct 2021 05:15:22 +0000"
Check out the latest on Fairfield roads,LATEST traffic alerts and road works for the Fairfield region:,None found,"Sat, 16 Oct 2021 05:15:22 +0000"
‘Not possible’: Stark warning for NSW,Welcome to Tuesday’s live coverage of Australia’s Covid-19 situation.,None found,"Mon, 18 Oct 2021 19:46:00 +0000"
Leilua to walk over Tigers’ shocking $800k pay cut,This would be among the biggest pay cuts in rugby league’s 113-year history.,None found,"Mon, 18 Oct 2021 19:44:00 +0000"
Yellow Wiggle Emma quits the group,"The Wiggles have today announced that Yellow Wiggle Emma Watkins will depart the popular children’s group at the end of this year, telling fans she felt she was “missing out” spending so much of her time touring.",None found,"Mon, 18 Oct 2021 19:40:00 +0000"
Severe storms tear through southern Queensland,A tornado has torn its way across parts of southern Queensland as severe storm activity lashes the sta,None found,"Mon, 18 Oct 2021 19:37:15 +0000"
Government will ‘at a minimum’ need nuclear if it joins ‘net zero bandwagon’,"Without baseload by way of nuclear, net zero by 2050 looks more and more like economic and strategic “self-harm,” according to Sky News host Peta Credl",None found,"Tue, 19 Oct 2021 07:33:33 +0000"
‘Absolute tragedy’: Hidden truth behind shock call,Essendon stalwart Ted Fordham has revealed a debate with the club over an insurance policy was what slammed the door shut on teammate John Coleman’s remarkable career at just 25 years of age.,None found,"Tue, 19 Oct 2021 07:33:00 +0000"
Here’s what you can expect with tomorrow’s Central Sydney weather,Tomorrow's forecast is showers.,None found,"Tue, 19 Oct 2021 07:30:23 +0000"
South Coast News Newsletter,South Coast News Newsletter,None found,"Tue, 19 Oct 2021 19:44:55 +0000"
Mother begs for help to find Cleo,"Wet-eyed and struggling to speak at times, the mother of missing West Australian girl Cleo Smith has told of the moment she woke inside the family tent on Saturday morning to find it “completely open” and her little girl gone.",None found,"Tue, 19 Oct 2021 19:44:16 +0000"
Last waterfront block to become $8.9m apartments,The construction of an $8.9 million dollar apartment building just metres from the ocean is part of a development boom on the south coast amid an ongoing housing crisis.,None found,"Tue, 19 Oct 2021 19:43:00 +0000"
WA won’t reopen border to NSW and Victoria,Western Australia Premier Mark McGowan has ruled out reopening the border in time for Christma,None found,"Tue, 19 Oct 2021 19:40:57 +0000"
"Simmons kicked out, teammate slams Aussie",Ben Simmons was booted out of practice on Wednesday and suspended for one game as he seems determined to kick stones and force Philadelphia to trade him.,None found,"Tue, 19 Oct 2021 19:38:00 +0000"
‘Hope they don’t stuff it up’: Mayor probed for criticising state’s vaccine rollout,The rights of every local government councillor to openly criticise the Queensland Government is at risk after a mayor found himself under investigation for questioning the vaccine rollout.,None found,"Tue, 19 Oct 2021 19:37:00 +0000"
Illawarra Star Newsletter,Illawarra Star Newsletter,None found,"Tue, 19 Oct 2021 19:34:06 +0000"
Reject Shop warns of Covid stock shortfall,"Discount retailer The Reject Shop has warned that disruptions to global supply chains caused by the pandemic would likely continue through to June, impacting stock availability in its stores and adding costs to the business.",None found,"Wed, 20 Oct 2021 07:27:00 +0000"
Market Close 20 Oct 21: ASX 200 rose for a 4th time in 5 days,"While the Australian sharemarket faded from this morning's three-week high, the ASX 200 still managed to lift for a fourth time in five days. Energy stocks and telcos both fell while all other sectors improved.",None found,"Wed, 20 Oct 2021 07:26:49 +0000"
What makes finding the next Tiger leader so hard?,"After surviving a unique season of AFL footy, the attention is already shifting to what 2022 may hold.",None found,"Wed, 20 Oct 2021 07:21:00 +0000"
‘Huge emotional cost’ to NSW regional travel ban,"Moree Mayor Katrina Humphries says travel between Sydney and regional New South Wales should resume earlier than November 1 because there is a “huge emotional cost” to the ban, which is also impacting the tourism industr",None found,"Wed, 20 Oct 2021 07:20:48 +0000"
Johnson backs ‘professional’ Tillies,Football: Football Australia CEO James Johnson says the Matildas will put any headlines behind them when they take on Brazil next week.,None found,"Wed, 20 Oct 2021 07:20:06 +0000"
More police challenge vax mandate on consent grounds,Twenty four police employees have launched a new Supreme Court legal challenge to Police Commissioner Katarina Carroll’s mandatory Covid-19 vaccination directive.,None found,"Wed, 20 Oct 2021 07:19:00 +0000"
Cocaine trafficking syndicate busted in Melbourne,"Police seized cocaine with a street value of $280,000 from a warehouse that was turned into an accommodation facility in Moorabbin.",None found,"Wed, 20 Oct 2021 07:18:19 +0000"
Huge number of Aussies fighting for jobs,"A staggering one in 27 Aussies are competing for each entry-level job, according to a new report.",None found,"Thu, 21 Oct 2021 07:46:00 +0000"
Latest business liquidations in Ashburton,NO liquidation appointment notices have been listed for businesses in the Ashburton Local Government Area so far today. The total for the past year is one.,None found,"Thu, 21 Oct 2021 07:45:23 +0000"
Latest business liquidations in Bayside (NSW),THERE have been two company liquidation notices in the Bayside (NSW) Local Government Area today and 85 for the past year.,None found,"Thu, 21 Oct 2021 07:45:23 +0000"
Latest business liquidations in Belmont,THERE has been one company liquidation notice in the Belmont Local Government Area today and 16 for the past year.,None found,"Thu, 21 Oct 2021 07:45:23 +0000"
Latest business liquidations in Blayney,NO liquidation appointment notices have been listed for businesses in the Blayney Local Government Area so far today. The total for the past year is 17.,None found,"Thu, 21 Oct 2021 07:45:23 +0000"
Latest business liquidations in Capel,NO liquidation appointment notices have been listed for businesses in the Capel Local Government Area so far today. The total for the past year is four.,None found,"Thu, 21 Oct 2021 07:45:23 +0000"
Latest business liquidations in Canada Bay,THERE have been two company liquidation notices in the Canada Bay Local Government Area today and 40 for the past year.,None found,"Thu, 21 Oct 2021 07:45:23 +0000"
Latest business liquidations in Broome,NO liquidation appointment notices have been listed for businesses in the Broome Local Government Area so far today. The total for the past year is one.,None found,"Thu, 21 Oct 2021 07:45:23 +0000"
Latest business liquidations in Cambridge,NO liquidation appointment notices have been listed for businesses in the Cambridge Local Government Area so far today. The total for the past year is 18.,None found,"Thu, 21 Oct 2021 07:45:23 +0000"
South Coast News – Breaking Newsletter,South Coast News - Breaking Newsletter,None found,"Thu, 21 Oct 2021 19:40:14 +0000"
Plans for new $17m Woolies in founder’s hometown revealed,Woolworths have revealed plans for its proposed $17 million upgrade of the Kiama Village shopping Centre.,None found,"Thu, 21 Oct 2021 19:36:00 +0000"
Forum creditors vote for committee to rake through ruins,"One of the alleged architects of the Forum business watched on as creditors voted to form a committee of inspection of the ruins of the company that allegedly bankrolled fast cars, boats and a property empire.",None found,"Fri, 22 Oct 2021 07:27:00 +0000"
Geelong developer seeks American burger chain store buyer,"A major Armstrong Creek developer is on the hunt for a buyer to snap up a 12-year lease for new American fast food store, Carl’s Jr, which is set to open in mid-2022.",None found,"Fri, 22 Oct 2021 07:24:00 +0000"
Daniel Andrews ‘wants to pretend his COVID plan has worked’,Sky News host Chris Kenny says Victorian Premier Daniel Andrews “wants to pretend that his plan has worked” to open up the state as he repeals restrictions with record-high levels of cas,None found,"Fri, 22 Oct 2021 07:22:37 +0000"
Prop gun fired by Alec Baldwin kills woman on set: police,"US actor Alec Baldwin fired a prop gun that killed a cinematographer and wounded the director on a film set in New Mexico, US law enforcement said Friday.",None found,"Fri, 22 Oct 2021 07:21:51 +0000"
"101mm in an hour, tornado, airport damage as more storms roll in","The Burea of Meteorology has confirmed a tornado from a supercell thunderstorm hit near Brisbane airport on Friday morning, with people in the area describing terrifying scenes on the ground.",None found,"Fri, 22 Oct 2021 02:50:00 +0000"
Man suffers facial injuries after Skiff Club fall,An emergency operation is underway in Manly after a man suffered multiple serious injuries after falling at least three metres.,None found,"Fri, 22 Oct 2021 02:50:00 +0000"
Astro Waetford and Elias Hachem arrested on October 13,Six Sydney Airport workers have been arrested and accused of being part of a criminal syndicate involved in a failed plan to smuggle drugs into Australia.,None found,"Fri, 22 Oct 2021 02:49:54 +0000"
Water sport heroes go head-to- head about vaccine,There’s division in the ranks of Surf Life Saving Australia.,None found,"Fri, 22 Oct 2021 02:49:00 +0000"
"Victoria records 2,189 COVID-19 cases, 16 deaths","Victorian Premier Daniel Andrews says 2,189 cases of COVID-19 were recorded with one acquired from oversea",None found,"Fri, 22 Oct 2021 02:48:34 +0000"
Mission Zero Network Collection,Mission Zero Network Collection,None found,"Fri, 22 Oct 2021 02:47:25 +0000"
Latest business liquidations in Burwood,NO liquidation appointment notices have been listed for businesses in the Burwood Local Government Area so far today. The total for the past year is 18.,None found,"Fri, 22 Oct 2021 02:45:23 +0000"
Latest business liquidations in Busselton,NO liquidation appointment notices have been listed for businesses in the Busselton Local Government Area so far today. The total for the past year is two.,None found,"Fri, 22 Oct 2021 02:45:23 +0000"
Baldwin was practicing drawing gun when he fired fatal shot: director,"Alec Baldwin was practicing drawing his gun from his holster and pointing it at the camera when he fatally shot cinematographer Halyna Hutchins on the set of the movie ""Rust,"" the director said in a search-warrant affidavit.",None found,"Mon, 25 Oct 2021 18:31:58 +0000"
Historic World Cup bloodbath is pure carnage,Spinner Mujeeb Ur Rahman took five wickets in Afghanistan’s record 130-run rout of Scotland in their opening Super 12s match of the Twenty20 World Cup.,None found,"Mon, 25 Oct 2021 18:31:00 +0000"
Second coming: Bathurst-winning ace creates dream team,Nick Percat is targeting a move up the Supercars grid when he teams with Chaz Mostert at Walkinshaw Andretti United next year in a return to the squad where he won a Bathurst 1000 crown on debut.,None found,"Tue, 26 Oct 2021 07:30:00 +0000"
Stoned and away: Soap star’s shock confession,Much-loved Summer Bay soap star Lynne McGranger has revealed her old habit of regular cannabis usage in an upcoming memoir set to shock.,None found,"Tue, 26 Oct 2021 07:30:00 +0000"
"You can ask, but don’t expect an answer","Adelaide’s largest council will no longer answer questions from councillors on behalf of ratepayers if they are not important enough, critical of staff, or too time consuming.",None found,"Tue, 26 Oct 2021 07:30:00 +0000"
Kiwi’s ‘absurd’ act stuns cricket world,Fast bowler Haris Rauf took a career best 4-22 to help Pakistan defeat New Zealand by five wickets and record their second successive win in the T20 World Cup.,None found,"Tue, 26 Oct 2021 19:40:00 +0000"
Australia cops it in international headlines,Australia has copped criticism across global headlines overnight as the world reacted to Prime Minister Scott Morrison’s new plan to tackle climate change.,None found,"Tue, 26 Oct 2021 19:39:00 +0000"
WA threatens to close border to rest of Australia,Western Australia could close its border to jurisdictions planning to ease travel restrictions with New South Wales and Victor,None found,"Tue, 26 Oct 2021 19:34:06 +0000"
Kerr’s brilliance can’t hide ugly Matildas issue,The defensive frailties that have plagued the Matildas in recent times reared their ugly head again as Australia coughed up a lead to draw 2-2 with Brazil in Tuesday night’s friendly.,None found,"Tue, 26 Oct 2021 19:33:00 +0000"
Kardashian rocker’s saucy history with Sophie Monk,Before Travis Barker put a ring on the oldest Kardashian sister there was a time when he was briefly locking lips with Aussie songstress turned reality TV star Sophie Monk.,None found,"Wed, 27 Oct 2021 07:53:00 +0000"
Shock details emerge during police interview played in murder trial,A jury has heard during a police interview a woman accused of murder said her mother had been drinking and was aggressive the last time she saw her alive.,None found,"Wed, 27 Oct 2021 07:52:00 +0000"
"Australian Footballer Announces He’s Gay, Believed to Be Only Current Male Top-Flight Player to Be Out","Adelaide United player Josh Cavallo came out in an emotional video published on October 27 in which he told the public, “I’m a footballer and I’m gay.” SBS News said that it’s believed Cavallo is now the “only current, openly gay male professional footballer in the world.” Speaking from his home in Adelaide, Cavallo said: “growing up I always felt the need to hide myself, you know, because I was ashamed. Ashamed that I’d never be able to do what I love and be gay.” In the video, which was posted through Adelaide United’s social media profiles, he added that “All I want to do is play football and be treated equally.” Cavallo enthused about the “immense” support he has gotten since coming out, saying “I know there are other football players living in silence. I want to change this.” In a statement, Adelaide United Football Club said “Adelaide United, not only as a football club, but as the embodiment of an inclusive community, supports a remarkable and brave person.” Credit: Josh Cavallo/Adelaide United Football Club via Storyful",None found,"Wed, 27 Oct 2021 07:49:09 +0000"
"Crows, Port win from rule changes",ADELAIDE and Port Adelaide are the big winners from new rules to be introduced to the SANFL next season.,None found,"Wed, 27 Oct 2021 07:49:00 +0000"
GI v Burgess in superstar bush footy showdown,NRL legend Greg Inglis has confirmed a comeback to rugby league next season in what will be the most star-studded competition in bush footy.,None found,"Wed, 27 Oct 2021 07:46:00 +0000"
Willo backs Mr Brightside to shine in Cantala,Champion jockey Craig Williams wants to reward the patience of brothers Ben and JD Hayes with victory on Mr Brightside in Saturday’s $2m Group 1 Cantala Stakes (1600m) at Flemington.,None found,"Wed, 27 Oct 2021 07:46:00 +0000"
Morrison to release net zero modelling,Prime Minister Scott Morrison will fly to Rome today before making his way to Glasgow for the G20 summ,None found,"Wed, 27 Oct 2021 19:30:26 +0000"
Grog ban for drunk P-plater busted doing 150km/h in 60 zone,A Dubbo P-plate driver has narrowly avoided being sent to jail after he got behind the wheel while drunk and led police on a “hideous” high speed pursuit.,None found,"Thu, 28 Oct 2021 07:42:00 +0000"
Wild storms deliver light show over Melbourne,"A large storm front has lashed Melbourne on Thursday night, bringing with it a light show of thunder and lightning.",None found,"Thu, 28 Oct 2021 07:41:00 +0000"
Get back to business: API,"Australia’s Covid-19 response needs to move from crisis mode to business as usual, the country‘s second biggest pharmaceutical wholesaler says, as borders reopen and the government approves a third booster shot.",None found,"Thu, 28 Oct 2021 07:40:00 +0000"
‘The veil has been lifted’: Deborah Mailman on toxic politics,"If Deborah Mailman and her colleagues had any concerns that the first season of Total Control had put some noses out of joint at Parliament House, they needn’t have worried.",None found,"Thu, 28 Oct 2021 07:39:00 +0000"
Cranbourne tips: Mott the man for punters,Herald Sun form analyst Brad Waters runs the rule over Friday evening’s Cranbourne card.,None found,"Thu, 28 Oct 2021 07:37:00 +0000"
Rescuer warns baby wildlife at risk if felling work goes ahead,There are calls for a developer to delay tree felling for a major project over fears for the local wildlife.,None found,"Thu, 28 Oct 2021 19:52:00 +0000"
Unrelenting Cumbre Vieja Volcano Continues Erupting on Spain’s La Palma,"Crews in La Palma continued monitoring eruptions at the Cumbre Vieja volcano, which, more than a month after its initial eruption, had destroyed more than 2,000 buildings, according to official estimates. Video filmed by the Canary Islands Volcanology Institute (Involcan) from Tacande on Thursday evening shows the scene and a close-up of the lava fountain illuminating the darkening sky. The volcano first erupted on September 19. A new south lava flow was reactivated and was running parallel to another flow on Camino Aniceto as of Thursday, Involcan said. As of Wednesday, lava flows had destroyed 2,183 buildings, the EU’s Copernicus Emergency Management Service said. Credit: Involcan via Storyful",None found,"Thu, 28 Oct 2021 19:49:09 +0000"
Music legend died from drug cocktail,"Australian music promoter Michael Gudinski died from a fatal cocktail of drugs, it has been revealed.",None found,"Thu, 28 Oct 2021 19:47:00 +0000"
Australia avoids second COVID-19 recession despite extended lockdowns,"Australia will avoid a second COVID-19 recession, defying predictions extended lockdowns in Victoria and New South Wales would devastate the econo",None found,"Thu, 28 Oct 2021 19:46:46 +0000"
‘Very few good options’ for renewable energy without nuclear power,"Curtin University's Nigel Marks says he agrees with former chief scientist Alan Finkel, who says nuclear must be considered if Australia wants low emissions technolog",None found,"Fri, 29 Oct 2021 07:38:48 +0000"
