Fresh Lava Erupts From Volcano on La Palma,"Bright lava and thick smoke erupted from the Cumbre Vieja volcano on the Spanish island of La Palma around 8 pm on Monday, September 27, officials said. Video shared by Canary Islands Volcanology Institute (Involcan) shows lava spewing from the volcano on Monday evening. Copernicus EMS said satellite imagery indicated that some 513 homes and 18.9 kilometers (11.7 miles) of roadway had been destroyed by volcanic activity. Credit: Involcan via Storyful",None found,"Mon, 27 Sep 2021 19:45:06 +0000"
It’s time to put ‘shameful treatment’ of Australians behind us: Chris Kenny,Sky News host Chris Kenny says it is time to put the “shameful way we have treated each other” with state and international border closures behind ,None found,"Tue, 28 Sep 2021 07:29:07 +0000"
"Tennant man arrested on child sex, drug charges",A TENNANT Creek man has been arrested after allegedly sending a sexually explicit photo to a 15-year-old girl.,None found,"Tue, 28 Sep 2021 07:27:00 +0000"
Newcastle News – Newsletter Collection,Newcastle News - Newsletter Collection,None found,"Tue, 28 Sep 2021 07:25:49 +0000"
The Newcastle News,The Newcastle News,None found,"Tue, 28 Sep 2021 07:24:37 +0000"
NN-REC/NEWS/NATIONAL (071415),NN-REC/NEWS/NATIONAL (071415),None found,"Tue, 28 Sep 2021 07:23:38 +0000"
DT-NN-NLC-REC/NEWS/CENTRALCOAST (141445),DT-NN-NLC-REC/NEWS/CENTRALCOAST (141445),None found,"Tue, 28 Sep 2021 07:23:06 +0000"
Analysis: Australia’s vaccine rollout,More than 52 per cent of all Australians aged 16 and over are now fully vaccinated against COVID-,None found,"Tue, 28 Sep 2021 07:21:42 +0000"
$10k hit for man growing weed in spare bedroom,A TOWNSVILLE man caught growing cannabis in a “sophisticated” set up in his spare bedroom will lose thousands of dollars of hydroponic growing equipment and face fines.,None found,"Tue, 28 Sep 2021 07:21:00 +0000"
Shock as prediction of NT Covid-19 outbreak doesn’t happen,A RIDICULOUS conspiracy theory alleging Michael Gunner would pretend to stage a Covid-19 outbreak in the Greek community is yet to be rebuked by senior members of the Kalymnian Brotherhood.,None found,"Tue, 28 Sep 2021 19:30:00 +0000"
Suspended mayor: ‘We were not one team’,Suspended Central Coast Mayor Lisa Matthews has given her evidence at the Public Inquiry into the embattled council’s crisis.,None found,"Tue, 28 Sep 2021 19:30:00 +0000"
Coffs Harbour Breaking News Newsletter,Coffs Harbour Breaking News Newsletter,None found,"Wed, 29 Sep 2021 06:00:33 +0000"
Battle to save iconic Far North music venue,"AN ICONIC live music venue, played by top bands such as Midnight Oil and Mumford and Sons, is on the brink of closing after 40 years, leaving volunteers fighting to save it.",None found,"Wed, 29 Sep 2021 06:00:00 +0000"
‘Off the mark’ – pressure on Aussie star,Ellyse Perry is feeling the pressure well aware she needs to lift her bowling output as she prepares to spearhead the Australian Test attack.,None found,"Wed, 29 Sep 2021 06:00:00 +0000"
DT-NN-NLC-REC/NEWSLETTERS/WENTWORTH COURIER (171514),DT-NN-NLC-REC/NEWSLETTERS/WENTWORTH COURIER (171514),None found,"Wed, 29 Sep 2021 05:58:40 +0000"
"Vaccine chief, ex-foreign minister battle to become Japan’s PM","Japan's ruling party was picking its new leader Wednesday, with a mild-mannered former foreign minister and a Twitter-savvy vaccine chief battling to the final round in the race to become the country's next prime minister.",None found,"Wed, 29 Sep 2021 05:52:04 +0000"
‘We need certainty’: Tasmanian business calls for opening date,Peak business groups have appealed to the state government to provide greater certainty about when travel restrictions would be eased.,None found,"Thu, 30 Sep 2021 07:37:00 +0000"
Olympic champion pleads guilty to felony,"Klete Keller, a two-time Olympic gold medallist with the US swim team, pleaded guilty on Wednesday to participating in the January 6 attack on Congress by supporters of former president Donald Trump.",None found,"Thu, 30 Sep 2021 07:36:00 +0000"
‘Selfish’ drunk driver’s 92-metre trail of destruction revealed,A drunk driver had an open beer in his car when he ploughed into two parked vehicles and dragged them for more than 18 metres in a shocking crash on a busy Goulburn street.,None found,"Thu, 30 Sep 2021 07:35:00 +0000"
Premier urged to ‘stick to the plan’ as he sticks to his guns,PREMIER Peter Gutwein will take his defiant stand on border closures to Friday’s national cabinet meeting as federal colleagues urged him to stick to the plan for reopening.,None found,"Thu, 30 Sep 2021 07:35:00 +0000"
Facebook ‘friend’ Gil distances himself from bar owner,The AFL will investigate how two diehard fans snuck into the Demons changerooms and onto the ground for post-match celebrations as part of an annual security review into the grand final.,None found,"Thu, 30 Sep 2021 07:34:00 +0000"
"Why multiple ambulance crews, police rushed to marina","G’day Far Northerners, here’s everything you need to know about what’s happening across the region this week, September 27- October 1.",None found,"Thu, 30 Sep 2021 07:32:00 +0000"
Fake cop caught doing 160kmph with emergency lights,A 61-year-old was caught by cops doing 160km per hour with flashing blue and red emergency lights on his car.,None found,"Thu, 30 Sep 2021 07:32:00 +0000"
Meet Sydney’s biggest TikTok stars,Sydney’s top TikTok stars are raking in tens of thousands of dollars a month as the platform creates a new generation of internet icons with untold influence on young people.,None found,"Thu, 30 Sep 2021 07:32:00 +0000"
Paul Barry Needs Functioning Eyeballs,"Barry took particular aim at Bella d’Abrera, who said of documentary series The School That Tried to End Racism:",None found,"Wed, 29 Sep 2021 23:36:16 +0000"
Who is performing at the NRL Grand Final?,The pre-match entertainment for the NRL Grand Final has been unveiled and the line-up features plenty of homegrown Queensland talent.,None found,"Wed, 29 Sep 2021 23:34:00 +0000"
Planes rev the engines anticipating return to travel,For many months now planes have been grounded and collecting dust at a desert graveyard in the Northern Territory – but as vaccinations accelerate towards reopening targets – planes are revving the engin,None found,"Wed, 29 Sep 2021 23:30:53 +0000"
Here’s what you can expect with today’s Liverpool weather,Today's forecast is shower or two; possible storm.,None found,"Wed, 29 Sep 2021 23:30:17 +0000"
"‘We are swimming’: Flooding rain lashes Tassie, more on the way","SWOLLEN creeks, sodden farms and flash flooding wreaked havoc on the north and east coast of Tasmania on Friday, with more wet weather on the way this weekend.",None found,"Fri, 01 Oct 2021 07:46:00 +0000"
Koch takes dig at Crows’ handout,Port Adelaide chairman David Koch has taken a not-so-subtle dig at the Crows’ search for a new home in his best and fairest speech on Thursday night.,None found,"Fri, 01 Oct 2021 07:44:00 +0000"
NSW Realestate Newsletter,NSW Realestate Newsletter,None found,"Fri, 01 Oct 2021 07:42:21 +0000"
Biden back down: Democrats forced to delay infrastructure bill vote after progressive revolt,"Nancy Pelosi and House Democrats have been forced into an embarrassing backdown, after she failed to secure enough votes to pass a bipartisan $1.2 infrastructure bill.",None found,"Fri, 01 Oct 2021 07:42:10 +0000"
Waller preparing for another red-letter day,Hall of Fame trainer Chris Waller is omnipresent as his stable seeks to repeat a unique Group 1 grand slam at the feature Royal Randwick and Flemington meetings on Super Saturday.,None found,"Fri, 01 Oct 2021 07:42:00 +0000"
Sam Burgess opens up on ‘great relationship’,Former South Sydney star Sam Burgess has given an insight into the close relationship he shares with Rabbitohs coach Wayne Bennett.,None found,"Fri, 01 Oct 2021 19:41:00 +0000"
Star tears up following cancer battle,North Melbourne midfielder Ben Cunnington has broken down accepting runner-up in the club’s best and fairest award.,None found,"Fri, 01 Oct 2021 19:38:00 +0000"
NN-REC/SPORT/SUPERRACING/ALLNEWS (195112),NN-REC/SPORT/SUPERRACING/ALLNEWS (195112),None found,"Sat, 02 Oct 2021 07:53:04 +0000"
Kicked desk that helped Mantello lure Barassi to Roos,No greater North Melbourne figure roamed Arden St during the club’s golden era of the 1970s than Albert Mantello.,None found,"Sat, 02 Oct 2021 07:50:00 +0000"
Ex-PM Howard picks his candidate to replace Gladys,Former Prime Minister John Howard has thrown his support behind Treasurer Dominic Perrottet to become the next Premier of NSW saying he would bring ­“greater skill and experience” than the other contenders.,None found,"Sat, 02 Oct 2021 07:48:00 +0000"
NN-REC/SPORT/NRL/NRL NEWS – CM ONLY (165648),NN-REC/SPORT/NRL/NRL NEWS - CM ONLY (165648),None found,"Sat, 02 Oct 2021 07:47:09 +0000"
Daily Telegraph Newsletter Video Homepage,Daily Telegraph Newsletter Video Homepage,None found,"Sat, 02 Oct 2021 07:45:34 +0000"
NRL grand final date and venue confirmed,"ARL Commission chairman Peter V’landys says it’s “full steam ahead” for the NRL grand final, which will be played at Brisbane’s Suncorp Stadium on Sunday night unless Queensland records a sudden spike in Covid-19 cases tomorrow.",None found,"Sat, 02 Oct 2021 07:45:00 +0000"
Panthers roll dice in huge late gamble,Welcome to our live coverage of the 2021 NRL Grand Final between the Rabbitohs and Panthers.,None found,"Sun, 03 Oct 2021 07:54:00 +0000"
Caxton St ramps up for the NRL Grand Final,Crowds flock to Caxton St ahead of NRL Grand Final.,None found,"Sun, 03 Oct 2021 07:52:57 +0000"
Penrith and Souths fans party from afar,"They might be hundreds of kilometres away, but Penrith and South Sydney fans are lighting it up back home in locked-down NSW ahead of tonight’s NRL grand final.",None found,"Sun, 03 Oct 2021 07:51:00 +0000"
Mega Gallery: Caxton St floods with NRL fans,Thousands have flocked to Caxton Street ahead of Queensland’s first NRL grand final at Suncorp Stadium. CHECK OUT THE PICTURES,None found,"Sun, 03 Oct 2021 07:45:00 +0000"
"Where’s Charlene? Luggage, found in search for missing mum",The family of a young mother who has been missing for more than two weeks are pleading for information from the public after police confirmed they found items during a search for the 21-year-old.,None found,"Sun, 03 Oct 2021 07:35:00 +0000"
DT – The Weekend Collection,DT - The Weekend Collection,None found,"Sat, 02 Oct 2021 19:22:54 +0000"
Melbourne to reach pandemic milestone,Melbourne is set to surpass 245 days in lockdown – making it the most locked down city in the worl,None found,"Sat, 02 Oct 2021 19:18:28 +0000"
Where to find the cheapest fuel in Central Sydney,THE average price of U91 unleaded petrol in Central Sydney this morning was 158.6 cents a litre.,None found,"Sat, 02 Oct 2021 19:15:30 +0000"
Where to find the cheapest fuel in The Inner-West,THE average price of U91 unleaded petrol in The Inner-West this morning was 151.1 cents a litre.,None found,"Sat, 02 Oct 2021 19:15:30 +0000"
Where to find the cheapest fuel in Macarthur Camden,THE average price of U91 unleaded petrol in Macarthur Camden this morning was 149.8 cents a litre.,None found,"Sat, 02 Oct 2021 19:15:30 +0000"
Here’s what you can expect with tomorrow’s Blacktown weather,Tomorrow's forecast is mostly sunny.,None found,"Mon, 04 Oct 2021 07:31:14 +0000"
Here’s what you can expect with tomorrow’s Bankstown weather,Tomorrow's forecast is mostly sunny.,None found,"Mon, 04 Oct 2021 07:31:14 +0000"
Here’s what you can expect with tomorrow’s Dubbo weather,Tomorrow's forecast is mostly sunny.,None found,"Mon, 04 Oct 2021 07:31:14 +0000"
Here’s what you can expect with tomorrow’s The Hills Shire weather,Tomorrow's forecast is mostly sunny.,None found,"Mon, 04 Oct 2021 07:31:14 +0000"
Here’s what you can expect with tomorrow’s Liverpool weather,Tomorrow's forecast is partly cloudy.,None found,"Mon, 04 Oct 2021 07:31:14 +0000"
Here’s what you can expect with tomorrow’s North Sydney weather,Tomorrow's forecast is sunny; strong w'ly winds.,None found,"Mon, 04 Oct 2021 07:31:14 +0000"
Market Close 5 Oct 21: ASX 200 eased by 0.4% in volatile trade,"After having its best start to a week in two months on Monday, the Aussie market fell by 0.4% today. Tech stocks led the declines while energy stocks surged on firmer oil prices.",None found,"Tue, 05 Oct 2021 07:36:58 +0000"
China is ‘entrenching themselves in bad policy’,Former Foreign Minister Alexander Downer says the trouble with China is the public just “accepts what Xi Jinping says,None found,"Tue, 05 Oct 2021 07:36:36 +0000"
Barty OUT of Billie Jean King Cup,"Tennis: Australian Ash Barty has pulled out of the Billie Jean King Cup, resting up after a gruelling seven months on the road.",None found,"Tue, 05 Oct 2021 07:32:06 +0000"
Bushfire advice for three blazes near Stuart Hwy,THREE separate bushfires were burning between Three Ways and Larrimah along the Stuart Hwy on Wednesday afternoon.,None found,"Wed, 06 Oct 2021 07:41:00 +0000"
Man taken to hospital after rolling his car,A man was taken to hospital after rolling his car in Biggera Waters around 4:30 on Wednesday.,None found,"Wed, 06 Oct 2021 07:40:00 +0000"
‘Overwhelming’ economic benefits if Australia signs on to net zero,Liberal MP Jason Falinksi says the “economic benefits” for Australia in signing up to net-zero by 2050 are “overwhelming and can’t be understated,None found,"Wed, 06 Oct 2021 07:39:28 +0000"
New riders rev up motorcycle group’s profits,A three-year road map kickstarted a stellar financial year for Australia’s biggest motorcycle group helped along with a surge in new owners during the Covid-19 pandemic.,None found,"Wed, 06 Oct 2021 07:39:00 +0000"
Manly Daily,Manly Daily,None found,"Wed, 06 Oct 2021 03:46:50 +0000"
Latest: 11 businesses go into liquidation in NSW,ASIC has listed one company liquidation notice in New South Wales today.,None found,"Wed, 06 Oct 2021 03:45:11 +0000"
Latest: 4 businesses go into liquidation in WA,NO liquidation appointment notices have been listed by ASIC for Western Australia-based businesses so far today.,None found,"Wed, 06 Oct 2021 03:45:11 +0000"
Latest business liquidations in Armidale Regional,NO liquidation appointment notices have been listed for businesses in the Armidale Regional Local Government Area so far today. The total for the past year is five.,None found,"Wed, 06 Oct 2021 03:45:07 +0000"
Latest business liquidations in Ballina,THERE has been one company liquidation notice in the Ballina Local Government Area today and 14 for the past year.,None found,"Wed, 06 Oct 2021 03:45:07 +0000"
Latest business liquidations in Berrigan,NO liquidation appointment notices have been listed for businesses in the Berrigan Local Government Area so far today. The total for the past year is one.,None found,"Wed, 06 Oct 2021 03:45:07 +0000"
Latest business liquidations in Bassendean,NO liquidation appointment notices have been listed for businesses in the Bassendean Local Government Area so far today. The total for the past year is one.,None found,"Wed, 06 Oct 2021 03:45:07 +0000"
Latest business liquidations in Camden,NO liquidation appointment notices have been listed for businesses in the Camden Local Government Area so far today. The total for the past year is 30.,None found,"Wed, 06 Oct 2021 03:45:07 +0000"
Opposition proposes alternate roadmap to ‘get Victoria moving again’,Victorian Deputy Liberal Leader David Southwick says his party is calling on the Andrews government to adopt similar reopening measures to New South Wales to “get Victoria moving again”,None found,"Thu, 07 Oct 2021 07:50:24 +0000"
Racing SA maintains stance to end jumps racing,South Australian jumps racing is officially dead and buried after an 11th hour push to save the ailing form of racing failed to sway decision makers.,None found,"Thu, 07 Oct 2021 07:50:00 +0000"
Volunteers Clean Marseille Beach Strewn With Rubbish After Floods,"Volunteers cleaned a beach in Marseille, France, on October 6 after it was left strewn with rubbish in the wake of flooding. RFI said a “tide of trash” hit coastal areas near the city, as heavy rain washed away garbage that had accumulated due to a collection strike. This footage showing the cleanup efforts on Plage de l’Huveaune was posted to the Facebook group Marseille Villages. Marseille residents woke on October 4 to find 173 mm of rainfall had fallen overnight, with status red and orange warnings issued in response to the heavy downpour. Credit: Marseille Villages via Storyful",None found,"Thu, 07 Oct 2021 07:49:09 +0000"
Pies ‘laughing stock’ claim as board faces obliteration,Collingwood president Mark Korda is under pressure to walk away from the club after the entire Magpies board was sent hurtling towards obliteration.,None found,"Thu, 07 Oct 2021 07:49:00 +0000"
Aussie star’s bonus $577k for doing nothing,"Australian boxer Geroge Kambosos Jr stands to make an extra $577,000 after the the promoters of his upcoming lightweight title fight with Teofimo Lopez were found in default of their bid for the fight.",None found,"Thu, 07 Oct 2021 07:46:00 +0000"
Stunning abuse exposes football’s grassroots shame,Lisa De Vanna’s public complaints alleging abuse and harassment at the elite level of Australian football has triggered calls to widen the review amid claims there are more problems at the grassroots.,None found,"Thu, 07 Oct 2021 19:53:00 +0000"
$250m tower to be a drawcard for luxury buyers,"If living in a penthouse appeals to future apartment dwellers, the $250 million Paramount on Parkes complex could fit the bill when construction on the 47-storey tower at Harris Park wraps up.",None found,"Thu, 07 Oct 2021 19:53:00 +0000"
‘Risks too much’: Top doc’s warning,Welcome to Friday’s live coverage of Australia’s Covid-19 situation.,None found,"Thu, 07 Oct 2021 19:50:00 +0000"
Queensland reaches milestone with 50 per cent fully vaccinated,Queensland has reached a vaccination milestone despite its sluggish rollout with 50 per cent of the eligible population now fully vaccinat,None found,"Thu, 07 Oct 2021 19:49:23 +0000"
United States steps back from debt cliff… for now,The United States staved off a credit default Thursday that would have sent the global economy into a tailspin as Washington's warring political factions agreed to a stop-gap fix to raise the nation's debt limit.,None found,"Thu, 07 Oct 2021 19:44:54 +0000"
Gagged: Former teammates called to discredit star,Former New South Wales premier Morris Iemma has called for police to investigate any potential criminal allegations arising from explosive claims of a toxic culture within the Matildas and football in Australia.,None found,"Fri, 08 Oct 2021 02:26:00 +0000"
‘Great hope’ for stranded Queenslanders if home quarantine trials are successful,Queensland Premier Annastacia Palaszczuk says there is “great hope” for Queenslanders stranded past the borders with home quarantine soon to begin trials on Monday,None found,"Fri, 08 Oct 2021 02:25:53 +0000"
Biden stumbles his way through speech on vaccine mandates,President Joe Biden has stumbled his way through a speech about vaccine mandates as his administration tries to stem the growing tide of COVID-19 cases across America.,None found,"Fri, 08 Oct 2021 02:24:23 +0000"
How wife tried to safe husband who drowned near marina,"UPDATE, 12pm Friday:",None found,"Fri, 08 Oct 2021 02:19:00 +0000"
New mum stuck in NZ after flying to collect adopted baby,A Queensland Ambulance Service dispatcher has been stranded in New Zealand for three months by Covid travel restrictions after crossing the Tasman to adopt her sister’s baby.,None found,"Fri, 08 Oct 2021 02:18:00 +0000"
Queensland’s quarantine system’s backlog may continue for months,Emails obtained by Sky News shows Queensland's quarantine system is still swamped despite introducing more staff and home quarantine trial,None found,"Fri, 08 Oct 2021 02:17:23 +0000"
NSW leadership wheeling and dealing revealed,Premier Dominic Perrottet was always heir apparent.,None found,"Sat, 09 Oct 2021 19:38:00 +0000"
‘Nonstop’ Thunder Rumbles Amid Tornado-Warned Storm in South Dakota,"Thunder rumbled during a storm in Sisseton, South Dakota, on October 9. A tornado warning was issued for the area at the time by the National Weather Service, as a line of severe storms swept over the state’s northeast and into neighboring Minnesota. This video, posted to Twitter by Ruth H Hopkins, shows the thunderstorm in action at Sisseton. “The rumbling thunder is nonstop,” Hopkins wrote. Credit: Ruth H. Hopkins via Storyful",None found,"Sun, 10 Oct 2021 07:35:09 +0000"
Israel Folau crowned Gold Coast’s best player after just 5 games,"Israel Folau will take the Rugby League Gold Coast A-Grade Player of the Year trophy with him to Japanese rugby, though a week earlier than perhaps he and his Southport Tigers would have hoped.",None found,"Sun, 10 Oct 2021 07:32:00 +0000"
Here’s what you can expect with tomorrow’s Manly weather,Tomorrow's forecast is cloudy; rain periods; fresh s'ly winds.,None found,"Sun, 10 Oct 2021 07:31:13 +0000"
Here’s what you can expect with tomorrow’s Southern weather,Tomorrow's forecast is showers.,None found,"Sun, 10 Oct 2021 07:31:13 +0000"
NN-REC/SPORT/CRICKET (192515),NN-REC/SPORT/CRICKET (192515),None found,"Sun, 10 Oct 2021 19:07:44 +0000"
BBL powerless to stop umpire ‘howlers’ this summer,Cricket is holding its breath that DRS will be available for every Ashes Test this summer after it was ruled out as a pivotal tool for the Big Bash.,None found,"Sun, 10 Oct 2021 19:06:00 +0000"
Austria’s Kurz steps down over corruption probe,Austria's conservative Chancellor Sebastian Kurz resigned on Saturday to end a government crisis after his coalition partner said he was unfit to lead the country because he has been placed under investigation on suspicion of corruption. Freddie Joyner has more.,None found,"Sun, 10 Oct 2021 19:05:06 +0000"
Barnaby Joyce is the ‘key’ to Coalition reaching net zero deal,Sky News Political Editor Andrew Clennell says Deputy Prime Minister Barnaby Joyce's support is “key” to Prime Minister Scott Morrison reaching a deal with the Nationals on net zero before the COP26 conference in Glasgo,None found,"Tue, 12 Oct 2021 07:52:32 +0000"
Climate survey an ‘important reminder’ about the views of mainstream Australia,"Sky News host Peta Credlin says the howls from the Canberra Press Gallery on climate change and net zero ""do not reflect"" the views of mainstream Austral",None found,"Tue, 12 Oct 2021 07:49:08 +0000"
Latest business liquidations in Hilltops,NO liquidation appointment notices have been listed for businesses in the Hilltops Local Government Area so far today. The total for the past year is three.,None found,"Tue, 12 Oct 2021 07:45:22 +0000"
Latest business liquidations in Karratha,NO liquidation appointment notices have been listed for businesses in the Karratha Local Government Area so far today. The total for the past year is two.,None found,"Tue, 12 Oct 2021 07:45:22 +0000"
Latest business liquidations in Junee,NO liquidation appointment notices have been listed for businesses in the Junee Local Government Area so far today. The total for the past year is nine.,None found,"Tue, 12 Oct 2021 07:45:22 +0000"
Latest business liquidations in Goulburn Mulwaree,NO liquidation appointment notices have been listed for businesses in the Goulburn Mulwaree Local Government Area so far today. The total for the past year is three.,None found,"Tue, 12 Oct 2021 07:45:22 +0000"
Latest business liquidations in Hawkesbury,NO liquidation appointment notices have been listed for businesses in the Hawkesbury Local Government Area so far today. The total for the past year is 28.,None found,"Tue, 12 Oct 2021 07:45:22 +0000"
Latest business liquidations in Gosnells,THERE has been one company liquidation notice in the Gosnells Local Government Area today and 10 for the past year.,None found,"Tue, 12 Oct 2021 07:45:22 +0000"
Small business package announced for New South Wales,"The New South Wales government has announced grants of up to $20,000 for small and medium size businesses if they are affected by future restrictio",None found,"Tue, 12 Oct 2021 19:56:17 +0000"
DT Opinion Subscriber Newsletter,DT Opinion Subscriber Newsletter,None found,"Tue, 12 Oct 2021 19:54:02 +0000"
DT Syd Con Subscriber Newsletter,DT Syd Con Subscriber Newsletter,None found,"Tue, 12 Oct 2021 19:53:32 +0000"
DT Sport Subscriber Newsletter,DT Sport Subscriber Newsletter,None found,"Tue, 12 Oct 2021 19:52:46 +0000"
DT News AM Subscriber Newsletter,DT News AM Subscriber Newsletter,None found,"Tue, 12 Oct 2021 19:51:59 +0000"
NSW on track to hit 80 per cent double dose this week,"As COVID case numbers fall to their lowest daily figure in two months – the New South Wales vaccination rate could reach 80 per cent, this we",None found,"Tue, 12 Oct 2021 19:50:17 +0000"
Shops in vogue with funds chasing bigger deals,Big shopping centre deals are firmly back on the agenda and the latest wave of deals signals that their values have avoided a deep plunge in the wake of the coronavirus crisis.,None found,"Wed, 13 Oct 2021 07:01:00 +0000"
US VP Kamala Harris a ‘pretty worrying figure’,"Joe Biden is looking “so unsteady” that Kamala Harris could be president of the United States before the next election, according to Sky News host Chris Ken",None found,"Wed, 13 Oct 2021 07:00:39 +0000"
HOROSCOPES BY CAINER,Cainer monthly horoscopes,None found,"Wed, 13 Oct 2021 07:00:06 +0000"
