 The murderous plot against Julian Assange,The murderous plot against Julian Assange,John Jiggens,"Fri, 01 Oct 2021 12:00:00 +1000"
 CARTOONS: Mark David does diplomacy,CARTOONS: Mark David does diplomacy,Mark David,"Fri, 01 Oct 2021 10:00:00 +1000"
 From fascism to farce to the next election,From fascism to farce to the next election,Martin Hirst,"Fri, 01 Oct 2021 08:00:00 +1000"
 The risky business behind Morrison's submarine deal,The risky business behind Morrison's submarine deal,Lee Duffield,"Sat, 02 Oct 2021 16:00:00 +1000"
 Trevor St Baker and the latest push for nuclear energy,Trevor St Baker and the latest push for nuclear energy,David Paull,"Sat, 02 Oct 2021 12:00:00 +1000"
 Wren's Week: Scott Morrison is destroying Australia's future inside and out,Wren's Week: Scott Morrison is destroying Australia's future inside and out,None found,"Sat, 02 Oct 2021 08:00:00 +1000"
 Australia's music scene plunges deeper into poverty,Australia's music scene plunges deeper into poverty,Daniel Holmes,"Sun, 03 Oct 2021 16:00:00 +1000"
 IA Book Club: The Crime of Not Knowing Your Crime – Ric Throssell Against ASIO,IA Book Club: The Crime of Not Knowing Your Crime – Ric Throssell Against ASIO,Jim Kable,"Sun, 03 Oct 2021 12:00:00 +1000"
 Nurses in crisis under 'care-less' Coalition,Nurses in crisis under 'care-less' Coalition,Kylie Ward,"Sun, 03 Oct 2021 08:00:00 +1000"
" It's a pandemic, not Braveheart: 'Freedom day' complicates COVID fight","It's a pandemic, not Braveheart: 'Freedom day' complicates COVID fight",Victoria Fielding,"Mon, 04 Oct 2021 15:00:00 +1000"
" Berejiklian and Barilaro out, but let's not celebrate yet","Berejiklian and Barilaro out, but let's not celebrate yet",Jennifer Wilson,"Mon, 04 Oct 2021 13:00:00 +1000"
 The Australian 'police state' is nothing new,The Australian 'police state' is nothing new,Dechlan Brennan,"Mon, 04 Oct 2021 11:00:00 +1000"
 Frydenberg’s mental health accusations against Andrews exposed as baseless,Frydenberg’s mental health accusations against Andrews exposed as baseless,Alan Austin,"Mon, 04 Oct 2021 07:00:00 +1000"
 Outgoing NSW Premier Gladys 'The Great' Berejiklian joins 'Insniders',Outgoing NSW Premier Gladys 'The Great' Berejiklian joins 'Insniders',Michelle Pini,"Tue, 05 Oct 2021 08:00:00 +1000"
 Liberal Party trashing its own reputation,Liberal Party trashing its own reputation,Lee Duffield,"Tue, 05 Oct 2021 15:00:00 +1000"
 The Morrison clown show goes on,The Morrison clown show goes on,Lee Duffield,"Fri, 14 May 2021 16:30:00 +1000"
 We need to urgently talk about the nursing crisis in Australia,We need to urgently talk about the nursing crisis in Australia,Kylie Ward,"Sun, 03 Oct 2021 08:00:00 +1000"
 Partner visas the big winner in new Migration Program,Partner visas the big winner in new Migration Program,Lina Li,"Tue, 05 Oct 2021 11:00:00 +1000"
 NSW corruption: Gladys Berejiklian is just the beginning,NSW corruption: Gladys Berejiklian is just the beginning,Ross Jones,"Tue, 05 Oct 2021 07:00:00 +1000"
 Flashback 2019: Fires rage as Berejiklian ignores advice and decimates what's left,Flashback 2019: Fires rage as Berejiklian ignores advice and decimates what's left,Sue Arnold,"Wed, 06 Oct 2021 16:00:00 +1000"
 AUKUS nothing more than a re-election stunt,AUKUS nothing more than a re-election stunt,Geoff Davies,"Wed, 06 Oct 2021 15:00:00 +1000"
 The Coalition of climate criminals,The Coalition of climate criminals,Hannah Thomas,"Wed, 06 Oct 2021 11:00:00 +1000"
 Zuckerberg's metaverse comes with serious flaws,Zuckerberg's metaverse comes with serious flaws,Paul Budde,"Wed, 06 Oct 2021 07:00:00 +1000"
 Friendlyjordies and the NSW Government’s demise,Friendlyjordies and the NSW Government’s demise,Michelle Pini,"Thu, 07 Oct 2021 07:00:00 +1000"
 Conservatives like Tudge think they need history but not historians,Conservatives like Tudge think they need history but not historians,Paul Taucher,"Thu, 07 Oct 2021 15:00:00 +1000"
 WHAT'S ON: Boss Level — groundhog slay,WHAT'S ON: Boss Level — groundhog slay,Dan Jensen,"Thu, 07 Oct 2021 16:00:00 +1000"
" Under Morrison, Australia strives to be unincorporated territory of U.S.","Under Morrison, Australia strives to be unincorporated territory of U.S.",Peter Henning,"Thu, 07 Oct 2021 11:00:00 +1000"
 Morrison's AUKUS deal crippling foreign policy,Morrison's AUKUS deal crippling foreign policy,Paul Begley,"Fri, 08 Oct 2021 15:00:00 +1000"
 Berejiklian’s resignation ignites mainstream media lovefest,Berejiklian’s resignation ignites mainstream media lovefest,Hayden O'Connor,"Fri, 08 Oct 2021 07:00:00 +1000"
 LNP turmoil illuminates the power of institutional narratives,LNP turmoil illuminates the power of institutional narratives,Elroy Rosenberg,"Fri, 08 Oct 2021 11:00:00 +1000"
 CARTOONS: Mark David does a runner,CARTOONS: Mark David does a runner,Mark David,"Fri, 08 Oct 2021 09:00:00 +1000"
" The vaccination saga: Infections, hesitancy and inequality","The vaccination saga: Infections, hesitancy and inequality",Bilal Cleland,"Sat, 09 Oct 2021 15:00:00 +1000"
 IA Book Club: Two Revolutions and the Constitution,IA Book Club: Two Revolutions and the Constitution,Julie McNeill,"Sat, 09 Oct 2021 11:00:00 +1000"
 Fake vaccine passports making the pandemic more difficult,Fake vaccine passports making the pandemic more difficult,Tom Tanuki,"Sat, 09 Oct 2021 07:00:00 +1000"
 Coalition overreach: Twitter is not the problem,Coalition overreach: Twitter is not the problem,Martin Hirst,"Sun, 10 Oct 2021 08:00:00 +1000"
 Hitting the snooze button on Big Australia in the wake of COVID-19,Hitting the snooze button on Big Australia in the wake of COVID-19,Michael Bayliss,"Sun, 10 Oct 2021 16:00:00 +1000"
 Scotty from marketing sells the nation on Gladys' reputation,Scotty from marketing sells the nation on Gladys' reputation,Rocky Dabscheck,"Sun, 10 Oct 2021 12:00:00 +1000"
" Collaery's trial to be public, but it should be abandoned","Collaery's trial to be public, but it should be abandoned",Dechlan Brennan,"Mon, 11 Oct 2021 15:00:00 +1000"
 Australians must be wary of Trump's &quot;big lie&quot; infiltrating our politics,Australians must be wary of Trump's &amp;quot;big lie&amp;quot; infiltrating our politics,Sue Arnold,"Mon, 11 Oct 2021 11:00:00 +1000"
 Mainstream media ignore mental health data to denigrate Dan Andrews,Mainstream media ignore mental health data to denigrate Dan Andrews,Alan Austin,"Mon, 11 Oct 2021 07:00:00 +1000"
 Gun club grant rejected for years before Daryl Maguire involvement,Gun club grant rejected for years before Daryl Maguire involvement,Anthony Klan,"Tue, 12 Oct 2021 15:00:00 +1000"
 A brief history of the Coalition’s fake social media accounts,A brief history of the Coalition’s fake social media accounts,Andrew P Street,"Tue, 12 Oct 2021 07:00:00 +1000"
 China versus USA: The demographic dimensions,China versus USA: The demographic dimensions,Abul Rizvi,"Tue, 12 Oct 2021 11:00:00 +1000"
 On IA: Weekly recap — 13 October,On IA: Weekly recap — 13 October,Dan Jensen,"Wed, 13 Oct 2021 16:34:00 +1000"
 What living with COVID would really mean for Australia,What living with COVID would really mean for Australia,John Quiggin,"Wed, 13 Oct 2021 15:00:00 +1000"
 Coalition complacency worsened NSW COVID winter,Coalition complacency worsened NSW COVID winter,Lee Duffield,"Wed, 13 Oct 2021 11:00:00 +1000"
 Telehealth would improve Australia's mental health statistics,Telehealth would improve Australia's mental health statistics,Paul Budde,"Wed, 13 Oct 2021 07:00:00 +1000"
 How Murdoch manipulates the climate of Australian politics,How Murdoch manipulates the climate of Australian politics,Michelle Pini,"Thu, 14 Oct 2021 06:30:00 +1000"
" Flashback 2016: ICAC, Baird and corruption par excellence","Flashback 2016: ICAC, Baird and corruption par excellence",Evan Jones,"Thu, 14 Oct 2021 16:00:00 +1000"
 Lack of perspective on Taiwan-China tensions,Lack of perspective on Taiwan-China tensions,Darrell Egan,"Thu, 14 Oct 2021 15:00:00 +1000"
 How we are trying to buy an identity in capitalist economies,How we are trying to buy an identity in capitalist economies,Molly Richardson,"Thu, 14 Oct 2021 11:00:00 +1000"
 WHAT'S ON: Where To Invade Next — Moore ideas for a better world,WHAT'S ON: Where To Invade Next — Moore ideas for a better world,Dan Jensen,"Fri, 15 Oct 2021 16:00:00 +1000"
 Football season a big win despite pandemic fears,Football season a big win despite pandemic fears,Lee Duffield,"Fri, 15 Oct 2021 15:00:00 +1000"
" Pro-vax, pro-union, anti-fascist: Three things to be proud of","Pro-vax, pro-union, anti-fascist: Three things to be proud of",Martin Hirst,"Fri, 15 Oct 2021 11:00:00 +1000"
 EXCLUSIVE: Gun club financial report shows mystery grant 'costs',EXCLUSIVE: Gun club financial report shows mystery grant 'costs',Anthony Klan,"Fri, 15 Oct 2021 07:00:00 +1000"
 CARTOONS: Old King Coal is changing his tune,CARTOONS: Old King Coal is changing his tune,Mark David,"Fri, 15 Oct 2021 09:00:00 +1000"
 An open letter to Prime Minister Scott Morrison,An open letter to Prime Minister Scott Morrison,Graeme Doyle,"Sat, 16 Oct 2021 15:00:00 +1000"
 Grassroots campaign against Christian Porter grows,Grassroots campaign against Christian Porter grows,Emma Willson,"Sat, 16 Oct 2021 11:00:00 +1000"
 Skilling Australians Fund: A fee for no service,Skilling Australians Fund: A fee for no service,Lina Li,"Sat, 16 Oct 2021 07:00:00 +1000"
 Returning to the office post-COVID: It's not set in concrete,Returning to the office post-COVID: It's not set in concrete,Peter Fisher,"Sun, 17 Oct 2021 12:00:00 +1000"
 To improve mental health systems we must connect with their users,To improve mental health systems we must connect with their users,Fi Peel,"Sun, 17 Oct 2021 08:00:00 +1000"
 COVIDSafe app: Missing the mark Coalition-style,COVIDSafe app: Missing the mark Coalition-style,Binoy Kampmark,"Sun, 17 Oct 2021 16:00:00 +1000"
 Australians must be wary of Trump's 'big lie' infiltrating our politics,Australians must be wary of Trump's 'big lie' infiltrating our politics,Sue Arnold,"Mon, 11 Oct 2021 11:00:00 +1000"
 Media inequality shows Labor scandals covered more than Liberal,Media inequality shows Labor scandals covered more than Liberal,Victoria Fielding,"Mon, 18 Oct 2021 15:00:00 +1000"
 Billboard mocks Morrison as Australia prepares for COP26,Billboard mocks Morrison as Australia prepares for COP26,Binoy Kampmark,"Mon, 18 Oct 2021 11:00:00 +1000"
" Australia needs an ICAC, but also mandatory gaol sentences","Australia needs an ICAC, but also mandatory gaol sentences",Alan Austin,"Mon, 18 Oct 2021 07:00:00 +1000"
 Flashback 2015: Coal comfort: The atomic emasculation of Malcolm Turnbull,Flashback 2015: Coal comfort: The atomic emasculation of Malcolm Turnbull,David Donovan,"Tue, 19 Oct 2021 16:00:00 +1000"
 Transparency lacking in Australian defence policy,Transparency lacking in Australian defence policy,Sue Wareham,"Tue, 19 Oct 2021 15:00:00 +1000"
 Environment in peril as Premier urged to increase population,Environment in peril as Premier urged to increase population,Sue Arnold,"Tue, 19 Oct 2021 11:00:00 +1000"
 The people versus Scott Morrison,The people versus Scott Morrison,Jennifer Wilson,"Tue, 19 Oct 2021 07:00:00 +1000"
 Dominic Perrottet drawn into ICAC gun club scandal,Dominic Perrottet drawn into ICAC gun club scandal,Anthony Klan,"Wed, 20 Oct 2021 15:00:00 +1000"
 Indigenous communities suffering most from Australia's climate inaction,Indigenous communities suffering most from Australia's climate inaction,Joanna Psaros,"Wed, 20 Oct 2021 13:00:00 +1000"
" Government unaccountability: Over 1,000 days and counting","Government unaccountability: Over 1,000 days and counting",Daniel Holmes,"Wed, 20 Oct 2021 11:00:00 +1000"
 Using smart cities to protect democracy,Using smart cities to protect democracy,Paul Budde,"Wed, 20 Oct 2021 07:00:00 +1000"
 Medicare cuts prove the Coalition is bad for our health,Medicare cuts prove the Coalition is bad for our health,Michelle Pini,"Thu, 21 Oct 2021 07:00:00 +1000"
 WHAT'S ON: The Last Duel — #metoo goes medieval,WHAT'S ON: The Last Duel — #metoo goes medieval,Dan Jensen,"Thu, 21 Oct 2021 16:00:00 +1000"
" Despite royal family’s scandals, Australia is unlikely to ditch monarchy","Despite royal family’s scandals, Australia is unlikely to ditch monarchy",Hsin-Yi Lo,"Thu, 21 Oct 2021 15:00:00 +1000"
" Undeterred by pariah status, PM to wave 'green and gold' at Glasgow","Undeterred by pariah status, PM to wave 'green and gold' at Glasgow",Joel Jenkins,"Thu, 21 Oct 2021 11:00:00 +1000"
 UN and Bangladesh work together to protect the Rohingya people,UN and Bangladesh work together to protect the Rohingya people,Shaik Abdur Rahman,"Fri, 22 Oct 2021 15:00:00 +1000"
" Universities, governments and companies can help avert climate catastrophe","Universities, governments and companies can help avert climate catastrophe",David Ritter,"Fri, 22 Oct 2021 07:00:00 +1000"
 ABC showing Liberal bias in lockdown coverage,ABC showing Liberal bias in lockdown coverage,Hayden O'Connor,"Fri, 22 Oct 2021 11:00:00 +1000"
 CARTOONS: Mark David is checking the climate,CARTOONS: Mark David is checking the climate,Mark David,"Fri, 22 Oct 2021 09:00:00 +1000"
 Further details emerge as Premier Perrottet linked to ICAC gun club grant,Further details emerge as Premier Perrottet linked to ICAC gun club grant,Anthony Klan,"Sat, 23 Oct 2021 07:00:00 +1000"
 ON IA: BREAKING NEWS — Perrottet exclusive with Anthony Klan,ON IA: BREAKING NEWS — Perrottet exclusive with Anthony Klan,Michelle Pini,"Sat, 23 Oct 2021 10:00:00 +1000"
 Citizen journalism on the rise in Australian fringe politics,Citizen journalism on the rise in Australian fringe politics,Tom Tanuki,"Sat, 23 Oct 2021 15:00:00 +1000"
 Update of Australia’s biggest ever labour trafficking scam,Update of Australia’s biggest ever labour trafficking scam,Abul Rizvi,"Sat, 23 Oct 2021 11:00:00 +1000"
 'Death of a Whale: The Challenge of Anti-Whaling Activists and Indigenous Rights' — an excerpt,'Death of a Whale: The Challenge of Anti-Whaling Activists and Indigenous Rights' — an excerpt,Paul Watson,"Sun, 24 Oct 2021 08:00:00 +1000"
 Iconic Afghanistan: Life before war,Iconic Afghanistan: Life before war,"Thomas Parrish, Mark Parrish","Sun, 24 Oct 2021 12:00:00 +1000"
 IA Book Club: Confronting the global climate crisis,IA Book Club: Confronting the global climate crisis,Bob Ashcroft,"Sat, 23 Oct 2021 16:00:00 +1000"
 KERRYN PHELPS: Passing the COVID buck risks more than government reputations,KERRYN PHELPS: Passing the COVID buck risks more than government reputations,Professor Kerryn Phelps AM,"Mon, 25 Oct 2021 15:00:00 +1000"
 Tudge flags freedom of speech while whitewashing Australia's past,Tudge flags freedom of speech while whitewashing Australia's past,Dechlan Brennan,"Mon, 25 Oct 2021 14:00:00 +1000"
 The Liberals must call Nationals' bluff on climate,The Liberals must call Nationals' bluff on climate,Tim Thornton,"Mon, 25 Oct 2021 11:00:00 +1000"
" Australian economy languishes while Ireland, Singapore, NZ soar","Australian economy languishes while Ireland, Singapore, NZ soar",Alan Austin,"Mon, 25 Oct 2021 07:00:00 +1000"
 Telstra’s Digicel buy is politically motivated,Telstra’s Digicel buy is politically motivated,Paul Budde,"Tue, 26 Oct 2021 11:00:00 +1000"
 Flashback 2016: Whence the Commonweal: The rise of the dunces,Flashback 2016: Whence the Commonweal: The rise of the dunces,Evan Jones,"Tue, 26 Oct 2021 16:00:00 +1000"
 National Farmers Federation needs to embrace climate adaption,National Farmers Federation needs to embrace climate adaption,David Paull,"Tue, 26 Oct 2021 15:00:00 +1000"
 Nationals ridiculous net zero deal doesn't even matter,Nationals ridiculous net zero deal doesn't even matter,Andrew P Street,"Tue, 26 Oct 2021 07:00:00 +1000"
 EXCLUSIVE: European MPs explain their 'no' to Assange extradition,EXCLUSIVE: European MPs explain their 'no' to Assange extradition,Sara Chessa,"Wed, 27 Oct 2021 15:00:00 +1000"
 Boris Johnson fails to act despite damning COVID-19 report,Boris Johnson fails to act despite damning COVID-19 report,Steve Bishop,"Wed, 27 Oct 2021 11:00:00 +1000"
 The Goward's punch,The Goward's punch,Joel Jenkins,"Wed, 27 Oct 2021 07:00:00 +1000"
" The Plan: Winking, blinding and eye-watering Coalition negligence","The Plan: Winking, blinding and eye-watering Coalition negligence",Michelle Pini,"Thu, 28 Oct 2021 06:30:00 +1000"
" From climate to corruption, the Morrison Government needs to go","From climate to corruption, the Morrison Government needs to go",Graham Perrett,"Thu, 28 Oct 2021 16:00:00 +1000"
 Perrottet pushes mass migration harder than Morrison,Perrottet pushes mass migration harder than Morrison,Stephen Saunders,"Thu, 28 Oct 2021 15:00:00 +1000"
 EXCLUSIVE: Europe says 'No' to Assange extradition,EXCLUSIVE: Europe says 'No' to Assange extradition,Sara Chessa,"Wed, 27 Oct 2021 15:00:00 +1000"
 The time is now: Western Sahara must gain independence,The time is now: Western Sahara must gain independence,Kamal Fadel,"Thu, 28 Oct 2021 11:00:00 +1000"
 Labor needs to stand up,Labor needs to stand up,Dechlan Brennan,"Fri, 29 Oct 2021 15:00:00 +1000"
 Australia needs a federal human rights act,Australia needs a federal human rights act,Gerry Georgatos,"Fri, 29 Oct 2021 11:00:00 +1000"
 CARTOONS: Scotty's Claytons climate plan,CARTOONS: Scotty's Claytons climate plan,Mark David,"Fri, 29 Oct 2021 09:00:00 +1000"
 China may be Morrison's last hope for re-election,China may be Morrison's last hope for re-election,Paul Begley,"Fri, 29 Oct 2021 07:00:00 +1000"
 WHAT'S ON: Love You Like That — Cupid's arrow misses the mark,WHAT'S ON: Love You Like That — Cupid's arrow misses the mark,Dan Jensen,"Sat, 30 Oct 2021 15:00:00 +1000"
 Full employment not necessarily the holy grail in a flexible market economy,Full employment not necessarily the holy grail in a flexible market economy,Graham White,"Sat, 30 Oct 2021 11:30:00 +1000"
 U.S. appeal against Assange opens,U.S. appeal against Assange opens,Binoy Kampmark,"Sat, 30 Oct 2021 07:00:00 +1000"
" EXCLUSIVE: Lost for words, Dominique Grubisa resorts to plagiarism","EXCLUSIVE: Lost for words, Dominique Grubisa resorts to plagiarism",David Donovan,"Sun, 31 Oct 2021 15:00:00 +1000"
 Goward article galling,Goward article galling,Bilal Cleland,"Sun, 31 Oct 2021 08:00:00 +1000"
 Religious discrimination bill: The devil is in the details,Religious discrimination bill: The devil is in the details,Meredith Doig,"Sun, 31 Oct 2021 12:00:00 +1000"
 ON IA: Ask Dave — 1 November 2021,ON IA: Ask Dave — 1 November 2021,David Donovan,"Mon, 01 Nov 2021 16:00:00 +1000"
" It's not 'cancel culture', it's audience feedback","It's not 'cancel culture', it's audience feedback",Victoria Fielding,"Mon, 01 Nov 2021 15:00:00 +1000"
 American politics in a state of chaos,American politics in a state of chaos,George Grundy,"Mon, 01 Nov 2021 11:00:00 +1000"
 Morrison Government humiliates Australia at G20,Morrison Government humiliates Australia at G20,Alan Austin,"Mon, 01 Nov 2021 07:00:00 +1000"
 JOHN PILGER: Justice for Assange is justice for all,JOHN PILGER: Justice for Assange is justice for all,John Pilger,"Tue, 02 Nov 2021 16:00:00 +1000"
 COP26 omits biodiversity loss from agenda,COP26 omits biodiversity loss from agenda,Sue Arnold,"Tue, 02 Nov 2021 15:00:00 +1000"
 Assange appeal day two: The CIA and empty assurances,Assange appeal day two: The CIA and empty assurances,Binoy Kampmark,"Tue, 02 Nov 2021 12:00:00 +1000"
 Morrison gets cold reception at G20,Morrison gets cold reception at G20,Jennifer Wilson,"Tue, 02 Nov 2021 07:00:00 +1000"
 Flashback 2014: Arthur Sinodinos goes down the gurgler,Flashback 2014: Arthur Sinodinos goes down the gurgler,Ross Jones,"Wed, 03 Nov 2021 16:00:00 +1000"
 How Scott Morrison's climate action wishlist was cobbled together,How Scott Morrison's climate action wishlist was cobbled together,Steve Bishop,"Wed, 03 Nov 2021 15:00:00 +1000"
 New pathway to permanent migration encourages gaming of visa system,New pathway to permanent migration encourages gaming of visa system,Abul Rizvi,"Wed, 03 Nov 2021 11:00:00 +1000"
 Interplanetary internet: Communication out of this world,Interplanetary internet: Communication out of this world,Paul Budde,"Wed, 03 Nov 2021 07:00:00 +1000"
" Scott Morrison really should resign, oui?","Scott Morrison really should resign, oui?",David Donovan and Michelle Pini,"Thu, 04 Nov 2021 07:00:00 +1000"
 Morrison Government continues to trash Australia's reputation on climate,Morrison Government continues to trash Australia's reputation on climate,Graeme McLeay,"Thu, 04 Nov 2021 15:00:00 +1000"
 Federal Government prevents medical community from assisting refugees,Federal Government prevents medical community from assisting refugees,Nilanthy Vigneswaran,"Thu, 04 Nov 2021 11:00:00 +1000"
" WHAT'S ON: Eternals — big, bold and beautiful","WHAT'S ON: Eternals — big, bold and beautiful",Dan Jensen,"Thu, 04 Nov 2021 16:00:00 +1000"
" Australia must help Afghans deprived of lives, dreams and futures","Australia must help Afghans deprived of lives, dreams and futures",Nazdana Soltanfar,"Fri, 05 Nov 2021 15:00:00 +1000"
 Tim Smith and the death of political accountability,Tim Smith and the death of political accountability,Dechlan Brennan,"Fri, 05 Nov 2021 11:00:00 +1000"
 CARTOONS: Mark David is COP-ping it in Glasgow,CARTOONS: Mark David is COP-ping it in Glasgow,Mark David,"Fri, 05 Nov 2021 09:00:00 +1000"
" Twitter fights against Porter, van Onselen and Laming’s defamation threats","Twitter fights against Porter, van Onselen and Laming’s defamation threats",Hayden O'Connor,"Fri, 05 Nov 2021 07:00:00 +1000"
 Eddie Obeid is a symptom of a greater problem,Eddie Obeid is a symptom of a greater problem,Karl Fitzgerald,"Sat, 06 Nov 2021 15:00:00 +1000"
 Avi Yemini and his ilk are anything but journalists,Avi Yemini and his ilk are anything but journalists,Tom Tanuki,"Sat, 06 Nov 2021 11:00:00 +1000"
 EXCLUSIVE: ICAC gun club figures don't add up,EXCLUSIVE: ICAC gun club figures don't add up,Anthony Klan,"Sat, 06 Nov 2021 07:00:00 +1000"
 IA Book Club: 'Why You Should Give A F*ck About Farming',IA Book Club: 'Why You Should Give A F*ck About Farming',Revelly Robinson,"Sun, 07 Nov 2021 16:00:00 +1000"
 Facebook rebrand: Why Meta is not better,Facebook rebrand: Why Meta is not better,Brett Wilkins,"Sun, 07 Nov 2021 12:00:00 +1000"
 Last throw of the dice for Julian Assange,Last throw of the dice for Julian Assange,Ian Curr,"Sun, 07 Nov 2021 08:00:00 +1000"
 Dominic Perrotett set to prioritise 'family values' during his tenure,Dominic Perrotett set to prioritise 'family values' during his tenure,Joanna Psaros,"Mon, 08 Nov 2021 15:00:00 +1000"
 Alan Tudge opens his own Christian college,Alan Tudge opens his own Christian college,Rocky Dabscheck,"Mon, 08 Nov 2021 11:00:00 +1000"
 House prices skyrocket and social housing collapses under the Coalition,House prices skyrocket and social housing collapses under the Coalition,Alan Austin,"Mon, 08 Nov 2021 07:00:00 +1000"
 Flashback 2019: 10 reasons why Scott Morrison is actually a hypocrite,Flashback 2019: 10 reasons why Scott Morrison is actually a hypocrite,Michelle Pini,"Tue, 09 Nov 2021 16:00:00 +1000"
 Religious Freedom Bill is Morrison's re-election strategy,Religious Freedom Bill is Morrison's re-election strategy,Andrew P Street,"Tue, 09 Nov 2021 15:00:00 +1000"
 Scott Morrison: A lonely man with an empty plan,Scott Morrison: A lonely man with an empty plan,Joel Jenkins,"Tue, 09 Nov 2021 11:00:00 +1000"
 NSW ICAC renews urge for federal commission,NSW ICAC renews urge for federal commission,Matthew Butera,"Tue, 09 Nov 2021 07:00:00 +1000"
 WHAT'S ON: No Time To Die — a Bond farewell,WHAT'S ON: No Time To Die — a Bond farewell,Dan Jensen,"Wed, 10 Nov 2021 16:00:00 +1000"
 'Shady' Michael Sukkar is dodging accountability,'Shady' Michael Sukkar is dodging accountability,Kieran Simpson,"Wed, 10 Nov 2021 15:00:00 +1000"
 Scott Morrison wants to be Australia's Donald Trump,Scott Morrison wants to be Australia's Donald Trump,Paul Begley,"Wed, 10 Nov 2021 11:00:00 +1000"
 Cirque du Soleil explores VR and holoportation,Cirque du Soleil explores VR and holoportation,Paul Budde,"Wed, 10 Nov 2021 07:00:00 +1000"
" Kings of defamation: Porter, Laming, Barilaro, Dutton et al","Kings of defamation: Porter, Laming, Barilaro, Dutton e",Michelle Pini,"Thu, 11 Nov 2021 07:00:00 +1000"
 On IA: Weekly recap — 11 November 2021,On IA: Weekly recap — 11 November ,Dan Jensen,"Thu, 11 Nov 2021 16:00:00 +1000"
 New visa for migrant farm workers could turbocharge exploitation,New visa for migrant farm workers could turbocharge exploita,Abul Rizvi,"Thu, 11 Nov 2021 15:00:00 +1000"
 Wealthy nations like Australia are leading the world to climate catastrophe,Wealthy nations like Australia are leading the world to climate catastr,Hannah Thomas,"Thu, 11 Nov 2021 11:00:00 +1000"
 November is time for Australian republican remembering,November is time for Australian republican remembe,Glenn Davies,"Fri, 12 Nov 2021 15:00:00 +1000"
 Bernard Collaery's trial needs to remain open,Bernard Collaery's trial needs to remain ,Dechlan Brennan,"Fri, 12 Nov 2021 11:00:00 +1000"
 CARTOONS: Defamations R Us,CARTOONS: Defamations ,Mark David,"Fri, 12 Nov 2021 09:00:00 +1000"
 Twitter criticism is ruffling conservative feathers,Twitter criticism is ruffling conservative feat,Jennifer Wilson,"Fri, 12 Nov 2021 07:00:00 +1000"
 IA Book Club: 'Memoirs Of A Rebel — Black Market Shooting',IA Book Club: 'Memoirs Of A Rebel — Black Market Shoot,Lindy Kittel,"Sat, 13 Nov 2021 15:00:00 +1000"
 Farmers claim win over fossil fuel industry,Farmers claim win over fossil fuel indu,Johanna Evans,"Sat, 13 Nov 2021 11:00:00 +1000"
 EXCLUSIVE: Dominique Grubisa's dodgy debt department,EXCLUSIVE: Dominique Grubisa's dodgy debt depart,David Donovan,"Sat, 13 Nov 2021 07:00:00 +1000"
