 Incarceration: How Australia fails its vulnerable,Incarceration: How Australia fails its vulner,Gerry Georgatos,"Sun, 14 Nov 2021 12:00:00 +1000"
 COVID-19 is a race and our children are left at the starting line,COVID-19 is a race and our children are left at the starting ,Natalie Beak,"Sun, 14 Nov 2021 08:00:00 +1000"
 Scott Morrison has mastered the art of lying,Scott Morrison has mastered the art of l,Binoy Kampmark,"Mon, 15 Nov 2021 15:00:00 +1000"
 Public inquiry is showing Australia’s unheard call for new foreign policy,Public inquiry is showing Australia’s unheard call for new foreign po,Kellie Tranter,"Mon, 15 Nov 2021 11:00:00 +1000"
 Living standards tumbling in Australia despite booming national wealth,Living standards tumbling in Australia despite booming national we,Alan Austin,"Mon, 15 Nov 2021 07:00:00 +1000"
 Flashback 2012: Prominent Liberal says Gillard should be kicked to death,Flashback 2012: Prominent Liberal says Gillard should be kicked to d,David Donovan,"Tue, 16 Nov 2021 16:00:00 +1000"
 ‘Glasgow Pact’ keeps pressure on climate laggards like Australia,‘Glasgow Pact’ keeps pressure on climate laggards like Austr,Michael Mazengarb,"Tue, 16 Nov 2021 15:00:00 +1000"
 Australian drug laws doing more harm than good,Australian drug laws doing more harm than ,David McIlveen,"Tue, 16 Nov 2021 11:00:00 +1000"
 Right-wing commentators turning journalism into public relations,Right-wing commentators turning journalism into public relat,Victoria Fielding,"Tue, 16 Nov 2021 07:00:00 +1000"
 EXCLUSIVE: ICAC gun club a failure prior to grant,EXCLUSIVE: ICAC gun club a failure prior to g,Anthony Klan,"Wed, 17 Nov 2021 15:00:00 +1000"
 WHAT'S ON: Last Night in Soho — a night you'll never forget,WHAT'S ON: Last Night in Soho — a night you'll never fo,Dan Jensen,"Wed, 17 Nov 2021 16:30:00 +1000"
 Labor possibly handing Morrison another election victory,Labor possibly handing Morrison another election vic,Paul Begley,"Wed, 17 Nov 2021 11:00:00 +1000"
 Labor’s NBN plan to reach 8 million households,Labor’s NBN plan to reach 8 million househ,Paul Budde,"Wed, 17 Nov 2021 07:00:00 +1000"
 Liberals incite Far-Right to lynch Andrews,Liberals incite Far-Right to lynch And,Michelle Pini,"Thu, 18 Nov 2021 07:00:00 +1000"
 The Far-Right in Melbourne presents a clear danger to democracy,The Far-Right in Melbourne presents a clear danger to democ,Martin Hirst,"Thu, 18 Nov 2021 11:00:00 +1000"
 Coalition provocation and silence fueling ugly Melbourne 'protests',Coalition provocation and silence fueling ugly Melbourne 'prote,Joel Jenkins,"Thu, 18 Nov 2021 15:00:00 +1000"
 Anti-vax rallies stink of Fraser Anning's populism,Anti-vax rallies stink of Fraser Anning's popu,Tom Tanuki,"Fri, 19 Nov 2021 15:00:00 +1000"
 Liberals and mainstream media encourage extremism,Liberals and mainstream media encourage extre,Hayden O'Connor,"Fri, 19 Nov 2021 11:00:00 +1000"
 CARTOONS: Mark David is selling the truth,CARTOONS: Mark David is selling the t,Mark David,"Fri, 19 Nov 2021 09:00:00 +1000"
 Scott Morrison is a threat to the Great Barrier Reef,Scott Morrison is a threat to the Great Barrier ,David Ritter,"Fri, 19 Nov 2021 07:00:00 +1000"
 Rohingya financial burden too great for Bangladesh,Rohingya financial burden too great for Bangla,Kazi Jamshed,"Sat, 20 Nov 2021 15:00:00 +1000"
 Angus Taylor admits emissions policy was misleading,Angus Taylor admits emissions policy was mislea,Michael Mazengarb,"Sat, 20 Nov 2021 11:00:00 +1000"
 Scotty the school captain is out of his depth,Scotty the school captain is out of his d,Sam Leckie,"Sat, 20 Nov 2021 07:00:00 +1000"
 One person's metaverse is another's dystopian reality,One person's metaverse is another's dystopian rea,Prabir Purkayastha,"Sun, 21 Nov 2021 12:00:00 +1000"
 Sex and disability: The right to intimate connection,Sex and disability: The right to intimate connec,Thea Calzoni,"Sun, 21 Nov 2021 08:00:00 +1000"
 How an influx of independents could change Parliament for the worse,How an influx of independents could change Parliament for the w,Kay Rollison,"Mon, 22 Nov 2021 15:00:00 +1000"
 Paul Keating slams Morrison's approach to Australia-China relations,Paul Keating slams Morrison's approach to Australia-China relat,Ian Curr,"Mon, 22 Nov 2021 11:00:00 +1000"
" Inflation worse under Coalition than Labor, contrary to Morrison's claims","Inflation worse under Coalition than Labor, contrary to Morrison's cl",Alan Austin,"Mon, 22 Nov 2021 07:00:00 +1000"
 Morrison braves the NSW Electoral Labyrinth Of Doom,Morrison braves the NSW Electoral Labyrinth Of ,Andrew P Street,"Tue, 23 Nov 2021 07:00:00 +1000"
 Australia’s weak labour market causes NZ migration slump,Australia’s weak labour market causes NZ migration s,Abul Rizvi,"Tue, 23 Nov 2021 15:00:00 +1000"
 Protests distract Government from climate crisis,Protests distract Government from climate cr,Sue Arnold,"Tue, 23 Nov 2021 11:00:00 +1000"
 Bloody Idiot of the Week — Episode 24: Would Scomocchio lie?,Bloody Idiot of the Week — Episode 24: Would Scomocchio ,David Donovan and Michelle Pini,"Wed, 24 Nov 2021 16:00:00 +1000"
 Conspiracy cults breeding terrorism through protests,Conspiracy cults breeding terrorism through prot,Bilal Cleland,"Wed, 24 Nov 2021 15:00:00 +1000"
 NBN remains a political football,NBN remains a political foot,Paul Budde,"Wed, 24 Nov 2021 07:00:00 +1000"
 Peaceful protesters reject Far-Right violence,Peaceful protesters reject Far-Right viol,Martin Hirst,"Wed, 24 Nov 2021 11:00:00 +1000"
 Morrison’s top 10 bare-faced lies,Morrison’s top 10 bare-faced ,Michelle Pini,"Thu, 25 Nov 2021 07:00:00 +1000"
 Don't punish the poor: Fines must be based on income,Don't punish the poor: Fines must be based on in,Gerry Georgatos,"Thu, 25 Nov 2021 11:00:00 +1000"
 Morrison Government mistakes ABC for a department it can control,Morrison Government mistakes ABC for a department it can con,Dechlan Brennan,"Thu, 25 Nov 2021 15:00:00 +1000"
 Flashback 2019: The blatant hypocrisy of Scott Morrison’s Christian faith,Flashback 2019: The blatant hypocrisy of Scott Morrison’s Christian f,Richard Tuffin,"Fri, 26 Nov 2021 15:00:00 +1000"
 Liberal Party's bloody history forgotten as Morrison cries freedom,Liberal Party's bloody history forgotten as Morrison cries fre,Lee Duffield,"Fri, 26 Nov 2021 12:00:00 +1000"
 CARTOONS: Mark David takes his message to the masses,CARTOONS: Mark David takes his message to the ma,Mark David,"Fri, 26 Nov 2021 09:00:00 +1000"
 Scott Morrison's Medusa complex,Scott Morrison's Medusa com,Geoff Dyer,"Fri, 26 Nov 2021 07:00:00 +1000"
 Corruption and extremism threaten government legitimacy,Corruption and extremism threaten government legiti,Bilal Cleland,"Sat, 27 Nov 2021 15:00:00 +1000"
 WHAT'S ON: The Wheel of Time — almost magical,WHAT'S ON: The Wheel of Time — almost mag,Dan Jensen,"Sat, 27 Nov 2021 11:00:00 +1000"
 Dutton commits to following U.S. into war for Taiwan,Dutton commits to following U.S. into war for Ta,Binoy Kampmark,"Sat, 27 Nov 2021 07:00:00 +1000"
 People living with disability have a dignified right to sex,People living with disability have a dignified right to,Graeme Sparkes,"Sun, 28 Nov 2021 16:00:00 +1000"
 Sexual abuse survival: How one woman's story helped heal another,Sexual abuse survival: How one woman's story helped heal ano,Jennifer Wilson,"Sun, 28 Nov 2021 12:00:00 +1000"
 Coalition derails Federal ICAC on technicality,Coalition derails Federal ICAC on technica,Ross Jones,"Sun, 28 Nov 2021 08:00:00 +1000"
 KERRYN PHELPS: Coalition threatened by Independent movement,KERRYN PHELPS: Coalition threatened by Independent move,Kerryn Phelps,"Mon, 29 Nov 2021 15:00:00 +1000"
 Coalition Government should've already closed our borders to Omicron,Coalition Government should've already closed our borders to Omi,Victoria Fielding,"Mon, 29 Nov 2021 11:00:00 +1000"
 Morrison Government notches up 40 'worst on record' economic outcomes,Morrison Government notches up 40 'worst on record' economic outc,Alan Austin,"Mon, 29 Nov 2021 07:00:00 +1000"
 Scott Morrison renews crackdown on social media users,Scott Morrison renews crackdown on social media u,Jennifer Wilson,"Tue, 30 Nov 2021 07:00:00 +1000"
 Alan Tudge disappoints with new education strategy,Alan Tudge disappoints with new education stra,Abul Rizvi,"Tue, 30 Nov 2021 15:00:00 +1000"
 Scott Morrison invents his own polygraph test,Scott Morrison invents his own polygraph ,Rocky Dabscheck,"Tue, 30 Nov 2021 11:00:00 +1000"
 China increases cyberwar tactics,China increases cyberwar tac,Paul Budde,"Wed, 01 Dec 2021 07:00:00 +1000"
 Federal insurance scheme needed to revitalise arts sector,Federal insurance scheme needed to revitalise arts se,Penelope Benton,"Wed, 01 Dec 2021 11:00:00 +1000"
 Detained refugees denied access to library services,Detained refugees denied access to library serv,Marlon Toner-McLachlan,"Wed, 01 Dec 2021 15:00:00 +1000"
 EDITORIAL: Morrison's sexual harassment dog act trolls women,EDITORIAL: Morrison's sexual harassment dog act trolls w,Michelle Pini,"Wed, 01 Dec 2021 18:30:00 +1000"
 Morrison's sexual harassment dog act trolls women,Morrison's sexual harassment dog act trolls w,Michelle Pini,"Thu, 02 Dec 2021 07:00:00 +1000"
 Flashback 2019: Normalising Scott Morrison,Flashback 2019: Normalising Scott Morr,Jennifer Wilson,"Thu, 02 Dec 2021 16:00:00 +1000"
 PM Morrison: The skipper who won't play with a straight bat,PM Morrison: The skipper who won't play with a straight,Geoff Dyer,"Thu, 02 Dec 2021 15:00:00 +1000"
 Blowing the whistle on umpire abuse,Blowing the whistle on umpire a,Vikki Watkins,"Thu, 02 Dec 2021 11:00:00 +1000"
