 Why Australia needs to become a secular republic,Why Australia needs to become a secular republic,Max Wallace,"Tue, 14 Sep 2021 12:00:00 +1000"
 AUDIO EXCLUSIVE: The Sun Rises interviews the United Australia Party,AUDIO EXCLUSIVE: The Sun Rises interviews the United Australia Party,David Donovan,"Mon, 13 Sep 2021 17:00:00 +1000"
 'Dobber King' Tony Abbott doesn't care for being dobbed upon,'Dobber King' Tony Abbott doesn't care for being dobbed upon,Andrew P Street,"Tue, 14 Sep 2021 08:00:00 +1000"
 Scott Morrison's religious delusions are dangerous,Scott Morrison's religious delusions are dangerous,George Grundy,"Fri, 02 Jul 2021 08:00:00 +1000"
" Morrison, Finlay and a tame – but not Tame enough – Women’s Summit","Morrison, Finlay and a tame – but not Tame enough – Women’s Summit",Michelle Pini,"Thu, 09 Sep 2021 08:00:00 +1000"
" Like the U.S., Australians angry about COVID mismanagement","Like the U.S., Australians angry about COVID mismanagement",Sue Arnold,"Mon, 13 Sep 2021 16:00:00 +1000"
" Rules around travel exemptions unclear, stranding Australians","Rules around travel exemptions unclear, stranding Australians",Lina Li,"Mon, 13 Sep 2021 12:00:00 +1000"
 Morrison Government sets more 'worst ever' economic records,Morrison Government sets more 'worst ever' economic records,Alan Austin,"Mon, 13 Sep 2021 08:00:00 +1000"
 Melbourne: It's a shame about the name,Melbourne: It's a shame about the name,GJ Burchall,"Sun, 12 Sep 2021 17:00:00 +1000"
 IA BOOK CLUB: Chris Bowen's 'Labor People',IA BOOK CLUB: Chris Bowen's 'Labor People',Craig Minns,"Sun, 12 Sep 2021 13:00:00 +1000"
 Publishers lose High Court appeal in Dylan Voller defamation case,Publishers lose High Court appeal in Dylan Voller defamation case,Martin Hirst,"Sun, 12 Sep 2021 09:00:00 +1000"
 A reflection of decades of failed U.S. national security policy,A reflection of decades of failed U.S. national security policy,Katrina vanden Heuvel,"Sat, 11 Sep 2021 16:00:00 +1000"
 Scott Morrison's Father's Day hypocrisy,Scott Morrison's Father's Day hypocrisy,Hannah Thomas,"Sat, 11 Sep 2021 12:00:00 +1000"
 How the anti-lockdown fundraising machine keeps running,How the anti-lockdown fundraising machine keeps running,Tom Tanuki,"Sat, 11 Sep 2021 08:00:00 +1000"
 Politicians still refuse to take action on climate disaster,Politicians still refuse to take action on climate disaster,Sonali Kolhatkar,"Fri, 10 Sep 2021 16:00:00 +1000"
 WHAT'S ON: Turning Point: 9/11 and the War on Terror — inside America's failure,WHAT'S ON: Turning Point: 9/11 and the War on Terror — inside America's failure,Dan Jensen,"Fri, 10 Sep 2021 12:00:00 +1000"
 CARTOONS: Mark David is running his own race,CARTOONS: Mark David is running his own race,Mark David,"Fri, 10 Sep 2021 10:00:00 +1000"
 Coalition responsible for the demise of Australia's Family Court,Coalition responsible for the demise of Australia's Family Court,Graham Perrett,"Fri, 10 Sep 2021 08:00:00 +1000"
 Australia's first anti-corruption party: FIN is now official,Australia's first anti-corruption party: FIN is now official,Ross Jones,"Thu, 09 Sep 2021 17:00:00 +1000"
 A betrayal of farmers: The Nationals are lackeys for coal,A betrayal of farmers: The Nationals are lackeys for coal,David Paull,"Thu, 09 Sep 2021 16:00:00 +1000"
 The Nationals and Murdoch media support nuclear power ahead of COP26,The Nationals and Murdoch media support nuclear power ahead of COP26,Noel Wauchope,"Thu, 09 Sep 2021 12:00:00 +1000"
 Flashback 2017: Matthew Guy and the 'mafia': Top five Liberal Party wise-Guys,Flashback 2017: Matthew Guy and the 'mafia': Top five Liberal Party wise-Guys,David Donovan,"Wed, 08 Sep 2021 17:30:00 +1000"
 Governments to blame for vaccine confusion,Governments to blame for vaccine confusion,Sue Arnold,"Wed, 08 Sep 2021 16:00:00 +1000"
 Flashback 2018: The bad Guys,Flashback 2018: The bad Guys,David Donovan,"Tue, 07 Sep 2021 17:00:00 +1000"
 Scott Morrison has destroyed Australia's humanity,Scott Morrison has destroyed Australia's humanity,Rosalind Fuller,"Wed, 08 Sep 2021 12:00:00 +1000"
 The Liberal Government doesn't care if you die,The Liberal Government doesn't care if you die,Jennifer Wilson,"Tue, 07 Sep 2021 08:00:00 +1000"
 Government wants NBN Co to focus on the money,Government wants NBN Co to focus on the money,Paul Budde,"Wed, 08 Sep 2021 08:00:00 +1000"
 COVID-19 saving AAT from burgeoning backlogs,COVID-19 saving AAT from burgeoning backlogs,Abul Rizvi,"Tue, 07 Sep 2021 16:00:00 +1000"
 Clive Palmer's UAP membership may be an offer you can't refuse,Clive Palmer's UAP membership may be an offer you can't refuse,Ross Jones,"Mon, 06 Sep 2021 16:30:00 +1000"
" Afghanistan, ‘anarchy’ and confecting a China threat","Afghanistan, ‘anarchy’ and confecting a China threat",William Briggs,"Tue, 07 Sep 2021 12:00:00 +1000"
 Murdoch and the big Australian lie,Murdoch and the big Australian lie,David Donovan and Michelle Pini,"Thu, 02 Sep 2021 16:00:00 +1000"
 Media bias for Berejiklian and against Andrews is clear,Media bias for Berejiklian and against Andrews is clear,Victoria Fielding,"Mon, 06 Sep 2021 16:00:00 +1000"
 Gladys boasts about how her Government is teaching us to 'live with COVID',Gladys boasts about how her Government is teaching us to 'live with COVID',Rocky Dabscheck,"Mon, 06 Sep 2021 12:00:00 +1000"
 Frydenberg dubiously claims Australia’s lagging economy ‘leads the pack’,Frydenberg dubiously claims Australia’s lagging economy ‘leads the pack’,Alan Austin,"Mon, 06 Sep 2021 08:00:00 +1000"
 IA Book Club: The Shortest History of War,IA Book Club: The Shortest History of War,Jim Kable,"Sun, 05 Sep 2021 17:00:00 +1000"
" Fire, floods and felonies: Relocation the only option for Rohingya","Fire, floods and felonies: Relocation the only option for Rohingya",Habibur Rahman,"Sun, 05 Sep 2021 12:00:00 +1000"
 First Nations Voice to Parliament: It's time to rethink democracy,First Nations Voice to Parliament: It's time to rethink democracy,Matthew Butera,"Sun, 05 Sep 2021 09:00:00 +1000"
 Richard Pusey: The ‘most hated man in Australia’ walks free,Richard Pusey: The ‘most hated man in Australia’ walks free,Elroy Rosenberg,"Sat, 04 Sep 2021 12:00:00 +1000"
 Help is needed for culturally diverse communities during pandemic,Help is needed for culturally diverse communities during pandemic,Sabrin Farooqui,"Sat, 04 Sep 2021 16:00:00 +1000"
 Texas abortion laws: A modern Handmaid's Tale,Texas abortion laws: A modern Handmaid's Tale,George Grundy,"Sat, 04 Sep 2021 08:00:00 +1000"
 WHAT'S ON: Nine Perfect Strangers — the truth shall set you free,WHAT'S ON: Nine Perfect Strangers — the truth shall set you free,Dan Jensen,"Fri, 03 Sep 2021 16:00:00 +1000"
 Afghanistan is a warning of global denialism,Afghanistan is a warning of global denialism,Robert Niven,"Fri, 03 Sep 2021 12:00:00 +1000"
 CARTOONS: Mark David is making promises,CARTOONS: Mark David is making promises,Mark David,"Fri, 03 Sep 2021 10:00:00 +1000"
 Class action may reform laws for the 'forgotten children',Class action may reform laws for the 'forgotten children',Gerry Georgatos,"Fri, 03 Sep 2021 08:00:00 +1000"
" Coal in China: The good, the bad and the ugly","Coal in China: The good, the bad and the ugly",John Quiggin,"Thu, 02 Sep 2021 12:00:00 +1000"
 Home Affairs delays visa processing while applications drop,Home Affairs delays visa processing while applications drop,Lina Li,"Thu, 02 Sep 2021 08:00:00 +1000"
 Agriculture Visas: Modern slavery continues,Agriculture Visas: Modern slavery continues,Abul Rizvi,"Wed, 01 Sep 2021 16:00:00 +1000"
 New koala recovery plan is just more political spin,New koala recovery plan is just more political spin,Sue Arnold,"Wed, 01 Sep 2021 12:00:00 +1000"
 Government still holding Australia back in global broadband ranking,Government still holding Australia back in global broadband ranking,Paul Budde,"Wed, 01 Sep 2021 08:00:00 +1000"
 Uniform resource rent tax for a better future,Uniform resource rent tax for a better future,Emma Dawson,"Tue, 31 Aug 2021 16:00:00 +1000"
 Climate crisis putting a billion children at ‘extremely high risk’,Climate crisis putting a billion children at ‘extremely high risk’,Reynard Loki,"Tue, 31 Aug 2021 12:00:00 +1000"
 Ningaloo natural beauty under threat if Woodside has its way,Ningaloo natural beauty under threat if Woodside has its way,Corinna Elaine,"Sun, 29 Aug 2021 13:00:00 +1000"
 Clive Palmer’s campaign will have a body count,Clive Palmer’s campaign will have a body count,Andrew P Street,"Tue, 31 Aug 2021 08:00:00 +1000"
 Wren's Week: Government negligence is dooming our nation,Wren's Week: Government negligence is dooming our nation,John Wren,"Mon, 30 Aug 2021 16:00:00 +1000"
 Picnics for the rich and curfews for the poor,Picnics for the rich and curfews for the poor,Davey Heller,"Mon, 30 Aug 2021 12:00:00 +1000"
 Corrupting democracy — we need to say &quot;FIN&quot;,Corrupting democracy — we need to say &amp;quot;FIN&amp;quot;,Ross Jones,"Thu, 26 Aug 2021 12:00:00 +1000"
 Morrison Government sets records in economic mismanagement,Morrison Government sets records in economic mismanagement,Alan Austin,"Mon, 30 Aug 2021 08:00:00 +1000"
 Charlie Watts: Farewell to the gentleman drummer,Charlie Watts: Farewell to the gentleman drummer,Jenny LeComte,"Sun, 29 Aug 2021 17:00:00 +1000"
 Scott Morrison's political motives have turned against him,Scott Morrison's political motives have turned against him,Matthew Butera,"Sat, 10 Apr 2021 16:30:00 +1000"
 Palmer's propaganda fodder for far-Right rebellion,Palmer's propaganda fodder for far-Right rebellion,David Paull,"Sun, 29 Aug 2021 09:00:00 +1000"
 Government and media misinformation making the pandemic tougher,Government and media misinformation making the pandemic tougher,Joel Jenkins,"Sat, 28 Aug 2021 16:00:00 +1000"
 Australian business needs a more sophisticated COVID-19 relief program,Australian business needs a more sophisticated COVID-19 relief program,Tom McCarthy,"Sat, 28 Aug 2021 12:00:00 +1000"
 The unreality of anti-lockdown activism,The unreality of anti-lockdown activism,Tom Tanuki,"Sat, 28 Aug 2021 08:00:00 +1000"
 WHAT'S ON: Candyman — more than just a horror film,WHAT'S ON: Candyman — more than just a horror film,Dan Jensen,"Fri, 27 Aug 2021 16:00:00 +1000"
 Rapid testing and viral mapping can help beat COVID-19,Rapid testing and viral mapping can help beat COVID-19,Kim Sawyer,"Fri, 27 Aug 2021 12:00:00 +1000"
 CARTOONS: The four phases of Mark David,CARTOONS: The four phases of Mark David,Mark David,"Fri, 27 Aug 2021 10:00:00 +1000"
 Canada’s aggressive plans for immigration post-COVID-19,Canada’s aggressive plans for immigration post-COVID-19,Abul Rizvi,"Fri, 27 Aug 2021 08:00:00 +1000"
 JOHN PILGER: How the U.S. ruined Afghanistan playing the 'great game',JOHN PILGER: How the U.S. ruined Afghanistan playing the 'great game',John Pilger,"Thu, 26 Aug 2021 17:00:00 +1000"
 Biden's Summit for Democracy an opportunity to attack China,Biden's Summit for Democracy an opportunity to attack China,William Briggs,"Thu, 26 Aug 2021 16:00:00 +1000"
 The debate around Australia's nation-building Inland Rail project,The debate around Australia's nation-building Inland Rail project,Craig Minns,"Thu, 26 Aug 2021 08:00:00 +1000"
 Government downplays COVID-19 case numbers to open up sooner,Government downplays COVID-19 case numbers to open up sooner,Jennifer Wilson,"Wed, 25 Aug 2021 16:00:00 +1000"
" From vaccines to Afghanistan, Scotty does nothing","From vaccines to Afghanistan, Scotty does nothing",Michelle Pini,"Thu, 19 Aug 2021 12:00:00 +1000"
 Multiple match thrillers set the tone for footy finals,Multiple match thrillers set the tone for footy finals,Ronny Lerner,"Wed, 25 Aug 2021 10:30:00 +1000"
 Bloody Idiot of the Week — Episode 23: Morrison and Dutton fight to the death,Bloody Idiot of the Week — Episode 23: Morrison and Dutton fight to the death,Dan Jensen,"Wed, 25 Aug 2021 12:00:00 +1000"
 The economic triumph of the Afghanistan war,The economic triumph of the Afghanistan war,George Grundy,"Wed, 25 Aug 2021 12:00:00 +1000"
 Using satellites in the fight against COVID-19,Using satellites in the fight against COVID-19,Paul Budde,"Wed, 25 Aug 2021 08:00:00 +1000"
 Freedom protesters and Craig Kelly central to Morrison’s re-election plan,Freedom protesters and Craig Kelly central to Morrison’s re-election plan,Martin Hirst,"Tue, 24 Aug 2021 16:00:00 +1000"
 The debt Australia owes the people of Afghanistan,The debt Australia owes the people of Afghanistan,Rashad Seedeen,"Tue, 24 Aug 2021 12:00:00 +1000"
 Frydenberg's revolving door,Frydenberg's revolving door,Anthony Klan,"Tue, 24 Aug 2021 08:00:00 +1000"
" Killing competition and a Federal ICAC, courtesy of the Coalition","Killing competition and a Federal ICAC, courtesy of the Coalition",Ross Jones,"Mon, 23 Aug 2021 17:00:00 +1000"
 Scott Morrison shielded by Murdoch protection racket,Scott Morrison shielded by Murdoch protection racket,Victoria Fielding,"Mon, 23 Aug 2021 16:00:00 +1000"
 NSW inquiry fails to expose Coalition's disastrous COVID decision-making,NSW inquiry fails to expose Coalition's disastrous COVID decision-making,Steve Bishop,"Mon, 23 Aug 2021 12:00:00 +1000"
 Morrison delivers for foreign corporations: Lowest wage rise on record,Morrison delivers for foreign corporations: Lowest wage rise on record,Alan Austin,"Mon, 23 Aug 2021 08:00:00 +1000"
 Students stiffed as universities cut courses to save money,Students stiffed as universities cut courses to save money,Eleanor Beidatsch,"Sun, 22 Aug 2021 17:00:00 +1000"
 Conspiracy theories continue to spread during COVID-19,Conspiracy theories continue to spread during COVID-19,Bilal Cleland,"Sun, 22 Aug 2021 13:00:00 +1000"
 Media makes light of Taliban terror,Media makes light of Taliban terror,Hadi Zaher,"Sun, 22 Aug 2021 09:00:00 +1000"
 Government has drained ABC of objectivity,Government has drained ABC of objectivity,Joel Jenkins,"Sat, 21 Aug 2021 12:00:00 +1000"
 The alt-Right: An era of misinformation incorporated,The alt-Right: An era of misinformation incorporated,David Paull,"Sat, 21 Aug 2021 08:00:00 +1000"
 WHAT'S ON: Respect — find out what it means,WHAT'S ON: Respect — find out what it means,Dan Jensen,"Fri, 20 Aug 2021 17:30:00 +1000"
 Scott Morrison is no supporter of great causes or freedom,Scott Morrison is no supporter of great causes or freedom,Peter Henning,"Fri, 20 Aug 2021 12:00:00 +1000"
 CARTOONS: Mark David's COVID response,CARTOONS: Mark David's COVID response,Mark David,"Fri, 20 Aug 2021 10:00:00 +1000"
 Border Force Commissioner's decisions are above the law,Border Force Commissioner's decisions are above the law,Lina Li,"Fri, 20 Aug 2021 08:00:00 +1000"
 Labor to lose progressive identity with small-target policies,Labor to lose progressive identity with small-target policies,John Quiggin,"Thu, 19 Aug 2021 16:00:00 +1000"
 Afghan women fear for their rights and safety as Taliban reclaims power,Afghan women fear for their rights and safety as Taliban reclaims power,Johanna Higgs,"Thu, 19 Aug 2021 08:00:00 +1000"
 Teenager steps up as AGL board nominee,Teenager steps up as AGL board nominee,David Ritter,"Thu, 19 Aug 2021 15:00:00 +1000"
 Peta Credlin's political opinions are worthless,Peta Credlin's political opinions are worthless,Alan Austin,"Wed, 18 Aug 2021 16:00:00 +1000"
 Australia must offer permanent protection to Afghan refugees now,Australia must offer permanent protection to Afghan refugees now,Claire Higgins,"Wed, 18 Aug 2021 12:00:00 +1000"
 U.S. Government keeps fighting  to extradite Julian Assange,U.S. Government keeps fighting  to extradite Julian Assange,Binoy Kampmark,"Mon, 16 Aug 2021 12:00:00 +1000"
 NBN Co hits revenue target after constant downward revision,NBN Co hits revenue target after constant downward revision,Paul Budde,"Wed, 18 Aug 2021 08:00:00 +1000"
 Home Affairs: Making money while migrants miss out,Home Affairs: Making money while migrants miss out,Lina Li,"Sun, 15 Aug 2021 17:00:00 +1000"
 The unanswered questions surrounding 9/11,The unanswered questions surrounding 9/11,George Grundy,"Tue, 14 Sep 2021 16:00:00 +1000"
 Flashback 2013: Leigh Salesperson interviews Dr Craig Emerson on ABC $7.30,Flashback 2013: Leigh Salesperson interviews Dr Craig Emerson on ABC $7.30,David Donovan,"Wed, 15 Sep 2021 17:00:00 +1000"
 'Honest' Christian Porter's mystery donation is totally not suspicious,'Honest' Christian Porter's mystery donation is totally not suspicious,Andrew P Street,"Wed, 15 Sep 2021 16:00:00 +1000"
 Emma Raducanu's rise to fame highlights dangers of media scrutiny,Emma Raducanu's rise to fame highlights dangers of media scrutiny,Hsin-Yi Lo,"Wed, 15 Sep 2021 12:00:00 +1000"
 Autonomous vehicle services: The future has a long and winding road,Autonomous vehicle services: The future has a long and winding road,Paul Budde,"Wed, 15 Sep 2021 08:00:00 +1000"
" Sales, Gillard and the 'Left-leaning Twitter' bully","Sales, Gillard and the 'Left-leaning Twitter' bully",Michelle Pini,"Thu, 16 Sep 2021 07:30:00 +1000"
 Corporate 'greenwashing' a major obstacle in climate change fight,Corporate 'greenwashing' a major obstacle in climate change fight,David Ritter,"Thu, 16 Sep 2021 16:00:00 +1000"
 International doctors endure hardship in COVID Australia,International doctors endure hardship in COVID Australia,Habibur Rahman,"Thu, 16 Sep 2021 12:00:00 +1000"
 IA Book Club: Maria Taylor's 'Injustice',IA Book Club: Maria Taylor's 'Injustice',Revelly Robinson,"Fri, 17 Sep 2021 16:00:00 +1000"
 WHAT'S ON: Die in a Gunfight — zero bang for your buck,WHAT'S ON: Die in a Gunfight — zero bang for your buck,Dan Jensen,"Fri, 17 Sep 2021 17:00:00 +1000"
 Leigh Sales' bullying claims don't stack up,Leigh Sales' bullying claims don't stack up,Martin Hirst,"Fri, 17 Sep 2021 12:00:00 +1000"
 CARTOONS: Mark David leaves lockdown to the experts,CARTOONS: Mark David leaves lockdown to the experts,Mark David,"Fri, 17 Sep 2021 10:00:00 +1000"
 Nuclear white elephants: Australia’s new submarine deal,Nuclear white elephants: Australia’s new submarine deal,Binoy Kampmark,"Fri, 17 Sep 2021 08:00:00 +1000"
 Climate education is essential for a better future,Climate education is essential for a better future,Howard Morrison,"Sat, 18 Sep 2021 16:00:00 +1000"
 The Australian immigration prison system,The Australian immigration prison system,Lina Li,"Sat, 18 Sep 2021 12:00:00 +1000"
 Wren's Week: Gladys does the dash while Porter remains untouchable,Wren's Week: Gladys does the dash while Porter remains untouchable,John Wren,"Sat, 18 Sep 2021 08:00:00 +1000"
 IA Book Club: Long Half-life – The Nuclear Industry in Australia,IA Book Club: Long Half-life – The Nuclear Industry in Australia,Evan Jones,"Sun, 19 Sep 2021 13:00:00 +1000"
 Tudge sore over suggestion we question Anzac Day,Tudge sore over suggestion we question Anzac Day,Dechlan Brennan,"Sun, 19 Sep 2021 09:00:00 +1000"
" Leigh Sales, Twitter and the power of the mainstream media","Leigh Sales, Twitter and the power of the mainstream media",Victoria Fielding,"Mon, 20 Sep 2021 17:00:00 +1000"
 Submarine fiasco the latest in a long list of Coalition military failures,Submarine fiasco the latest in a long list of Coalition military failures,Alan Austin,"Mon, 20 Sep 2021 08:00:00 +1000"
 Temporary entrants in Australia: Who is left and what is to come,Temporary entrants in Australia: Who is left and what is to come,Abul Rizvi,"Mon, 20 Sep 2021 12:00:00 +1000"
 Nuclear sub plan sees Australia’s reputation take a dive,Nuclear sub plan sees Australia’s reputation take a dive,Dave Sweeney,"Mon, 20 Sep 2021 16:00:00 +1000"
 Flashback 2019: Like a fish out of water: Australia's submarine project is a flop,Flashback 2019: Like a fish out of water: Australia's submarine project is a flop,Binoy Kampmark,"Tue, 21 Sep 2021 17:00:00 +1000"
 Morrison Government setting Australia backward in women's rights,Morrison Government setting Australia backward in women's rights,Graham Perrett,"Tue, 21 Sep 2021 16:00:00 +1000"
 China and how America lost peer competition,China and how America lost peer competition,William Briggs,"Tue, 21 Sep 2021 12:00:00 +1000"
 Scott Morrison's devolution of democracy,Scott Morrison's devolution of democracy,Jennifer Wilson,"Tue, 21 Sep 2021 08:00:00 +1000"
 Bad politics and the death of tax reform,Bad politics and the death of tax reform,Ross Stitt,"Wed, 22 Sep 2021 16:00:00 +1000"
 Morrison Government re-election would be an environmental catastrophe,Morrison Government re-election would be an environmental catastrophe,Sue Arnold,"Wed, 22 Sep 2021 12:00:00 +1000"
 Unveiling T25: Telstra’s vision of its future,Unveiling T25: Telstra’s vision of its future,Paul Budde,"Wed, 22 Sep 2021 08:00:00 +1000"
 EDITORIAL: Christian Porter’s dark blind trust: Nothing to see here!,EDITORIAL: Christian Porter’s dark blind trust: Nothing to see here!,Michelle Pini,"Wed, 22 Sep 2021 18:30:00 +1000"
 Christian Porter’s dark blind trust: Nothing to see here!,Christian Porter’s dark blind trust: Nothing to see here!,Michelle Pini,"Thu, 23 Sep 2021 07:30:00 +1000"
 Melbourne anti-lockdown protests are a disorganised mess,Melbourne anti-lockdown protests are a disorganised mess,Tom Tanuki,"Thu, 23 Sep 2021 16:00:00 +1000"
 Bulldogs in the way of Demons ending curse,Bulldogs in the way of Demons ending curse,Ronny Lerner,"Thu, 23 Sep 2021 14:00:00 +1000"
 'Sub-standard': Submarine deal botched by Morrison and his cronies,'Sub-standard': Submarine deal botched by Morrison and his cronies,George Grundy,"Thu, 23 Sep 2021 12:00:00 +1000"
 Morrison Government sends Australia backward in women's rights,Morrison Government sends Australia backward in women's rights,Graham Perrett,"Tue, 21 Sep 2021 16:00:00 +1000"
 WHAT'S ON: Joe Bell — the long road to redemption,WHAT'S ON: Joe Bell — the long road to redemption,Dan Jensen,"Fri, 24 Sep 2021 16:00:00 +1000"
 Bridging visa boom sparks audit request,Bridging visa boom sparks audit request,Lina Li,"Fri, 24 Sep 2021 12:00:00 +1000"
 CARTOONS: Mark David goes 'sub-terranean',CARTOONS: Mark David goes 'sub-terranean',Mark David,"Fri, 24 Sep 2021 10:00:00 +1000"
" Frydenberg ignored advice on JobKeeper design flaw, Liberal member claims","Frydenberg ignored advice on JobKeeper design flaw, Liberal member claims",Hayden O'Connor,"Fri, 24 Sep 2021 08:00:00 +1000"
 Government needs to rethink its COVID-19 strategy,Government needs to rethink its COVID-19 strategy,Ted Christie,"Sat, 25 Sep 2021 12:00:00 +1000"
" Melbourne earthquake: Shaken, not stirred","Melbourne earthquake: Shaken, not stirred",Binoy Kampmark,"Sat, 25 Sep 2021 08:00:00 +1000"
 Morrison's 'sub-par' performance tanks Australia's national identity,Morrison's 'sub-par' performance tanks Australia's national identity,Peter Henning,"Sun, 26 Sep 2021 17:00:00 +1000"
 The value of a degrowth economy: Our planet would be richer for it,The value of a degrowth economy: Our planet would be richer for it,Erin Remblance,"Sun, 26 Sep 2021 13:00:00 +1000"
 U.S.-China talk could torpedo climate conference,U.S.-China talk could torpedo climate conference,Graeme McLeay,"Sun, 26 Sep 2021 09:00:00 +1000"
 Scott Morrison: What the bloody hell are you doing,Scott Morrison: What the bloody hell are you doing,Paul Begley,"Mon, 27 Sep 2021 16:00:00 +1000"
 The disadvantaged face the brunt of COVID-related hardship,The disadvantaged face the brunt of COVID-related hardship,Duncan Storrar,"Mon, 27 Sep 2021 12:00:00 +1000"
 Morrison and Frydenberg set multiple 'all-time worst' records on jobs,Morrison and Frydenberg set multiple 'all-time worst' records on jobs,Alan Austin,"Mon, 27 Sep 2021 08:00:00 +1000"
" Scott Morrison, what the bloody hell are you doing?","Scott Morrison, what the bloody hell are you doing?",Paul Begley,"Mon, 27 Sep 2021 16:00:00 +1000"
 National Party’s emission plan: No coal executive left behind,National Party’s emission plan: No coal executive left behind,Andrew P Street,"Tue, 28 Sep 2021 16:00:00 +1000"
 Mainstream media no friend to The New Liberals,Mainstream media no friend to The New Liberals,Victor Kline,"Tue, 28 Sep 2021 12:00:00 +1000"
 Outcome of 2020-21 Migration Program: Alex Hawke panics on immigration,Outcome of 2020-21 Migration Program: Alex Hawke panics on immigration,Abul Rizvi,"Tue, 28 Sep 2021 08:00:00 +1000"
 China makes progress in fight against climate change,China makes progress in fight against climate change,John Quiggin,"Wed, 29 Sep 2021 16:00:00 +1000"
 Flashback 2016: The conventional wisdom: Jeremy Corbyn and the ABC,Flashback 2016: The conventional wisdom: Jeremy Corbyn and the ABC,David Donovan,"Wed, 29 Sep 2021 17:00:00 +1000"
 Government's climate change web of lies,Government's climate change web of lies,Sue Arnold,"Wed, 29 Sep 2021 12:00:00 +1000"
 Artificial intelligence to better understand our world,Artificial intelligence to better understand our world,Paul Budde,"Wed, 29 Sep 2021 08:00:00 +1000"
 Morrison Government aspires to net zero — on climate action,Morrison Government aspires to net zero — on climate action,Michelle Pini,"Thu, 30 Sep 2021 08:00:00 +1000"
 WHAT'S ON: Squid Game — Netflix and kill,WHAT'S ON: Squid Game — Netflix and kill,Dan Jensen,"Thu, 30 Sep 2021 17:00:00 +1000"
 Australia's approval of gas projects lighting climate change fires,Australia's approval of gas projects lighting climate change fires,David Shearman,"Thu, 30 Sep 2021 12:00:00 +1000"
 Uncertainty looms for offshore visa holders,Uncertainty looms for offshore visa holders,Lina Li,"Thu, 30 Sep 2021 16:00:00 +1000"
 World Bank solution to Rohingya crisis comes with limitations,World Bank solution to Rohingya crisis comes with limitations,Kazi Jamshed,"Fri, 01 Oct 2021 17:00:00 +1000"
 BOOK REVIEW: The Accidental Prime Minister by Annika Smethurst,BOOK REVIEW: The Accidental Prime Minister by Annika Smethurst,Stephen Saunders,"Fri, 01 Oct 2021 16:00:00 +1000"
